username,time,tweet
HealYourSecret,Thu Sep 01 05:29:55 IST 2011,I change myself I change world Gloria Anzaldua
HealYourSecret,Thu Sep 01 04:12:26 IST 2011,Your life better chance gets better change Jim Rohn
HealYourSecret,Thu Sep 01 02:56:18 IST 2011,Realize deeply present moment Eckhart Tolle
HealYourSecret,Thu Sep 01 01:42:05 IST 2011,Be This first step toward becoming better JC Hare AW Hare
HealYourSecret,Thu Sep 01 00:26:04 IST 2011,Don’t past steal presentCherralea Morgen
HealYourSecret,Thu Sep 01 00:08:15 IST 2011,Wisdom la Carte Are You “In-Power-Meant” - By Janus Moncur So many fall daily lives – meani 
HealYourSecret,Wed Aug 31 23:11:43 IST 2011,I knew life began I stood dark  looking out light  Yusef Komunyakaa
HealYourSecret,Wed Aug 31 21:54:51 IST 2011,You’re braver believe stronger seem smarter think AA Milne
HealYourSecret,Wed Aug 31 20:39:37 IST 2011,Everything flowers within Galway Kinnell
HealYourSecret,Wed Aug 31 19:20:48 IST 2011,Others stop temporarily – one permanently Zig Ziglar
HealYourSecret,Wed Aug 31 18:03:11 IST 2011,When Im trusting being myselfeverything life reflects falling place easily miraculously Shakti Gawain
HealYourSecret,Wed Aug 31 16:44:45 IST 2011,The effective way transform higher consciousness pay attention present moment Deepak Chopra
HealYourSecret,Wed Aug 31 15:27:09 IST 2011,It attitude aptitude determines altitude Zig Ziglar
HealYourSecret,Wed Aug 31 11:54:35 IST 2011,RT  Intuition Manifestation - What difference relationship between intuiting something 
HealYourSecret,Wed Aug 31 02:52:17 IST 2011,Courage takes stand up speak courage takes sit down listen Winston Churchill
HealYourSecret,Wed Aug 31 01:37:17 IST 2011,Faith taking first step even don’t see whole staircase Martin Luther King Jr
HealYourSecret,Wed Aug 31 00:20:48 IST 2011,When move beyond fear feel free Spencer Johnson
HealYourSecret,Wed Aug 31 00:09:23 IST 2011,Wisdom la Carte Abundance Beauty Waiting You 
HealYourSecret,Tue Aug 30 23:59:22 IST 2011,RT  Daily Inspiration - Today take task changing emotional tone life wherever 
HealYourSecret,Tue Aug 30 23:03:48 IST 2011,I special talents I passionately curious Albert Einstein
HealYourSecret,Tue Aug 30 21:47:16 IST 2011,We repeatedly excellence act habit  Aristotle
HealYourSecret,Tue Aug 30 20:31:41 IST 2011,Don’t past steal present Cherralea Morgen
HealYourSecret,Tue Aug 30 19:18:15 IST 2011,Life limitations except ones make Les Brown
HealYourSecret,Tue Aug 30 18:03:30 IST 2011,Argue limitations sure enough they’re yours Richard Bach
HealYourSecret,Tue Aug 30 16:47:35 IST 2011,The person something impossible interrupt person doing Chinese proverb
HealYourSecret,Tue Aug 30 15:28:17 IST 2011,We need magic transform world We carry power need inside ourselves already JK Rowling
HealYourSecret,Tue Aug 30 14:11:52 IST 2011,Be first rate version yourself second rate version someone Judy Garland
HealYourSecret,Tue Aug 30 12:55:15 IST 2011,You’re braver believe stronger seem smarter think AA Milne
HealYourSecret,Tue Aug 30 11:54:22 IST 2011,RT  Meditation Breath - Hi I started meditating night before I go sleep Now jus 
HealYourSecret,Tue Aug 30 09:01:36 IST 2011,RT  Family Dilemma - I’m  in  deep  problem   please  help    I’m 26 yrs old    is pr 
HealYourSecret,Tue Aug 30 06:08:47 IST 2011,Wisdom la Carte How Be Yourself Your Business Personal Life 
HealYourSecret,Tue Aug 30 02:54:50 IST 2011,My future depends mostly myself Paul Robeson
HealYourSecret,Tue Aug 30 01:30:57 IST 2011,As specific clear pure intention clear result brought back  Deepak Chopra
HealYourSecret,Tue Aug 30 00:18:07 IST 2011,We need magic transform world We carry power need inside ourselves already JK Rowling
HealYourSecret,Tue Aug 30 00:05:40 IST 2011,Wisdom la Carte Ways Be Unique - By Vincent Alston Never compare yourself anyone You I indivi 
HealYourSecret,Mon Aug 29 23:57:45 IST 2011,RT  Deepak Homebase - September 12 – Russell Simmons – Hip hop tool prevent violence Inner  
HealYourSecret,Mon Aug 29 23:00:14 IST 2011,That happiness dissolved something complete great Willa Cather
HealYourSecret,Mon Aug 29 21:41:57 IST 2011,Ones destination never place new way looking things Henry Miller
HealYourSecret,Mon Aug 29 20:57:19 IST 2011,RT  Weekly Health Tip Understanding Coping Nicotine Withdrawal 
HealYourSecret,Mon Aug 29 20:27:47 IST 2011,I change myself I change world Gloria Anzaldua
HealYourSecret,Mon Aug 29 19:14:37 IST 2011,Your life better chance gets better change Jim Rohn
HealYourSecret,Mon Aug 29 17:57:14 IST 2011,Realize deeply present moment Eckhart Tolle
HealYourSecret,Mon Aug 29 16:40:28 IST 2011,Be This first step toward becoming better JC Hare AW Hare
HealYourSecret,Mon Aug 29 15:21:43 IST 2011,Don’t past steal presentCherralea Morgen
HealYourSecret,Mon Aug 29 14:02:43 IST 2011,I knew life began I stood dark  looking out light  Yusef Komunyakaa
HealYourSecret,Mon Aug 29 11:53:45 IST 2011,RT  In 2012 issue wont economy 
HealYourSecret,Mon Aug 29 03:30:18 IST 2011,RT  The person removes mountain begins carrying away small stones — Chinese proverb
HealYourSecret,Mon Aug 29 03:07:33 IST 2011,You’re braver believe stronger seem smarter think AA Milne
HealYourSecret,Mon Aug 29 01:54:15 IST 2011,Everything flowers within Galway Kinnell
HealYourSecret,Mon Aug 29 00:38:04 IST 2011,Others stop temporarily – one permanently Zig Ziglar
