username,time,tweet
smsailor_,Tue Mar 01 05:29:37 IST 2016,Are following Snapchat hootsuite Get behind-the-scenes look happening nest  
smsailor_,Tue Mar 01 05:28:37 IST 2016,How GoPro contentmarketing thatll make Wow  
smsailor_,Tue Mar 01 05:14:45 IST 2016,Can solve emojiriddle Hint TV Show |👩🏻👩🏼👩🏼👦🏻👦🏻👦🏻🗽☕️
smsailor_,Tue Mar 01 04:59:33 IST 2016,How social media education empowers next generation marketers  
smsailor_,Tue Mar 01 04:13:29 IST 2016,GORETEXna pioneered performance outdoor gear now branded adventure magazines  
smsailor_,Tue Mar 01 03:29:25 IST 2016,3 insights advocate marketing start  
smsailor_,Tue Mar 01 03:28:29 IST 2016,Venture capital firm firstround 9 magazines Heres  
smsailor_,Tue Mar 01 02:59:40 IST 2016,Be person shares awesome gifs A guide everything gifs  
smsailor_,Tue Mar 01 02:29:42 IST 2016,YouTube new tool blurring moving objects  via mashable ChoiceContent 
smsailor_,Tue Mar 01 02:13:38 IST 2016,Content Sutra Ep 7 BrennerMichael Future ContentMarketing  
smsailor_,Tue Mar 01 02:13:37 IST 2016,BradTonoff Keep eyes peeled invite week 👀
smsailor_,Tue Mar 01 02:05:12 IST 2016,Snapchat featured behind-the-scenes Oscars coverage web 
smsailor_,Tue Mar 01 01:59:38 IST 2016,Create images social media 15 reliable resources  
smsailor_,Tue Mar 01 00:59:32 IST 2016,Keywords monitoring social media protect brand  
smsailor_,Tue Mar 01 00:49:32 IST 2016,Pinterest Roulette I tried use social network outfit inspiration  
smsailor_,Tue Mar 01 00:19:55 IST 2016,How exclamation points help score date 
smsailor_,Tue Mar 01 00:13:37 IST 2016,The marketing strategy each presidential campaign analyzed swag  
smsailor_,Mon Feb 29 23:59:43 IST 2016,Writing resources heavy week content  
smsailor_,Mon Feb 29 23:43:44 IST 2016,RT Cerosdotcom Join RaptMedia contently  Cerosdotcom talk InteractiveContent RSVP … 
smsailor_,Mon Feb 29 23:14:03 IST 2016,For worlds largest retailer reaching right audience harder expected  
smsailor_,Mon Feb 29 22:59:55 IST 2016,Have tweeted customer service complaint Those days over  
smsailor_,Mon Feb 29 22:04:49 IST 2016,Mark Zuckerberg sets record straight Orwellian pic VR army  
smsailor_,Mon Feb 29 21:59:26 IST 2016,The beginner’s guide social media metrics  
smsailor_,Mon Feb 29 21:58:37 IST 2016,Infographic How Best Brands Use Snapchat  
smsailor_,Mon Feb 29 20:59:39 IST 2016,Becoming entrepreneur risky thought  Entrepreneur 
smsailor_,Mon Feb 29 20:49:52 IST 2016,Snapchat apologizes employee payroll data leak phishing attack 
smsailor_,Mon Feb 29 20:30:11 IST 2016,Social media news need know  February 2016 roundup 
smsailor_,Mon Feb 29 20:13:58 IST 2016,Video How ContentMarketing ROI Works  
smsailor_,Mon Feb 29 19:59:35 IST 2016,Every social team different certain roles need successful  
smsailor_,Mon Feb 29 18:58:34 IST 2016,Print magazines making comeback—thanks ambitious brands  
smsailor_,Mon Feb 29 17:59:26 IST 2016,3 reasons CEO can’t afford NOT social  via FastCompany ChoiceContent 
smsailor_,Mon Feb 29 17:58:32 IST 2016,The Most Interesting Influencer World  
smsailor_,Mon Feb 29 16:58:36 IST 2016,Successful brand editors know good content isnt glorified marketing copy  
smsailor_,Mon Feb 29 15:59:50 IST 2016,How Facebook make smarter Just look 16 accounts  
smsailor_,Mon Feb 29 15:43:27 IST 2016,SumoMes Genius Tool Could Give You Tons Free Traffic  
smsailor_,Mon Feb 29 14:43:26 IST 2016,The Big Reason It Might Be Time Quit Your Job  
smsailor_,Mon Feb 29 14:29:29 IST 2016,Why Facebook’s latest move survival tip  invoker LinkedInPulse 
smsailor_,Mon Feb 29 13:59:33 IST 2016,11 ways use social data prove ROI social media efforts  
smsailor_,Mon Feb 29 13:43:57 IST 2016,Everything wanted know contentmarketing  
smsailor_,Mon Feb 29 12:59:26 IST 2016,How keep up trends using Twitter business  
smsailor_,Mon Feb 29 12:43:34 IST 2016,How Uber  Airbnb  buffer use contentmarketing drive crazy growth  
smsailor_,Mon Feb 29 10:59:38 IST 2016,How keep branding consistent social  via Inc ChoiceContent 
smsailor_,Mon Feb 29 10:13:39 IST 2016,Youll never think sticky content same way again  
smsailor_,Mon Feb 29 09:29:25 IST 2016,Social ROI toolkit  Strategies measuring improving social ROI 
smsailor_,Mon Feb 29 08:59:52 IST 2016,9 social media etiquette rules EVERYONE know  
smsailor_,Mon Feb 29 08:28:42 IST 2016,The Real Problem With Contextualized Marketing  
smsailor_,Mon Feb 29 07:29:24 IST 2016,Still convinced value social ads  Give try beginners guide 
smsailor_,Mon Feb 29 07:01:19 IST 2016,What social media doing brains A lot  
smsailor_,Mon Feb 29 06:41:36 IST 2016,What happened Abercrombies risky contentmarketing  
smsailor_,Mon Feb 29 04:57:31 IST 2016,Fallen Facebook Like rut Heres out  
