username,time,tweet
HanzStickyhoove,Tue Mar 01 05:29:50 IST 2016,Pegasus Fantasy- dream everyone dreams Spread wing called Freedom run away run awaaaaaaay
HanzStickyhoove,Tue Mar 01 05:07:46 IST 2016,Yes left out protect love lost sight tomorrow Aiiiiii Wo Torimodose
HanzStickyhoove,Tue Mar 01 05:06:59 IST 2016,Oh left out protect love lost sight tomorrow I dont wanna see face forgotten smile
HanzStickyhoove,Tue Mar 01 05:06:03 IST 2016,It now bury everything splatter everywhere saaaaame
HanzStickyhoove,Tue Mar 01 05:05:23 IST 2016,My lost heart longing burning hot right noooow Oh burning
HanzStickyhoove,Tue Mar 01 05:03:26 IST 2016,YOU ARE SHOCK - heartbeat racing always races sweet love YOU ARE SHOCK- A heartbeat chasing now chaaaaasing love
HanzStickyhoove,Tue Mar 01 05:00:50 IST 2016,Oh left now protect love find way back home tomorrow Ai Wo Torimodose
HanzStickyhoove,Tue Mar 01 04:58:47 IST 2016,Oh left now protect love find way back home tomorrow I dont wanna see face forgotten smile
HanzStickyhoove,Tue Mar 01 04:57:39 IST 2016,Even try tie burning heart up chain use nowAnyone gets way fall one touch finger
HanzStickyhoove,Tue Mar 01 04:56:36 IST 2016,YOU ARE SHOCK  - The sky falling power love YOU ARE SHOCK - now falling opened heart
HanzStickyhoove,Tue Mar 01 04:31:09 IST 2016,Jazz Swing music great But I find hilarious nobody family stand One actually prefers Brittany Spears xD
HanzStickyhoove,Mon Feb 29 06:25:06 IST 2016,Played first game DD tonight lot fun Kinda funny I non-human elf tank
HanzStickyhoove,Mon Feb 29 00:04:06 IST 2016,My favorite part WeBareBears nobody seems notice/care bears people xD
HanzStickyhoove,Sun Feb 28 23:16:16 IST 2016,Dont peeps bitching Mussolini  mans country invented first publicly known Jet Fighter world
HanzStickyhoove,Sun Feb 28 23:01:46 IST 2016,No idea fuck ripkeith supposed I assumed  died something Now actually shame
HanzStickyhoove,Sun Feb 28 01:38:37 IST 2016,RT  
HanzStickyhoove,Sun Feb 28 00:11:15 IST 2016,I cooked baby fed vegetables asked master xD
HanzStickyhoove,Sat Feb 27 02:57:27 IST 2016,I dont understand furries When I kid I wanted astronaut I didnt dress up astronaut fuck others costume xD
HanzStickyhoove,Sat Feb 27 00:15:02 IST 2016,I remember Tank Girl being great movie chance horribly wrong I need see again sometime
HanzStickyhoove,Fri Feb 26 11:06:14 IST 2016,That old bitch Jack The Ripper right xD
HanzStickyhoove,Fri Feb 26 04:39:32 IST 2016,Ive never hated videogame boss more I hate Gafgarion Ive never managed beat without cheating 
HanzStickyhoove,Thu Feb 25 04:35:54 IST 2016,The Gameboy Advance best soundchip made man I want make love sexy soundchip
HanzStickyhoove,Thu Feb 25 02:54:30 IST 2016,You shoot boltgun roll 1-3 I stay adorable 3
HanzStickyhoove,Thu Feb 25 02:50:50 IST 2016,Email Twitter Hanz Stickyhooves whats happening world  Good damn question Twitter xD
HanzStickyhoove,Thu Feb 25 02:16:33 IST 2016,I dont Ebay feedback thing buyers Its choose buys product buyer pay
HanzStickyhoove,Wed Feb 24 11:46:51 IST 2016,Im really out loop I heard HD remake Zelda Twilight Princess thought Isnt recent Zelda game anyways
HanzStickyhoove,Wed Feb 24 08:25:02 IST 2016,I managed resist buying FF9 well though Ill buy later comes out PC
HanzStickyhoove,Wed Feb 24 08:24:31 IST 2016,The answer earlier todays How Long till I break down order Legend Dragoon question 8 hours
HanzStickyhoove,Wed Feb 24 00:53:43 IST 2016,Time take bets long until I fold under pressure buy certain PS1 game Ive eye
HanzStickyhoove,Tue Feb 23 04:05:53 IST 2016,Would hilarious troll flag take WW2 reenactments
HanzStickyhoove,Tue Feb 23 04:04:15 IST 2016,Part buy modern videogame version Nazi Kriegsmarine flag Its same normal giant black x
HanzStickyhoove,Tue Feb 23 02:07:03 IST 2016,Japans airforce unfairly misrepresented videogames They lot really badass planes werent Zeros Like Ki49
HanzStickyhoove,Tue Feb 23 01:11:18 IST 2016,In under 30 days I played two major hentai games used music Chrono Cross I know best RPG god damn guys
HanzStickyhoove,Mon Feb 22 11:16:46 IST 2016,Im really really planes Applekraut really really likes tanks We need find guy really boats trifecta
HanzStickyhoove,Mon Feb 22 04:24:28 IST 2016,Yep beat Resident Evil 5 official thats favorite Resident Evil game Its incredible
HanzStickyhoove,Mon Feb 22 00:29:17 IST 2016,The Heinkel 177 bomber frequently puncture oil container setting whole plane fire mid-flight
HanzStickyhoove,Mon Feb 22 00:25:32 IST 2016,The Focke-Wulf 200 Condor German heavy bomber frequently wings ripped upon landing problem never fixed
HanzStickyhoove,Mon Feb 22 00:23:34 IST 2016,I love WW2 planes reading Luftwaffe used makes want punch Goering The Luftwaffe fucking idiots
HanzStickyhoove,Mon Feb 22 00:00:51 IST 2016,Operation Barbarossa 800000 german military casualties 4000000 Soviet military casualties Decisive Soviet Victory xD
HanzStickyhoove,Sun Feb 21 23:56:15 IST 2016,February 21st 1942 Barbarosa war ants already begun I gassed scouts horde still come
HanzStickyhoove,Sun Feb 21 12:43:06 IST 2016,Youtube put 20 minute ad garage doors video I watching I watched whole damn thing Ive never garage life
HanzStickyhoove,Sun Feb 21 12:17:56 IST 2016,Part really fursuit made part Where even wear Since I dont local fur friends
HanzStickyhoove,Sun Feb 21 11:14:59 IST 2016,COOOOOOOOOOOOOOOOOOOOOOOOOOOOOOOOOOOOOOOOOOMMMMMMMMMMMMMMMMMMMMMMMMMMMMMMMMBBBBBBBBBBBBBBBBBBBBBBBBBBBBBBBBBBOOOOOOOOOOOOOOOOOOOOOO
HanzStickyhoove,Sun Feb 21 11:14:43 IST 2016,Clears throat  ahem UUUUUUUUUULLLLLLLLLLLLLLLLLLLLLLLLLLLLLLLLLLLLLLLLLLLLLLLLLLLLTTTTTTTTTTTTTTTTTTTRRRRRRRRRRRRRRRRAAAAAAAAAAAAA
HanzStickyhoove,Sun Feb 21 07:39:57 IST 2016,Robot Alchemic Drive fuckin incredible Only game character told something clueless thing
HanzStickyhoove,Sun Feb 21 04:13:17 IST 2016,Dunno WTF happened OBS started livestreaming I listening music Sorry anyone saw xD
HanzStickyhoove,Sun Feb 21 03:16:33 IST 2016, Cant remember random peeps submit writings games Wanna try writing something Embry P
HanzStickyhoove,Sun Feb 21 03:04:11 IST 2016,Imma boy I want play submissive wussy guy gets raped lot both genders-Hanz describing ideal hentai game   P
HanzStickyhoove,Sun Feb 21 02:56:34 IST 2016,Laughing way hard xD 
HanzStickyhoove,Sun Feb 21 00:33:51 IST 2016,We real genius over here 
