username,time,tweet
katmac95,Tue Mar 01 05:29:50 IST 2016,I dont think society take enough opportunities appreciate actually truly content But today Im happy
katmac95,Tue Mar 01 05:20:16 IST 2016,RT  Just chocolate dinner Yup 💚
katmac95,Tue Mar 01 04:04:19 IST 2016,What mean I need new socks 
katmac95,Tue Mar 01 02:59:55 IST 2016,Idk I watch con want wish   congrats 100 advance
katmac95,Tue Mar 01 02:51:35 IST 2016,Im excited OUAT myself I excited see cast again people happy comes back 
katmac95,Mon Feb 29 21:34:19 IST 2016,RT  Always 💔 Oscars 
katmac95,Mon Feb 29 21:19:33 IST 2016,RT SepticEye The Irish sure know name drinks 
katmac95,Mon Feb 29 21:17:57 IST 2016,RT  6 days go OnceUponaTime 
katmac95,Mon Feb 29 10:48:14 IST 2016,RT  
katmac95,Mon Feb 29 10:48:07 IST 2016,RT  KATE IS ALL OF US 
katmac95,Mon Feb 29 10:47:33 IST 2016,RT  sad loss meme community
katmac95,Sun Feb 28 23:47:50 IST 2016,Why dont coffee places make ice OUT OF COFFEE No more watery coffee hot days   take note
katmac95,Sun Feb 28 21:52:11 IST 2016, Im proud 😊
katmac95,Sun Feb 28 21:48:27 IST 2016, 
katmac95,Sun Feb 28 11:50:09 IST 2016,I ready wisdom tooth removed Its gonna hurt Im gonna die life gonna awful
katmac95,Sun Feb 28 11:37:17 IST 2016, I know I cant even complain But still nobody spoil
katmac95,Sun Feb 28 10:24:52 IST 2016,  
katmac95,Sun Feb 28 10:23:55 IST 2016, Ill Vancouver con I wont access tv But plus side Ill Vancouver con lol
katmac95,Sun Feb 28 07:57:53 IST 2016,Should money go vidding computer proper video camera convention stuff dies I bad decisions
katmac95,Sun Feb 28 07:53:19 IST 2016, 
katmac95,Sun Feb 28 07:49:03 IST 2016, I survive starts playing distance What champ coming back soon cliff diving accident
katmac95,Sun Feb 28 07:47:54 IST 2016, Pilot 
katmac95,Sat Feb 27 13:07:22 IST 2016,  Im sorry guys past relationship under microscope / That doesnt seem fair
katmac95,Sat Feb 27 11:12:21 IST 2016,Doing Khan Academy I retake math placement test I really want done
katmac95,Sat Feb 27 11:00:39 IST 2016, In vid youre CSUN grad Its short list transfer CTVA program D How time
katmac95,Sat Feb 27 03:47:11 IST 2016,RT  When shade thrown Olsen twins 3 minutes first episode FullerHouse 😂😂 
katmac95,Sat Feb 27 03:46:14 IST 2016,Been watching fullerhouse Netflix day cute 😊💟
katmac95,Sat Feb 27 03:45:46 IST 2016,RT  Everywhere You Look Fuller House now streaming Netflix
katmac95,Fri Feb 26 21:56:30 IST 2016, snaps fingers vigorously agreement Its getting ridiculous I saw video blocked HUMMING part tswift song 😟
katmac95,Fri Feb 26 21:54:44 IST 2016,RT  Time make video fair use wtfu makeyoutubegreatagain
katmac95,Fri Feb 26 21:51:58 IST 2016,RT  yes want desperately  
katmac95,Fri Feb 26 09:20:38 IST 2016,RT  The upstairs neighbors chanting last hour Honestly guys trying summon Satan hed by…
katmac95,Fri Feb 26 09:17:19 IST 2016,RT  Dont EVER hit head brick brain disabled -Markimom
katmac95,Thu Feb 25 12:01:34 IST 2016,Aww precious meow- meow boy 
katmac95,Thu Feb 25 10:31:30 IST 2016,rowling normal ugly cry over story Because well Im mine
katmac95,Wed Feb 24 09:40:33 IST 2016,Its awful attack writers Ill honest I really havent liked season 5 ALL far show Be respectful
katmac95,Wed Feb 24 09:38:10 IST 2016,Every OUAT interview everJen eloquent long beautiful responseColin Yup That
katmac95,Wed Feb 24 09:22:49 IST 2016,I barely know Im already convinced come 10000 tons added drama
katmac95,Wed Feb 24 04:32:24 IST 2016,The more I hear 100th more Im convinced huge disappointment Oh well
katmac95,Tue Feb 23 10:32:33 IST 2016,I very angry thexfilesfinale
katmac95,Tue Feb 23 03:31:56 IST 2016,Wtf somebody actually post tumblr telling people buy charity shirt bc I ship CS If thats true I give up 😕
katmac95,Tue Feb 23 03:30:54 IST 2016,   good job fandom ❤
katmac95,Sun Feb 21 21:26:31 IST 2016,RT  happy 100 episodes  OnceTurns100
katmac95,Sun Feb 21 21:17:27 IST 2016, awesome
katmac95,Sun Feb 21 01:47:53 IST 2016,Mark y dis- Chica probably  markiplier charitylivestream 
katmac95,Sun Feb 21 00:14:15 IST 2016,HAPPY 100th OUAT onceturns100 oncertothecore 
katmac95,Sat Feb 20 23:22:06 IST 2016, Im serious being allergic fruit I ingest computers That expensive diet Im poor
katmac95,Sat Feb 20 23:19:32 IST 2016, Im allergic apples I eat Windows- based systems But really I allergic fruit  
katmac95,Sat Feb 20 23:18:00 IST 2016,  July 23rd btw Which national hot dog day ice cream cone day 3
katmac95,Sat Feb 20 23:12:08 IST 2016,Sad I cant afford SDCC2016 ON 21st birthday  SDCCOR I wanted see  panel 
