username,time,tweet
MindsetMotivate,Thu Sep 01 05:29:48 IST 2011,The illiterate 21st century b those cant read  write those learn unlearn  relearn - Alvin Toffler
MindsetMotivate,Thu Sep 01 04:17:50 IST 2011,Nothing gives 1 person much advantage over another 2 remain always cool  unruffled under circumstances - Thomas Jefferson
MindsetMotivate,Thu Sep 01 03:23:48 IST 2011,A primary method gaining mind full peace practice emptying mind -  Napoleon Hill
MindsetMotivate,Thu Sep 01 02:24:19 IST 2011,Id regret things Ive done regret things I havent done- Lucille Ball
MindsetMotivate,Thu Sep 01 00:52:40 IST 2011,Maybe doesnt matter road embark Maybe matters embark - Barbara Hall
MindsetMotivate,Wed Aug 31 22:35:55 IST 2011,Be life long short completeness depends lived for- David Starr Jordan
MindsetMotivate,Wed Aug 31 22:00:58 IST 2011,I dont know grandfather I much more concerned know grandson - Abraham Lincoln
MindsetMotivate,Wed Aug 31 21:39:48 IST 2011,Never doubt small group thoughtful committed people change world Indeed thing - Margaret Meade
MindsetMotivate,Wed Aug 31 21:11:20 IST 2011,Time free priceless You cant use You cant keep spend - Harvey MacKay
MindsetMotivate,Wed Aug 31 20:31:20 IST 2011,Nobody go back start new beginning anyone start today make new ending - Maria Robinson
MindsetMotivate,Wed Aug 31 19:49:19 IST 2011,Perseverance failing 19 times succeeding 20th - Julie Andrews
MindsetMotivate,Wed Aug 31 19:04:51 IST 2011,We faced series great opportunities brilliantly disguised impossible situations- Charles R Swindoll
MindsetMotivate,Wed Aug 31 18:35:24 IST 2011,Its hard detect good luck - looks much something youve earned- Frank Howard Clark
MindsetMotivate,Wed Aug 31 16:02:52 IST 2011,Never limit yourself others limited imagination never limit others limited imagination - Mae Jemison
MindsetMotivate,Wed Aug 31 10:26:09 IST 2011,Just something doesnt planned doesnt mean useless - Thomas A Edison
MindsetMotivate,Wed Aug 31 09:26:59 IST 2011,I never schooling interfere education- Mark Twain
MindsetMotivate,Wed Aug 31 08:03:15 IST 2011,Faith taking first step even dont see whole staircase- Martin Luther King Jr
MindsetMotivate,Wed Aug 31 07:36:47 IST 2011,Youre better think Schwartz
MindsetMotivate,Wed Aug 31 07:02:37 IST 2011,Concentration fine antidote anxiety -  Jack Nicklaus
MindsetMotivate,Wed Aug 31 03:51:56 IST 2011,To successful give up everything know - Asara Lovejoy
MindsetMotivate,Wed Aug 31 01:50:34 IST 2011,Trying everyone sign mediocrity - Colin Powell
MindsetMotivate,Tue Aug 30 23:28:57 IST 2011,Be life long short completeness depends lived for- David Starr Jordan
MindsetMotivate,Tue Aug 30 22:49:01 IST 2011,We very best happiest fully engaged work enjoy Earl Nightingale
MindsetMotivate,Tue Aug 30 21:51:19 IST 2011,The thing man man mind Everything find pig horse - The Secret Freedom
MindsetMotivate,Tue Aug 30 20:50:13 IST 2011,Id regret things Ive done regret things I havent done- Lucille Ball
MindsetMotivate,Tue Aug 30 20:13:09 IST 2011,Tell everyone want someone want help it- W Clement Stone
MindsetMotivate,Tue Aug 30 18:37:54 IST 2011,I dont know grandfather I much more concerned know grandson - Abraham Lincoln
MindsetMotivate,Tue Aug 30 18:20:50 IST 2011,It takes courage grow up become really - ee Cummings
MindsetMotivate,Tue Aug 30 17:52:26 IST 2011,There eagle soar hippopotamus wallow mud - Carl Sandburg
MindsetMotivate,Tue Aug 30 16:36:59 IST 2011,Take care minutes hours take care themselves- Phillip Dormer Stanhope
MindsetMotivate,Tue Aug 30 15:08:27 IST 2011,I dont know grandfather I much more concerned know grandson - Abraham Lincoln
MindsetMotivate,Tue Aug 30 14:43:06 IST 2011,Time free priceless You cant use You cant keep spend - Harvey MacKay
MindsetMotivate,Tue Aug 30 08:29:25 IST 2011,Id regret things Ive done regret things I havent done- Lucille Ball
MindsetMotivate,Tue Aug 30 08:01:30 IST 2011,Never limit yourself others limited imagination never limit others limited imagination - Mae Jemison
MindsetMotivate,Tue Aug 30 06:41:26 IST 2011,Perseverance failing 19 times succeeding 20th - Julie Andrews
MindsetMotivate,Tue Aug 30 05:49:05 IST 2011,Trying everyone sign mediocrity - Colin Powell
MindsetMotivate,Tue Aug 30 02:48:18 IST 2011, sometimes taste adversity prosperity welcome - Anne Bradstreet
MindsetMotivate,Tue Aug 30 00:10:18 IST 2011,I nonsense -- wakes up brain cells Fantasy necessary ingredient living- Dr Seuss
MindsetMotivate,Mon Aug 29 23:37:26 IST 2011,Just something doesnt planned doesnt mean useless - Thomas A Edison
MindsetMotivate,Mon Aug 29 22:37:04 IST 2011,You brilliant ideas ideas anywhere - Lee Iacocca
MindsetMotivate,Mon Aug 29 21:47:12 IST 2011,Never doubt small group thoughtful committed people change world Indeed thing - Margaret Meade
MindsetMotivate,Mon Aug 29 20:32:17 IST 2011,Tell everyone want someone want help it- W Clement Stone
MindsetMotivate,Mon Aug 29 19:20:31 IST 2011,You much grander think - Asara Lovejoy
MindsetMotivate,Mon Aug 29 18:59:52 IST 2011,Concentration fine antidote anxiety -  Jack Nicklaus
MindsetMotivate,Mon Aug 29 18:18:55 IST 2011,The illiterate 21st century b those cant read  write those learn unlearn  relearn - Alvin Toffler
MindsetMotivate,Mon Aug 29 15:53:35 IST 2011,There end adventures seek eyes open - Jawaharlal Nehru
MindsetMotivate,Mon Aug 29 13:19:00 IST 2011,We faced series great opportunities brilliantly disguised impossible situations- Charles R Swindoll
MindsetMotivate,Mon Aug 29 12:39:39 IST 2011,It takes courage grow up become really - ee Cummings
MindsetMotivate,Mon Aug 29 10:42:30 IST 2011,To successful give up everything know - Asara Lovejoy
MindsetMotivate,Mon Aug 29 09:59:13 IST 2011,If I made valuable discoveries owing more patient attention talent - Sir Isaac Newton
