username,time,tweet
LizbethOlivar14,Wed Mar 23 05:29:59 IST 2016,RT  trust proud two meaningful compliments receive someone
LizbethOlivar14,Wed Mar 23 05:28:03 IST 2016,RT  Wishing random numbers text
LizbethOlivar14,Wed Mar 23 05:27:22 IST 2016,RT  Its important remember always control moodIf people around being negativedont affect…
LizbethOlivar14,Wed Mar 23 05:27:17 IST 2016,RT  Get Mercurial Natural Diamond boots Nike Football App today 💎 💪   
LizbethOlivar14,Wed Mar 23 05:27:08 IST 2016,RT  Hidden beauty livelokai 
LizbethOlivar14,Wed Mar 23 05:24:22 IST 2016,Learning drive hard
LizbethOlivar14,Fri Mar 18 05:42:16 IST 2016,Biology hard
LizbethOlivar14,Fri Mar 18 05:39:56 IST 2016,Too much homework gotta studying
LizbethOlivar14,Fri Mar 18 05:37:40 IST 2016,RT  Let dreams rule way livelokai 
LizbethOlivar14,Fri Mar 18 05:34:08 IST 2016,Im feeling pretty sweet bracket MarchMood MarchMadness
LizbethOlivar14,Fri Mar 18 05:32:15 IST 2016,RT  Wow Thanks  letting first athlete trying new HyperAdapt 10 nike2016 nikeinnovation 
LizbethOlivar14,Sat Mar 12 07:50:05 IST 2016,RT  Only those risk going far possibly find  out far one go
LizbethOlivar14,Sat Mar 12 07:48:40 IST 2016,RT  Vancouver tonight PURPOSETOUR
LizbethOlivar14,Fri Mar 11 11:05:12 IST 2016,RT  HATE people act theyre better everybody 
LizbethOlivar14,Fri Mar 11 11:05:07 IST 2016,Wish phone charge faster
LizbethOlivar14,Fri Mar 11 07:44:32 IST 2016,RT  Take stand livelokai 
LizbethOlivar14,Fri Mar 11 00:35:19 IST 2016, nice soccer cleats
LizbethOlivar14,Fri Mar 11 00:35:00 IST 2016,RT  Explosive pace personal styleBurst past opponents Mercurial Superfly iD  https/…
LizbethOlivar14,Fri Mar 11 00:32:38 IST 2016,RT  Ivan Rakitic indispensable birthday boy  
LizbethOlivar14,Fri Mar 11 00:31:33 IST 2016,RT  Ivan Rakitic The indispensable birthday boy  
LizbethOlivar14,Fri Mar 11 00:30:47 IST 2016,RT  If prefer  goal RT hashtag SuarezFCB 
LizbethOlivar14,Fri Mar 11 00:30:24 IST 2016,RT  If Messis goal RT hashtag MessiFCB 
LizbethOlivar14,Fri Mar 11 00:26:23 IST 2016,RT  Thank Seattle PurposeTour 
LizbethOlivar14,Thu Mar 10 11:31:43 IST 2016,RT  Team dinner before tour starts 
LizbethOlivar14,Thu Mar 10 11:31:37 IST 2016,RT  Training accuracy ⚽️👦🏽❤️ 
LizbethOlivar14,Thu Mar 10 11:27:52 IST 2016,If didnt succeed didnt try hard enough
LizbethOlivar14,Thu Mar 10 04:09:49 IST 2016,NowPlaying Middle DJ Snake ♫ 
LizbethOlivar14,Tue Mar 08 10:40:39 IST 2016,RT  Worry nothing steal joy keep very busy doing nothing
LizbethOlivar14,Tue Mar 08 10:37:18 IST 2016,RT  A classic twist Choose now between Rose Gold  Ivory Band Platinum  Black Band GearS2  h…
LizbethOlivar14,Tue Mar 08 10:37:05 IST 2016,Ugh hate phone connect charger
LizbethOlivar14,Fri Mar 04 07:00:14 IST 2016,RT  All highlights La Liga game between Rayo Vallecano FC Barcelona   
LizbethOlivar14,Fri Mar 04 06:59:35 IST 2016,RT  19 mature accidentally used credit card room key
LizbethOlivar14,Fri Mar 04 06:57:43 IST 2016,RT  Wheres next stop journey livelokai 
LizbethOlivar14,Fri Mar 04 06:57:26 IST 2016,Found solution problem
LizbethOlivar14,Wed Mar 02 09:02:10 IST 2016,《Time waiting up it》
LizbethOlivar14,Wed Mar 02 09:00:32 IST 2016,RT  SANTOS AGAIN Uli Davila benefits deflection put Mexican side 2-0 up The Galaxy trouble
LizbethOlivar14,Wed Mar 02 08:57:41 IST 2016,Just realized 3 more months until out school
LizbethOlivar14,Wed Mar 02 08:51:02 IST 2016,RT  try make something new found pinterest 
LizbethOlivar14,Wed Mar 02 08:50:41 IST 2016,RT  Thank 22
LizbethOlivar14,Wed Mar 02 08:50:25 IST 2016,RT  You 3 hours left purplelokai palm hands livelokai 
LizbethOlivar14,Tue Mar 01 09:06:20 IST 2016,HappyBirthdayJustinBieber youve come long way
LizbethOlivar14,Tue Mar 01 09:04:21 IST 2016,Craving frozen yogurt ♥♥♥
LizbethOlivar14,Tue Mar 01 09:03:10 IST 2016,Just realized 3 more months until I out school
LizbethOlivar14,Tue Mar 01 08:59:19 IST 2016,RT  Happy leapday final day limited-edition purple Lokai Available until 12am PST tonight livelokai 
LizbethOlivar14,Tue Mar 01 08:58:58 IST 2016,RT  When realize it’s leap year one more day 
LizbethOlivar14,Tue Mar 01 08:58:41 IST 2016,RT  The final chance limited-edition purple Lokai here  Available until midnight PST 
LizbethOlivar14,Sat Feb 27 21:21:22 IST 2016,Just cause trending NeverTrump
LizbethOlivar14,Sat Feb 27 21:20:16 IST 2016,RT  New YouTube video 🐻😊RT followOr Tweet TheTeddyBearCamDance watched commented 😘❤️https/…
LizbethOlivar14,Sat Feb 27 21:17:23 IST 2016,RT  Everyone needs snuggle buddy 
