username,time,tweet
HendMohammedM,Tue Mar 01 05:29:45 IST 2016,This sadness feels such constant heavy weight chest
HendMohammedM,Tue Mar 01 05:25:55 IST 2016,Some people meant fall love each meant together
HendMohammedM,Tue Mar 01 02:43:33 IST 2016,Nothing before counts
HendMohammedM,Tue Mar 01 02:42:34 IST 2016,All I apart think
HendMohammedM,Tue Mar 01 02:41:57 IST 2016,I dont think I even breathe together
HendMohammedM,Tue Mar 01 02:39:26 IST 2016,All I want more less
HendMohammedM,Tue Mar 01 02:38:41 IST 2016,Every step I take another mistake
HendMohammedM,Mon Feb 29 19:15:25 IST 2016,It feels priceless That youre always free
HendMohammedM,Mon Feb 29 07:53:39 IST 2016,RT  weekends reaction stacey dash bestt Oscarssowhite 
HendMohammedM,Mon Feb 29 07:53:29 IST 2016,AYYY LMFAAOO 
HendMohammedM,Mon Feb 29 07:40:15 IST 2016,RT  جرا ايه يا وحش احنا هنقديها مغنا وهزار طول الليل؟
HendMohammedM,Mon Feb 29 07:39:42 IST 2016,yalahwy 
HendMohammedM,Mon Feb 29 06:24:41 IST 2016,THE WEEKND IS FUCKING SLAYING JESUS Oscars
HendMohammedM,Mon Feb 29 06:22:51 IST 2016,I CANT FEEL MYSELF DAFUQ NO WHY OH MY OH ME OH GOD OH GOD MY GOD 
HendMohammedM,Mon Feb 29 06:12:46 IST 2016,SO BEAUTIFUL I CANT EVEN STOP STARING UGH UGH UGH 
HendMohammedM,Mon Feb 29 06:12:05 IST 2016,HOLY MOLY OH MY FUCK NO IM DEAD IM CRYING 
HendMohammedM,Mon Feb 29 05:30:59 IST 2016,I see face everytime somebody cant see I want
HendMohammedM,Mon Feb 29 05:17:37 IST 2016,love lost
HendMohammedM,Mon Feb 29 03:57:40 IST 2016,RT Hassann 
HendMohammedM,Sun Feb 28 21:07:43 IST 2016,I see going I play music watch leave
HendMohammedM,Sun Feb 28 15:36:36 IST 2016,Its looking people wondering whos heart broken day wondering heart breaking wondering WHY
HendMohammedM,Sun Feb 28 15:35:11 IST 2016,I look people wonder theyre here Not mean way curious way
HendMohammedM,Sun Feb 28 07:23:09 IST 2016,There’s hole soul I can’t fill Can fill
HendMohammedM,Sun Feb 28 07:19:33 IST 2016,You check-out time But never leave
HendMohammedM,Sun Feb 28 07:18:58 IST 2016,We prisoners here device
HendMohammedM,Sun Feb 28 07:17:51 IST 2016,This Heaven Hell
HendMohammedM,Sun Feb 28 07:16:47 IST 2016,Some dance remember dance forget
HendMohammedM,Sun Feb 28 06:44:48 IST 2016,بيني وبينك هجر وغدر وجرح في قلبي دريته  بيني وبينك ليل وفراق وطريق انت اللي بديته
HendMohammedM,Sun Feb 28 06:34:03 IST 2016,RT  She worship morning coffee wont morning coffee alternative Yet unaware mor…
HendMohammedM,Sun Feb 28 04:44:29 IST 2016,E M B R A C E  Y O U R  S I N S 
HendMohammedM,Sun Feb 28 04:43:29 IST 2016,Drink til numb pain
HendMohammedM,Sun Feb 28 04:38:39 IST 2016,Now everything everything
HendMohammedM,Sun Feb 28 04:37:24 IST 2016,I M M U N E  T H E  L O V E 
HendMohammedM,Sun Feb 28 04:36:51 IST 2016,Youre dead
HendMohammedM,Sun Feb 28 04:36:31 IST 2016,When stared eyes He good
HendMohammedM,Sun Feb 28 04:35:52 IST 2016,You never thought youd see face again But love swayed lies
HendMohammedM,Sun Feb 28 04:33:00 IST 2016,You deserve name crown throne
HendMohammedM,Fri Feb 26 06:52:32 IST 2016,
HendMohammedM,Fri Feb 26 06:49:45 IST 2016,Cause see want
HendMohammedM,Fri Feb 26 06:49:27 IST 2016,Those days friend
HendMohammedM,Fri Feb 26 06:48:46 IST 2016,Your shoulder cry lips arent kiss
HendMohammedM,Thu Feb 25 07:18:14 IST 2016,Bring drugs baby I bring pain
HendMohammedM,Thu Feb 25 07:17:44 IST 2016,Bring love baby I bring shame
HendMohammedM,Thu Feb 25 06:39:46 IST 2016,Once I dead everything normal though I never existed
HendMohammedM,Thu Feb 25 06:31:29 IST 2016,What difference life made anyone None I think None
HendMohammedM,Thu Feb 25 06:30:08 IST 2016,The eyes never lie
HendMohammedM,Thu Feb 25 03:49:24 IST 2016,Ill make look easyy
HendMohammedM,Thu Feb 25 03:47:39 IST 2016,want bad evvaahh
HendMohammedM,Thu Feb 25 03:39:15 IST 2016,RT  Bless darkness bless light I lost soul skin tones
HendMohammedM,Thu Feb 25 03:39:07 IST 2016,RT Ersh شهداء ٢٥ يناير ماتوا في أحداث يناير 
