username,time,tweet
Mckayla_Holmes,Tue Mar 01 05:29:30 IST 2016,If someone buy packet yeast great Im trying make pita bread over here
Mckayla_Holmes,Tue Mar 01 01:54:48 IST 2016,The morning party I always 3 new people added sc😂
Mckayla_Holmes,Tue Mar 01 00:56:06 IST 2016, come find  before tomorrow tho
Mckayla_Holmes,Mon Feb 29 23:08:28 IST 2016,If anyone stories dr Birch Please find IALC member video taped
Mckayla_Holmes,Mon Feb 29 09:45:06 IST 2016,I slept much weekend
Mckayla_Holmes,Mon Feb 29 09:41:39 IST 2016,Theres always weird food residue screen phone
Mckayla_Holmes,Mon Feb 29 09:17:38 IST 2016,The thing Im excited try Peru Guinea pig
Mckayla_Holmes,Mon Feb 29 07:05:05 IST 2016, happy birthday bud🎉🎉
Mckayla_Holmes,Mon Feb 29 07:01:37 IST 2016,Text want fun conversation
Mckayla_Holmes,Mon Feb 29 06:21:46 IST 2016,I want someone whos committed working out
Mckayla_Holmes,Mon Feb 29 01:36:21 IST 2016,Come cjhs game baseball -
Mckayla_Holmes,Sun Feb 28 19:42:37 IST 2016,Fricken someone start streak - mckaylaholmes13
Mckayla_Holmes,Sun Feb 28 09:45:40 IST 2016,RT  Dont luv youre wearing makeup asked several times youre sick upset Im …
Mckayla_Holmes,Sun Feb 28 08:55:38 IST 2016,RT  My phone max drypacity
Mckayla_Holmes,Sun Feb 28 08:30:54 IST 2016,Who something
Mckayla_Holmes,Sun Feb 28 02:17:15 IST 2016,RT  💙✨ 
Mckayla_Holmes,Sun Feb 28 02:09:31 IST 2016,RT  Holmes I feel youre mom group youre junior
Mckayla_Holmes,Sun Feb 28 02:09:23 IST 2016, know I need take care people
Mckayla_Holmes,Sun Feb 28 01:51:54 IST 2016,RT  The internet deserves see 
Mckayla_Holmes,Sun Feb 28 01:51:15 IST 2016,Yo sushi later
Mckayla_Holmes,Sun Feb 28 01:10:32 IST 2016,Todays going slow
Mckayla_Holmes,Sat Feb 27 23:50:21 IST 2016,Lumberjack Fridays going thing 
Mckayla_Holmes,Sat Feb 27 23:44:39 IST 2016,RT  lets make happen 
Mckayla_Holmes,Sat Feb 27 23:15:11 IST 2016,If anyone pics please send me-
Mckayla_Holmes,Sat Feb 27 20:00:18 IST 2016,In situations Im mom I feel
Mckayla_Holmes,Sat Feb 27 19:52:29 IST 2016, put
Mckayla_Holmes,Sat Feb 27 19:28:13 IST 2016,RT  Wish I fall asleep normal people
Mckayla_Holmes,Sat Feb 27 00:27:39 IST 2016,Just another picture The Prom Shoppes fashion show Dont forget stop all… 
Mckayla_Holmes,Fri Feb 26 10:53:10 IST 2016,I over much house plants piss tf
Mckayla_Holmes,Fri Feb 26 08:22:15 IST 2016,RT  8th grade self thegoldenyears 
Mckayla_Holmes,Fri Feb 26 07:57:08 IST 2016,4 people followed // automatically checked 
Mckayla_Holmes,Fri Feb 26 06:26:53 IST 2016,RT  A fun shot holmes during tpsfashionshow 🎀 Come see dress person Here… 
Mckayla_Holmes,Fri Feb 26 03:23:15 IST 2016,Lmao hit up
Mckayla_Holmes,Fri Feb 26 02:01:17 IST 2016,I need something tonight
Mckayla_Holmes,Thu Feb 25 10:34:02 IST 2016,RT  Killing 
Mckayla_Holmes,Thu Feb 25 10:20:31 IST 2016,RT  This 100x better damn Daniel 😂💀 
Mckayla_Holmes,Thu Feb 25 07:10:50 IST 2016,Ilysm💜💜😩😩 
Mckayla_Holmes,Tue Feb 23 09:48:07 IST 2016,RT  White people winning one 
Mckayla_Holmes,Tue Feb 23 09:40:47 IST 2016,RT  What dude doing 😂 
Mckayla_Holmes,Tue Feb 23 09:29:29 IST 2016,RT  want something real
Mckayla_Holmes,Tue Feb 23 09:27:45 IST 2016,RT  When youre hungry open up fridge house theres nothing
Mckayla_Holmes,Tue Feb 23 08:24:46 IST 2016,Wow senior Im Orchesis saved
Mckayla_Holmes,Tue Feb 23 07:21:36 IST 2016,I need hug
Mckayla_Holmes,Tue Feb 23 07:14:42 IST 2016,Im scared
Mckayla_Holmes,Tue Feb 23 06:59:26 IST 2016,RT  I LOVE EVERYTHING ABOUT THIS 
Mckayla_Holmes,Tue Feb 23 06:46:11 IST 2016,RT  
Mckayla_Holmes,Tue Feb 23 06:07:59 IST 2016,Guys someone text Im great conversationalist
Mckayla_Holmes,Tue Feb 23 06:04:22 IST 2016,Well didnt go anywhere😒😒
Mckayla_Holmes,Mon Feb 22 08:23:51 IST 2016,RT  He tried standing egg 
