username,time,tweet
germoneys,Tue Mar 01 05:29:41 IST 2016, I realize isnt possible I dream I few days ago
germoneys,Tue Mar 01 05:29:09 IST 2016, looks banana tree peel hot wings
germoneys,Tue Mar 01 05:28:46 IST 2016,I want become worlds truly humane farmer engineering plants actually meat A t bone growing ground
germoneys,Tue Mar 01 05:28:11 IST 2016,Im make chicken Alfredo hell yeah YEAHHAHA
germoneys,Tue Mar 01 05:26:25 IST 2016,RT  TW// animal abusethis SUCH good news FINALLY  
germoneys,Tue Mar 01 05:12:41 IST 2016,RT  Do republican children play Marco Polo Marco Rubio
germoneys,Tue Mar 01 05:12:05 IST 2016,Snakes dogs without legs kill theyre bigger
germoneys,Tue Mar 01 05:11:08 IST 2016,RT  Also tf back again My nigga first one
germoneys,Tue Mar 01 05:11:02 IST 2016,RT  How yall found one person actually deserved props  
germoneys,Tue Mar 01 05:08:46 IST 2016,NYX stick foundation looks great Im aware wearing
germoneys,Tue Mar 01 05:06:47 IST 2016, naked 3 pretty tho
germoneys,Tue Mar 01 05:02:19 IST 2016,Unpopular opinion naked palettes shit
germoneys,Tue Mar 01 03:22:04 IST 2016,RT  America checks single one
germoneys,Tue Mar 01 03:22:01 IST 2016,RT  poster hanging up human geography class stare despair day 
germoneys,Tue Mar 01 00:54:10 IST 2016,A bar teachers called kahooters
germoneys,Tue Mar 01 00:53:47 IST 2016,The vid porn family life pic statue David Ah yes obscene thing known man Renaissance
germoneys,Mon Feb 29 08:27:35 IST 2016, I well
germoneys,Mon Feb 29 08:26:46 IST 2016,Remember I illuminati 
germoneys,Mon Feb 29 07:32:11 IST 2016,RT  If Young Metro dont trust 
germoneys,Mon Feb 29 07:30:41 IST 2016,Idk pillow case went Im using shirt
germoneys,Mon Feb 29 07:26:58 IST 2016,  
germoneys,Mon Feb 29 07:24:49 IST 2016,RT  Me af hard much 
germoneys,Mon Feb 29 07:23:19 IST 2016,RT  This literally face I make Im pooping 
germoneys,Mon Feb 29 07:23:13 IST 2016,RT  I think agree collectively over whole Im awkward quirky I love pizza Jennifer Lawrence ph…
germoneys,Mon Feb 29 07:22:40 IST 2016,RT  Anyone makes joke Leonardo DiCaprio winning Oscar getting instantly blocked Be better
germoneys,Mon Feb 29 07:22:21 IST 2016,I stress induced heart attack already
germoneys,Mon Feb 29 05:34:31 IST 2016,Thinking looks good youre drawing later realize shit 
germoneys,Mon Feb 29 05:34:15 IST 2016,Look little ass gogomobile background 
germoneys,Mon Feb 29 05:30:31 IST 2016,I love bread Im bread
germoneys,Mon Feb 29 05:29:41 IST 2016,Someone please bring Montana gold bread Im DYING
germoneys,Mon Feb 29 05:17:59 IST 2016,The golden men grow numbers Theyre taking over
germoneys,Mon Feb 29 05:16:13 IST 2016,I finally bought foundation months ive used
germoneys,Mon Feb 29 05:15:21 IST 2016,RT  Glasses model 
germoneys,Mon Feb 29 05:14:19 IST 2016,Things make uncomfortable sonic bat tiddies 
germoneys,Mon Feb 29 05:05:37 IST 2016,RT  Would fuck Dr Phil Dr Phil 
germoneys,Mon Feb 29 04:11:03 IST 2016,Idk poster funnier see AC Moore 
germoneys,Mon Feb 29 03:22:11 IST 2016,RT  JIMMY NEUTRON PART 8 
germoneys,Sun Feb 28 23:01:24 IST 2016,I want irregular choice shoes I afraid ruining
germoneys,Sun Feb 28 10:52:16 IST 2016,RT  
germoneys,Sun Feb 28 10:45:45 IST 2016,RT  THIS IS SO CUTE 😭😍 
germoneys,Sun Feb 28 10:32:14 IST 2016,RT  How 
germoneys,Sun Feb 28 10:29:42 IST 2016,
germoneys,Sun Feb 28 10:24:51 IST 2016,That smiley neck needs name 
germoneys,Sun Feb 28 09:22:00 IST 2016,RT  We busy laughing Trump we’ve lost sight dangerous  explains
germoneys,Sun Feb 28 08:47:46 IST 2016,RT  Happy Pokémon Day Tell youre celebrating 20 years Pokémon adventures Pokemon20 
germoneys,Sun Feb 28 08:46:13 IST 2016,Feelin good 
germoneys,Sun Feb 28 08:37:26 IST 2016,RT  
germoneys,Sun Feb 28 07:48:18 IST 2016, hear ascend heaven
germoneys,Sun Feb 28 07:46:56 IST 2016,RT  Magic Man - Out Of Mind - Vocal Stem 
