username,time,tweet
IVIolotov,Thu Sep 01 05:29:48 IST 2011,Just new sideline polo Guns Up Tech apparel Obviously black choice Game week here    TTU
IVIolotov,Thu Sep 01 05:26:01 IST 2011,RT  I hope Big 12 expand stick around I going strong advocate Texas Tech OU OSU t 
IVIolotov,Wed Aug 31 21:55:13 IST 2011,Welcome hell October 8th Aggies   
IVIolotov,Tue Aug 30 00:19:30 IST 2011,RT  I hear Goin Band Tis season    gunsup
IVIolotov,Mon Aug 29 22:02:51 IST 2011,Game week   
IVIolotov,Mon Aug 29 21:57:39 IST 2011,RT khan A shark swimming street Puerto Rico HurricaneIrene hit 
IVIolotov,Fri Aug 26 23:19:36 IST 2011,Quit hoarding weights rec members   
IVIolotov,Fri Aug 26 08:04:08 IST 2011,RT  I rid AM go school Air Force Louisville TCU unlikely Arkansas way unlikely SMU Ag 
IVIolotov,Thu Aug 25 23:49:31 IST 2011,RT  Obligatory first day class sucks/rocks/blows tweet Srsly tho freshman hang out SUB day cool  
IVIolotov,Wed Aug 24 07:56:46 IST 2011,iLuminate incredible act Ive seen They dont win AGT successful Americasgottalent
IVIolotov,Wed Aug 24 07:18:44 IST 2011,  Check out old project I dug up If I RT Ill one better 
IVIolotov,Tue Aug 23 07:28:37 IST 2011,Ramsey greatest chef world kicks people completely based drama ratings Elise gone hellskitchen
IVIolotov,Sun Aug 21 06:48:22 IST 2011,  out looking trouble Hit up trouble whathappensinvegas
IVIolotov,Sun Aug 21 02:53:33 IST 2011,No work tomorrow  Anybody looking good time tonight adventure
IVIolotov,Fri Aug 19 20:20:07 IST 2011,RT  I wish  Texas Tech  Georgia Tech Football Virginia Tech play each eve 
IVIolotov,Fri Aug 19 02:49:22 IST 2011,My players play best look best well yes 2 correlate littleleaguebaseball
IVIolotov,Fri Aug 19 02:48:17 IST 2011,Somebody needs explain Japanese Little League team curve bills hats Crease And 35 hat llws
IVIolotov,Fri Aug 19 02:45:48 IST 2011,My players play best look best well two correlate believe
IVIolotov,Fri Aug 19 02:44:29 IST 2011,Somebody needs explain Japanese Little Leagers curve bills A crease 35 hat   
IVIolotov,Thu Aug 18 00:56:29 IST 2011,I love coming home new apartment
IVIolotov,Tue Aug 16 07:23:55 IST 2011,RT  Get owned AM Now both SEC Big 12 dont want Go away forever please
IVIolotov,Tue Aug 16 02:08:52 IST 2011,RT  Hey NO ONE CARES getoveryourself
IVIolotov,Tue Aug 16 02:08:39 IST 2011,RT  “   CENA IS GOING TO WIN YOU ARE TO MUCH OF A CRY BABY TO BE A WINNER”Your twit pic makes cry
IVIolotov,Tue Aug 16 02:07:01 IST 2011,RT  If Big 12 fails I call Tech Pac-12 Thats last time Ill iranttoomuch departmentofredundancyde 
IVIolotov,Fri Aug 12 23:31:12 IST 2011,Final hour home Ive known   
IVIolotov,Fri Aug 12 07:59:01 IST 2011,   I see TNA Knockouts superplexing each I expect Divas match surpass
IVIolotov,Mon Aug 08 22:14:58 IST 2011,Currently reading     Im depressed   
IVIolotov,Mon Aug 08 21:55:28 IST 2011,RT  watching prequel Intervention called Toddlers Tiaras
IVIolotov,Mon Aug 08 21:55:03 IST 2011,RT  “ Rise Planet Apes So good” -Possibly best use CGI I seen Beautiful storytelling
IVIolotov,Fri Aug 05 20:36:03 IST 2011,Dreaming day I work greatest ambitious hardest working studio world I want bad   
IVIolotov,Fri Aug 05 20:30:41 IST 2011,RT Anna Today I went thesauruscom searched ninjas The computer told Ninjas found Well played ninj 
IVIolotov,Tue Aug 02 08:38:52 IST 2011,Creative Ugh promoting Cena face whines BS paper championship    And Little Jimmies ate up sigh
IVIolotov,Tue Jul 19 10:20:58 IST 2011,Love seeing  title belt baseball game Am I jealous Very   
IVIolotov,Tue Jul 12 07:14:08 IST 2011,Creative Whos charge teaching Kelly carry title belt She lessons    
IVIolotov,Tue Jul 12 06:41:06 IST 2011,Creative CM Punk helped forget Cenas existence    Then music started   
IVIolotov,Tue Jul 12 01:34:48 IST 2011,Miss artwork Think Ill work quick projects tonight Inspiration
IVIolotov,Tue Jul 05 07:07:21 IST 2011,RT  holy shit  Raw ZackPack WWWYKI
IVIolotov,Tue Jul 05 07:07:07 IST 2011,  context conduct
IVIolotov,Tue Jul 05 06:58:09 IST 2011, I disagree I enjoy interaction whole thing taken out conduct Big fan still Youre pure entertainment
IVIolotov,Wed Jun 29 09:57:35 IST 2011,Peter Jackson brilliant man I demand direct Halo movies 343 Microsoft quit screwing up
IVIolotov,Tue Jun 28 09:33:24 IST 2011,RT   - Watch out Dwayne upset hell respond long-winded snorefest via s 
IVIolotov,Tue Jun 28 09:32:08 IST 2011,  Biased cause wearing merchandise left out call outs   
IVIolotov,Tue Jun 28 09:16:31 IST 2011,RT  CM Punk Suspended WTF And thank wwe proving right Stop kissing Cenas ass 2 seconds think 
IVIolotov,Tue Jun 28 09:02:04 IST 2011,Creative Its product peoples attention Its singularly CM Punk People chant Cena Sucks still force
IVIolotov,Tue Jun 28 08:54:18 IST 2011,RT   product sucks CM Punk infused awesomeness ROLL WITH IT OR FADE AWAY
IVIolotov,Tue Jun 28 08:53:17 IST 2011, CM Punk spoken truth Scripted I bet wasnt CM Punk made nothing valid points I appreciate honesty
IVIolotov,Sun Jun 26 07:16:28 IST 2011,RT  Congrats NY maybe world isnt hopeless 44 more states grow up
IVIolotov,Fri Jun 24 07:15:31 IST 2011, Cars movie potential future story lines The gimmick theyre cars covered ground
IVIolotov,Thu Jun 23 21:11:23 IST 2011,  Dont talk Astros
IVIolotov,Tue Jun 21 07:58:00 IST 2011, gets Theres reason Impact performers arent working way  WWE stars leaving Orlando   
