username,time,tweet
marilyncariaga,Tue Mar 01 05:29:41 IST 2016,Proverbs 1513- “A happy heart makes face cheerful heartache crushes spirit”
marilyncariaga,Tue Mar 01 05:11:04 IST 2016,Patience word day Breathe
marilyncariaga,Mon Feb 29 21:31:33 IST 2016,Happy Leap Year Extra 24 hours share love aloha around world Aloha Namaste MindBodySpirit
marilyncariaga,Mon Feb 29 21:30:07 IST 2016,The morning sunrise evening sunset Thank beauty
marilyncariaga,Mon Feb 29 21:28:47 IST 2016,What BLISS
marilyncariaga,Mon Feb 29 21:28:23 IST 2016,Theres lots smile Find one thing smile Thankful
marilyncariaga,Mon Feb 29 21:26:56 IST 2016,Believe Beloved Love
marilyncariaga,Mon Feb 29 21:26:36 IST 2016,Follow heart It compass need Believe
marilyncariaga,Mon Feb 29 20:56:48 IST 2016,Fear missing out FOMO
marilyncariaga,Mon Feb 29 20:56:30 IST 2016,Count blessings Gratitude
marilyncariaga,Mon Feb 29 06:43:26 IST 2016,Faith Exercise muscle
marilyncariaga,Mon Feb 29 06:38:36 IST 2016,You simply amazing
marilyncariaga,Mon Feb 29 06:38:12 IST 2016,Nourish soul
marilyncariaga,Mon Feb 29 06:37:36 IST 2016,Intuitive intelligence The still small voice Gut feeling
marilyncariaga,Mon Feb 29 06:36:31 IST 2016,My dreams bigger Are dreams big RideTheBigWave
marilyncariaga,Mon Feb 29 06:34:55 IST 2016,Patience friend In meantime live today
marilyncariaga,Mon Feb 29 06:33:20 IST 2016,Practice kindness
marilyncariaga,Mon Feb 29 06:32:49 IST 2016,Healing important aspect lifes journey Too mask issues
marilyncariaga,Mon Feb 29 06:30:57 IST 2016,Rise up Walk forward Healing
marilyncariaga,Mon Feb 29 06:29:34 IST 2016,Today I choose rest still Its good spirit
marilyncariaga,Sun Feb 28 23:46:50 IST 2016,Im writing new book Its blueprint successful  abundant living Youll love more  leave lasting legacy Leaders
marilyncariaga,Sun Feb 28 23:37:53 IST 2016,May I find right global partners-sponsors seek help bring message abundant living Abundance Global OneLove
marilyncariaga,Sun Feb 28 23:32:49 IST 2016,May grace  peace upon May blessed Aloha Namaste
marilyncariaga,Sun Feb 28 23:29:10 IST 2016,When make decision best best- gifts become best best LetsDoThis
marilyncariaga,Sun Feb 28 23:26:33 IST 2016,My friend laughs lot  talks having laugh-a-thon Its goofy silly imagine healthy benefits Just Laugh more
marilyncariaga,Sun Feb 28 23:23:17 IST 2016,Where I live beauty around power  aloha May find beauty live fill love Hawaii Namaste
marilyncariaga,Sun Feb 28 23:18:08 IST 2016,Influencer What matters Is greater good Business Professionals CEO Leaders Global
marilyncariaga,Sun Feb 28 23:14:26 IST 2016,Thank friends following My intentions  purpose see filled love living life desire being best
marilyncariaga,Sun Feb 28 23:13:07 IST 2016,Define purpose gift create blueprint take action Let know CoachForSuccessfulLiving MindBodySpirit
marilyncariaga,Sun Feb 28 23:10:30 IST 2016,Give yourself permission something love today ChooseLife ChooseJoy ChooseHappiness
marilyncariaga,Sun Feb 28 23:07:44 IST 2016,Invest someones passion A child family friends Give opportunity discover explore succeed  watch flourishSocial
marilyncariaga,Sun Feb 28 23:04:25 IST 2016,True friends people love unconditionally know lot spend quality time Show friends love
marilyncariaga,Sun Feb 28 23:00:41 IST 2016,LOVE powerful energy  GREATEST Love Social Business Professionals
marilyncariaga,Sun Feb 28 22:59:52 IST 2016,Loving accepting Say love Love Social
marilyncariaga,Sun Feb 28 22:59:00 IST 2016,Smile Its healthy Healthy Happy Love Gratitude
marilyncariaga,Sun Feb 28 22:56:50 IST 2016,What youre thinking become I challenge observe yourself Listen speak watch act Social
marilyncariaga,Sun Feb 28 22:53:49 IST 2016,Healthy foods expensive Its great  best investment mind body  soul HealthyBenefits OptimalPerformance Social
marilyncariaga,Sun Feb 28 22:51:06 IST 2016,Eat healthy natural foods good clear thinking body  soul AbundantLiving Healthy JoinMe
marilyncariaga,Sun Feb 28 22:47:35 IST 2016,Say NO Domestic Violence No one live fear Social LoveYourself
marilyncariaga,Sun Feb 28 22:46:22 IST 2016,We always choice love hate Choose love
marilyncariaga,Sun Feb 28 22:45:53 IST 2016,Are worrier Thats mind filled worry LetItGo Embrace new healthy thoughts
marilyncariaga,Sun Feb 28 22:45:02 IST 2016,To positive  healthy mindset way life AbundantLiving
marilyncariaga,Sun Feb 28 22:44:28 IST 2016,Healthy thinking Toxic Thinking ChoosePositiveVibes Energy
marilyncariaga,Sun Feb 28 22:43:43 IST 2016,When judge someone criticizing yourself ChooseLove
marilyncariaga,Sun Feb 28 22:42:47 IST 2016,When talk dreams already here Manifest DreamsComeTrue SocialMediaMarketing
marilyncariaga,Sun Feb 28 22:41:23 IST 2016,Are happy I hope happy Social Marketing Business Professionals
marilyncariaga,Sun Feb 28 22:40:33 IST 2016,Today brand new day start again Social Self Encouragement
marilyncariaga,Sun Feb 28 11:15:05 IST 2016,󾬘 I love being friends  family They truly bring out best version 󾬏❤️󾬏 SelfLove  TrueLove 
marilyncariaga,Sun Feb 28 08:57:10 IST 2016,I loving opportunity walking dancing It brings great joy I hope enjoying moment Social Friends
marilyncariaga,Sat Feb 27 12:12:18 IST 2016,
