username,time,tweet
Marflebooks,Tue Mar 01 05:29:59 IST 2016,Unless ridiculously disciplined and/or talented know bounty face
Marflebooks,Tue Mar 01 04:29:59 IST 2016,Somehow feeling suspense cartoon animal outright creepy once switched applied human face behind
Marflebooks,Tue Mar 01 03:29:58 IST 2016,I need apply fur onto fursuit over population
Marflebooks,Tue Mar 01 02:29:58 IST 2016,Goodnight adorable animal heads productive day young Im
Marflebooks,Tue Mar 01 01:29:58 IST 2016,Maybe 90s again try live w/o constant connection
Marflebooks,Tue Mar 01 00:29:58 IST 2016,Today feels much something out painting
Marflebooks,Mon Feb 29 23:29:58 IST 2016,Ill call port call
Marflebooks,Mon Feb 29 22:29:58 IST 2016,I know someone feeling
Marflebooks,Mon Feb 29 21:29:58 IST 2016,Have Skype open hours wonder remind stuck head
Marflebooks,Mon Feb 29 20:29:58 IST 2016,Do jokes first coyote comic drawn
Marflebooks,Mon Feb 29 19:29:58 IST 2016,Inktiber necessitates physical ink hands again
Marflebooks,Mon Feb 29 18:29:58 IST 2016,How help
Marflebooks,Mon Feb 29 17:29:58 IST 2016,Organizing computer productive procrastinate Dental appointments Id cant avoid kay
Marflebooks,Mon Feb 29 16:29:58 IST 2016,Thank
Marflebooks,Mon Feb 29 15:29:58 IST 2016,Ever those bridges
Marflebooks,Mon Feb 29 14:29:58 IST 2016,Gelatophobia Fear being caught up work
Marflebooks,Mon Feb 29 13:30:03 IST 2016,Elevator con Hilton resting assured rough drafts relegated relevant places
Marflebooks,Mon Feb 29 12:29:58 IST 2016,I really more outgoing animal people wurst
Marflebooks,Mon Feb 29 11:29:58 IST 2016,comfy leave
Marflebooks,Mon Feb 29 10:29:59 IST 2016,I dont much common I still wanna those bridges
Marflebooks,Mon Feb 29 09:29:58 IST 2016,Go pester I didnt coffee morning
Marflebooks,Mon Feb 29 08:29:58 IST 2016,While I cant truly see myself anywhere hoverboard
Marflebooks,Mon Feb 29 07:29:58 IST 2016,Lunch under fair bit weird
Marflebooks,Mon Feb 29 06:29:58 IST 2016,Yes Im being zone creatively youre focused hours chocolates feral animals next Saturday
Marflebooks,Mon Feb 29 05:29:58 IST 2016,I reassigned make plans
Marflebooks,Mon Feb 29 04:29:59 IST 2016,Time begin neo-cubist modern art designs spot
Marflebooks,Mon Feb 29 03:29:58 IST 2016,I need reflect
Marflebooks,Mon Feb 29 02:29:58 IST 2016,Going back January
Marflebooks,Mon Feb 29 01:29:59 IST 2016,You furries furry provention
Marflebooks,Mon Feb 29 00:29:58 IST 2016,Totally tempted buy something good grief
Marflebooks,Sun Feb 28 23:29:59 IST 2016,When thing career life bring smile face overall brighten day wag
Marflebooks,Sun Feb 28 22:29:58 IST 2016,Pirate ships crowded bus something phone
Marflebooks,Sun Feb 28 21:29:59 IST 2016,Redundant shower thinking creepy stalker leitmotif played diegetically
Marflebooks,Sun Feb 28 20:29:58 IST 2016,That took shower hour dont wanna up
Marflebooks,Sun Feb 28 19:29:58 IST 2016,I hunt down getting quick responses making very very relatively adorable protagonist wag
Marflebooks,Sun Feb 28 18:29:58 IST 2016,Dammit acne marf
Marflebooks,Sun Feb 28 17:29:58 IST 2016,Im Mission Statements
Marflebooks,Sun Feb 28 16:29:58 IST 2016,A picture ago fries dip milkshake
Marflebooks,Sun Feb 28 15:29:59 IST 2016,Im awake productive purchase investment time
Marflebooks,Sun Feb 28 14:29:58 IST 2016,Yknow whatever reason unapproachable
Marflebooks,Sun Feb 28 13:29:58 IST 2016,This becoming Mac person
Marflebooks,Sun Feb 28 12:29:58 IST 2016,Go furmeet straight class late mirror
Marflebooks,Sun Feb 28 11:29:58 IST 2016,Shall work freshly flowing inside body
Marflebooks,Sun Feb 28 10:29:58 IST 2016,I try superhero powers involve elements modified canine noises bad one-liners coffee
Marflebooks,Sun Feb 28 09:29:58 IST 2016,Breakfast making pizza
Marflebooks,Sun Feb 28 08:29:59 IST 2016,Modern repeatedly system used up tries hide flaws
Marflebooks,Sun Feb 28 07:29:58 IST 2016,16 more pages written see unresponsive scripts
Marflebooks,Sun Feb 28 06:29:58 IST 2016,2 hour travel time between points
Marflebooks,Sun Feb 28 05:29:59 IST 2016,The green grass blooming trees spring partly cloudy sky along ground
Marflebooks,Sun Feb 28 04:29:58 IST 2016,Thinking ideally M-F daily posting w/ compilation week I legitimately felt I knew I doing
