username,time,tweet
pambesteder,Tue Mar 01 05:29:36 IST 2016, James even imagine She told HUGE headache screws used hold skull together surgery
pambesteder,Tue Mar 01 05:29:09 IST 2016, Absolutelycrystal clear perspective
pambesteder,Tue Mar 01 05:28:38 IST 2016, Waitdid I count using Common Core  lol
pambesteder,Tue Mar 01 05:28:21 IST 2016, God bless Suzanne
pambesteder,Tue Mar 01 05:28:08 IST 2016, Cindy certainly
pambesteder,Tue Mar 01 05:27:52 IST 2016, Indeed Natalie  Thank
pambesteder,Tue Mar 01 05:27:37 IST 2016, Kayleethats very sweet  Thank
pambesteder,Tue Mar 01 05:27:28 IST 2016, Youre very kind  Thank
pambesteder,Tue Mar 01 05:27:14 IST 2016, Amen Amen
pambesteder,Tue Mar 01 05:27:06 IST 2016, Susan I appreciate
pambesteder,Tue Mar 01 05:26:58 IST 2016, Thank much Cynthia
pambesteder,Tue Mar 01 05:26:50 IST 2016, Thank
pambesteder,Tue Mar 01 05:26:39 IST 2016,You think 3 Americans African descent didnt memo pushing Trump racist 
pambesteder,Tue Mar 01 05:22:56 IST 2016, Why bursting bubble  Cant I happy without giving pesky facts  -
pambesteder,Tue Mar 01 05:22:13 IST 2016,Politics life  My friend Cathy brain surgery Thursday  Heres something real upset 
pambesteder,Tue Mar 01 05:20:28 IST 2016,  Which self-inflicted  People riled themselves up much guy WONT vote 4 anyone
pambesteder,Tue Mar 01 05:16:19 IST 2016, Whoever wins nominationthe fight ourselvesits Hillary
pambesteder,Tue Mar 01 05:15:41 IST 2016,  What think Webb  Interesting wasnt
pambesteder,Tue Mar 01 05:15:16 IST 2016,Even car breaks down I crack rib punched eye  cant see bad hair day I CRAWL vote SECPrimary
pambesteder,Tue Mar 01 05:12:46 IST 2016, I know  I
pambesteder,Tue Mar 01 05:12:34 IST 2016, Yepjust one more
pambesteder,Tue Mar 01 05:09:23 IST 2016,Hurry up here primary voting day  I want thing over GOP nominee fight true opponent
pambesteder,Tue Mar 01 05:05:07 IST 2016,YIKESand again I YIKES  Go ahead Michelle 
pambesteder,Tue Mar 01 05:02:15 IST 2016,Tomorrow day  Get out exercise right people fought preserve  I willtoo many died NOT
pambesteder,Tue Mar 01 04:59:26 IST 2016, Have watched video  Watch itabout 17 minutes
pambesteder,Tue Mar 01 04:58:54 IST 2016,RT  We running limited 100 PKS Scorpion Signature series Bushcraft Knives come PKS T https…
pambesteder,Tue Mar 01 04:58:43 IST 2016, You cant  Only God change heart thus changing life  You sweet kind whenever
pambesteder,Tue Mar 01 04:56:59 IST 2016,I keep getting emails GOP donate  I never donated political entity never  Go figure
pambesteder,Tue Mar 01 04:56:08 IST 2016,  WebbI watched video David Duke It interesting 
pambesteder,Tue Mar 01 04:53:42 IST 2016,RT  Atlanta couples message bottle washes ashore France 4 years later  
pambesteder,Tue Mar 01 04:52:46 IST 2016,Knowing Christ wicked life saved out ofI problem allowing people failures
pambesteder,Tue Mar 01 04:50:17 IST 2016,jesse Hes changed heart
pambesteder,Tue Mar 01 04:50:00 IST 2016, Amen Justin
pambesteder,Tue Mar 01 04:49:48 IST 2016, I agree
pambesteder,Tue Mar 01 04:49:34 IST 2016, I problem listening He over 40 years ago  yes hes right Hillary
pambesteder,Tue Mar 01 04:48:31 IST 2016, My dad racist became Christianloves Lord
pambesteder,Tue Mar 01 04:31:37 IST 2016,I American African descentheres questionIs possible someone once racist longer one
pambesteder,Tue Mar 01 04:20:24 IST 2016,David Duke responds CNN  Speaks Trump Americans  
pambesteder,Tue Mar 01 03:45:34 IST 2016,RT  Both establishment Republicans Trump need cool close ranks fight real enemy  Trump Rubio Kasich co…
pambesteder,Tue Mar 01 03:28:48 IST 2016,  lol
pambesteder,Tue Mar 01 03:28:31 IST 2016, How I remove Virtual Assistant window  Its cover content I need access 
pambesteder,Tue Mar 01 03:21:54 IST 2016, Watch
pambesteder,Tue Mar 01 03:21:41 IST 2016, Did watch video
pambesteder,Tue Mar 01 03:21:13 IST 2016,theUSA This political crisisits crisis morality soul country  No election change now
pambesteder,Tue Mar 01 03:19:50 IST 2016, Awww   My husband wont dog  He Im responsible enough  I want little one
pambesteder,Tue Mar 01 03:19:00 IST 2016,OK now interesting  CNN talking Trump KKK  cuts away Trump supporters questions  
pambesteder,Tue Mar 01 03:14:32 IST 2016,Kristoff Can imagine Bill anywhere near oval office again  Good grief
pambesteder,Tue Mar 01 03:14:06 IST 2016, He didnt think until today hell out town tomorrow
pambesteder,Tue Mar 01 03:13:42 IST 2016, Hayou liked one huh   My brain works  lol
pambesteder,Tue Mar 01 03:13:21 IST 2016,theUSA Yesstarts homethen schoolschipping chipping away  Obama clean articulatenon-assuming
