username,time,tweet
wputriayu,Thu Sep 01 05:29:58 IST 2011,RT  RT  They  Everything happens reason   But nice know  reasons
wputriayu,Tue Aug 30 13:41:04 IST 2011,Iya maafin aku juga yaa - RT  Mohon maaf lahir batin temen sd ku      
wputriayu,Tue Aug 30 12:58:44 IST 2011,Iya geemm Maafin aku juga yaa♡ RT  mohon maaf lahir batin yaa kalian     love ya
wputriayu,Sat Aug 27 08:05:12 IST 2011,Beluum td malem nginep dulu di lampung D RT  pasti udah nyampe palembang D 
wputriayu,Sat Aug 27 04:52:31 IST 2011,Siiip  RT  Ohahaha oleh oleh ya ayuu wkwkRT  Ke palembang hehehe RT  Yahahaha mudik kemana Ikut hehe
wputriayu,Fri Aug 26 19:13:25 IST 2011,Ke palembang hehehe RT  Yahahaha mudik kemana Ikut heheRT  Ngga mudik hehehe Kamu RT  Masih juga hehe
wputriayu,Fri Aug 26 18:56:07 IST 2011,RT  RT  RT  RT  RT  Badmood  put headphone  Volume up  Ignore world
wputriayu,Fri Aug 26 18:54:19 IST 2011,Ngga mudik hehehe Kamu RT  Masih juga hehe besok ikut yuRT  Masih hehehe Chia RT  Sama sama
wputriayu,Fri Aug 26 18:10:21 IST 2011,Masih hehehe Chia RT  Sama sama- masih di gba yuRT  Makasih chia - RT  Followed ayuu heheRT
wputriayu,Fri Aug 26 17:53:08 IST 2011,Makasih chia - RT  Followed ayuu heheRT  Followback ya hehehe 
wputriayu,Fri Aug 26 17:24:11 IST 2011,Followback ya hehehe 
wputriayu,Fri Aug 26 16:43:34 IST 2011,Im Seafood Jumbo Kakap Jl Ikan Kakap No 45 Telukbetung Bandar Lampung 
wputriayu,Fri Aug 26 16:20:20 IST 2011,Gapapa ko aku terima hatimu apa adanya -  RT   jadi malu nih  tapi hati aku udah milik beberapa orang gimana
wputriayu,Fri Aug 26 16:09:25 IST 2011,Iya ah mudiknya ke hatimu aja  RT   deuuuuuh kehati aku 
wputriayu,Fri Aug 26 16:04:38 IST 2011,Kehatimu nis - RT   paw mudik ke lampungg
wputriayu,Fri Aug 26 16:03:19 IST 2011,Ngebuuuutt  RT  Busyet cepet amaatRT  Lampung shiiif hehehe RT  Udah dimanaRT  Iyaa tp
wputriayu,Fri Aug 26 16:01:02 IST 2011,RT  RT  Pendek adalah tinggi yg tertundaberarti tinggi aku ketunda˘⌣˘
wputriayu,Fri Aug 26 16:00:27 IST 2011,Lampung shiiif hehehe RT  Udah dimanaRT  Iyaa tp kadang2 sos  RT  Dapet sinyal Naha bisa RT
wputriayu,Fri Aug 26 15:51:55 IST 2011,Iyaa tp kadang2 sos  RT  Dapet sinyal Naha bisa RT  Udah dikapal shiiff hehehe RT  Udah nyampe mana
wputriayu,Fri Aug 26 12:46:05 IST 2011,Udah dikapal shiiff hehehe RT  Udah nyampe mana Ke pelabuhan paw 
wputriayu,Fri Aug 26 12:36:10 IST 2011,RT  Mantap nih yg ini wkwk RT  RT  RT  flashback villa w/ °\▿/°
wputriayu,Fri Aug 26 12:27:47 IST 2011,RT  RT  flashback villa w/ °\▿/°
wputriayu,Fri Aug 26 11:43:06 IST 2011,RT-  Sama sama geulis ˘⌣˘ε˘ RT  Amiiin makasih geulis ♥´⌣ʃƪ RT  Hey geulis hati hati di
wputriayu,Fri Aug 26 11:15:25 IST 2011,Amiiin makasih geulis ♥´⌣ʃƪ RT  Hey geulis hati hati di jalaaaan yap ♥ ´⌣ʃƪ   semoga selamat sampe tujuan
wputriayu,Fri Aug 26 08:41:07 IST 2011,Iyaa makasih bebep♡♡ RT  Hati2 dijalaaaaaan semoga selamat sampe palembang yaa♥♡ 
wputriayu,Fri Aug 26 06:02:34 IST 2011,Im Rest Area KM 62 Jalan Tol Jakarta - Cikampek Cikampek 
wputriayu,Thu Aug 25 11:50:06 IST 2011,RT  RT  Paranirmal activity 5 serem parah
wputriayu,Wed Aug 24 18:09:34 IST 2011,Im Kimia farma Buah Batu Jln Buah Batu Bandung 
wputriayu,Wed Aug 24 18:09:34 IST 2011,I unlocked Explorer badge  
wputriayu,Wed Aug 24 16:43:39 IST 2011,Lagi di bip ta RT  RT  Im Bandung Indah Plaza Jalan Merdeka No 56 Bandung w/ 7 others 
wputriayu,Wed Aug 24 15:56:38 IST 2011,Im Bandung Indah Plaza Jalan Merdeka No 56 Bandung w/ 7 others 
wputriayu,Wed Aug 24 15:55:07 IST 2011,Si shifa cantik 
wputriayu,Wed Aug 24 15:44:07 IST 2011,RT  With     bip 
wputriayu,Wed Aug 24 09:38:18 IST 2011,RT  Paw paw cek bbm 
wputriayu,Wed Aug 24 09:20:22 IST 2011,RT-  iya bangeeet putri -RT  Iya taa Maafin aku juga yaa - RT  Ehudh mau lebaran maafin ya kalo http
wputriayu,Wed Aug 24 06:31:05 IST 2011,Iya taa Maafin aku juga yaa - RT  Ehudh mau lebaran maafin ya kalo ada salah yg disengaja atau ngga D  
wputriayu,Wed Aug 24 06:29:24 IST 2011,RT  Siaaap  Ơ̴̴̴̴̴̴̮͡Ơ̴̴͡  RT  Besok jadi yahhh Ơ̴̴̴̴̴̴̮͡Ơ̴̴͡  
wputriayu,Wed Aug 24 03:18:04 IST 2011,RT  Flashback 303 sama      sandhy  ngakak deh inget 303
wputriayu,Tue Aug 23 13:19:47 IST 2011,Im Ganesha Operation Buah Batu w/  
wputriayu,Tue Aug 23 08:16:04 IST 2011,RT  Sama sama RT  Makasiih RT  Followed yaa RT  Followback yaa 
wputriayu,Tue Aug 23 08:01:13 IST 2011,Makasiih RT  Followed yaa RT  Followback yaa 
wputriayu,Tue Aug 23 07:54:25 IST 2011,Followback yaa 
wputriayu,Tue Aug 23 05:25:33 IST 2011,Sama2 - RT  Makasih ka RT  Followed - RT  Ka  minta folbacknya makasih ka
wputriayu,Tue Aug 23 05:06:47 IST 2011,Followed - RT  Ka  minta folbacknya makasih ka
wputriayu,Tue Aug 23 04:47:51 IST 2011,RT  Rada kompak saeutik atuh c209
wputriayu,Tue Aug 23 04:42:58 IST 2011,RT♡  Iyaa samasama geuliis hehe RT  Makasih gemi yg lebiiih♡ RT   cantik avanya puuut ♥
wputriayu,Tue Aug 23 04:40:55 IST 2011,Makasih gemi yg lebiiih♡ RT   cantik avanya puuut ♥
wputriayu,Tue Aug 23 04:33:30 IST 2011,Yaah Kenapa RT  Gajadi bubarnya zzzz       dll
wputriayu,Mon Aug 22 15:37:29 IST 2011,Sama22 - RT  makasih teh ---RT  Followed yaa - RT vauliaaazakiahs teh  minta follbacknyaa --
wputriayu,Mon Aug 22 15:32:57 IST 2011,Followed yaa - RT  teh  minta follbacknyaa -- [Like  ]
