username,time,tweet
WomenOfHistory,Tue Mar 01 05:08:00 IST 2016,Every scar story Dont afraid tell
WomenOfHistory,Tue Mar 01 04:16:31 IST 2016,Faith belief God want It belief God right
WomenOfHistory,Tue Mar 01 03:30:58 IST 2016,You   deserve best 
WomenOfHistory,Tue Mar 01 03:26:04 IST 2016,Fake friends believe rumors Real friends believe
WomenOfHistory,Tue Mar 01 02:43:00 IST 2016,RT  Amen 
WomenOfHistory,Tue Mar 01 02:34:45 IST 2016,People meant together always find way back
WomenOfHistory,Tue Mar 01 01:43:30 IST 2016,Happiness found stop comparing yourself people
WomenOfHistory,Tue Mar 01 00:52:54 IST 2016,Knowledge knowing tomato fruit Wisdom putting fruit salad
WomenOfHistory,Tue Mar 01 00:17:09 IST 2016,RT  Dad Plays Baby A Lullaby And What Happens Next Is So Beautiful It Took Our Breath Away   
WomenOfHistory,Tue Mar 01 00:01:44 IST 2016,Dont speak unless improve silence
WomenOfHistory,Mon Feb 29 23:42:16 IST 2016,RT  The past changed forgotten edited erased accepted
WomenOfHistory,Mon Feb 29 23:10:42 IST 2016,Surround yourself those bring out best stress
WomenOfHistory,Mon Feb 29 22:19:38 IST 2016,Commitment means staying loyal going long mood left commitment
WomenOfHistory,Mon Feb 29 21:43:45 IST 2016,RT Women Worry ends faith begins
WomenOfHistory,Mon Feb 29 21:28:37 IST 2016,True love fine wine older better - Fred Jacob
WomenOfHistory,Mon Feb 29 20:43:41 IST 2016,RT  God knows better anyone thats one love He
WomenOfHistory,Mon Feb 29 20:38:00 IST 2016,People forget people forget people never forget made feel
WomenOfHistory,Mon Feb 29 19:46:30 IST 2016,If whole world blind many people impress
WomenOfHistory,Mon Feb 29 18:56:05 IST 2016,I never stop caring decide push away I go
WomenOfHistory,Mon Feb 29 18:04:48 IST 2016,Prove yourself yourself others
WomenOfHistory,Mon Feb 29 18:02:00 IST 2016,RT  Kitten kisses Does better Go here purchase -- 
WomenOfHistory,Mon Feb 29 17:14:09 IST 2016,Life perfect wonderful
WomenOfHistory,Mon Feb 29 16:22:34 IST 2016,Choose job love  never work day life - Confucius
WomenOfHistory,Mon Feb 29 15:31:38 IST 2016,Missing someone being see worst feeling
WomenOfHistory,Mon Feb 29 14:40:31 IST 2016,Sometimes people expect kick youre down ones help back up
WomenOfHistory,Mon Feb 29 13:49:37 IST 2016,Life party hoped here dance
WomenOfHistory,Mon Feb 29 12:58:54 IST 2016,When youre happy enjoy music youre sad understand lyrics
WomenOfHistory,Mon Feb 29 12:08:03 IST 2016,Action expresses priorities
WomenOfHistory,Mon Feb 29 11:16:43 IST 2016,Do look fell slipped
WomenOfHistory,Mon Feb 29 10:26:00 IST 2016,Trust yourself Create kind self happy live life - Golda Meir
WomenOfHistory,Mon Feb 29 10:16:54 IST 2016,RT Gospels Join community VISITING -  Sign up daily emails 
WomenOfHistory,Mon Feb 29 09:34:49 IST 2016,A secret happiness letting situation instead think making best
WomenOfHistory,Mon Feb 29 09:31:00 IST 2016,I love   
WomenOfHistory,Mon Feb 29 08:46:36 IST 2016,RT Sports Nobodys natural You work hard good work better -Paul Coffey
WomenOfHistory,Mon Feb 29 08:44:49 IST 2016,If want know mans take good look treats inferiors equals
WomenOfHistory,Mon Feb 29 07:52:54 IST 2016,Never give up hope never know still happen
WomenOfHistory,Mon Feb 29 07:43:42 IST 2016,RT  If judge people time love
WomenOfHistory,Mon Feb 29 07:01:33 IST 2016,Forgiving someone easy being trust again totally different story
WomenOfHistory,Mon Feb 29 06:53:26 IST 2016,RT  Puppy Kisses Is shirt Do want one Go here --  
WomenOfHistory,Mon Feb 29 06:10:45 IST 2016,Can remember before world told
WomenOfHistory,Mon Feb 29 05:19:38 IST 2016,Just doesnt mean
WomenOfHistory,Mon Feb 29 04:29:02 IST 2016,Things turn out best those make best out way things turn out
WomenOfHistory,Mon Feb 29 03:37:31 IST 2016,I walk slowly I never walk backwards
WomenOfHistory,Mon Feb 29 03:30:58 IST 2016,I   THANKFUL 
WomenOfHistory,Mon Feb 29 02:46:40 IST 2016,Forgive even theyre sorry
WomenOfHistory,Mon Feb 29 01:55:54 IST 2016,Worrying take away tomorrows troubles takes away todays peace
WomenOfHistory,Mon Feb 29 01:04:37 IST 2016,Life learning yesterday living today hoping tomorrow
WomenOfHistory,Mon Feb 29 00:13:46 IST 2016,The problem problem The problem attitude problem
WomenOfHistory,Sun Feb 28 23:22:37 IST 2016,The strongest people those show strength front those win battles know nothing
WomenOfHistory,Sun Feb 28 22:31:50 IST 2016,Take first step faith You dont see whole staircase take first step
