username,time,tweet
chocolatierLL,Tue Mar 01 05:29:38 IST 2016,A classic Singer Actress Mom Beauty queen sort Class act breathtaking BlackHottiesMonth  
chocolatierLL,Tue Mar 01 05:28:16 IST 2016,I indeed Saved Best Last everyone Vanessa Williams crush decades  BHM 
chocolatierLL,Tue Mar 01 05:27:00 IST 2016,28 stunning names listed Leap Year gave one extra day honor one more BlackHottiesMonth wraps up now
chocolatierLL,Tue Mar 01 04:52:05 IST 2016,Have doofus hipsters figured out way vape cider
chocolatierLL,Tue Mar 01 01:17:03 IST 2016,Who beBlackHottiesMonth
chocolatierLL,Mon Feb 29 18:15:30 IST 2016,I bet furries walk Build-a-Bear Workshop massively aroused
chocolatierLL,Mon Feb 29 08:48:08 IST 2016,At rate wrapping up Oscars2016 Tuesday
chocolatierLL,Mon Feb 29 08:38:28 IST 2016,Minions make everything better Oscars2016
chocolatierLL,Mon Feb 29 08:01:32 IST 2016,
chocolatierLL,Mon Feb 29 08:01:26 IST 2016,
chocolatierLL,Mon Feb 29 08:00:13 IST 2016,When Benicio Del Toro going star David Johansen story
chocolatierLL,Mon Feb 29 07:54:18 IST 2016,I good feeling Martian thing Oscars2016 
chocolatierLL,Mon Feb 29 07:36:14 IST 2016,Hey BHMs 11  guy ripped  pay damages Oscars2016
chocolatierLL,Mon Feb 29 07:20:04 IST 2016,Ok crawl thank yous distracting I keep thinking schools closed theres blizzard Oscars2016
chocolatierLL,Mon Feb 29 07:08:37 IST 2016,Loving ChrisRock open Got LOT people squirming Oscars2016
chocolatierLL,Mon Feb 29 07:03:15 IST 2016,If Minions Ted dont win something riot Oscars2016
chocolatierLL,Mon Feb 29 06:54:30 IST 2016,The Dick Poop Oscar Flub Was Just The Beginning - CONAN TBS - YouTube old times sake DickPoop Oscars  
chocolatierLL,Mon Feb 29 06:37:05 IST 2016,I think Kevin Hart IS Oscar
chocolatierLL,Mon Feb 29 06:16:02 IST 2016,Ill best keep Oscars lively I bad feeling w/this years movies May Hollywood version Monday Night Raw
chocolatierLL,Mon Feb 29 06:09:55 IST 2016,TWilson  apologies I stand corrected
chocolatierLL,Mon Feb 29 05:50:13 IST 2016,Who Whos left Minimal clues given-who figure out  BlackHottiesMonth 
chocolatierLL,Mon Feb 29 05:49:15 IST 2016,Tonight 2-29 recap FB preparation tomorrows Leap Day announcement 1 BlackHottiesMonth 
chocolatierLL,Mon Feb 29 05:47:53 IST 2016,All props  tonight 2 Heres hoping long glorious career BHM 
chocolatierLL,Mon Feb 29 05:46:47 IST 2016,A model wrestling announcer Masters Degree Journalism Are kidding Speechless BlackHottiesMonth 
chocolatierLL,Mon Feb 29 05:45:35 IST 2016,Cody Rhodes surely one luckiest men planet  BlackHottiesMonth 
chocolatierLL,Mon Feb 29 05:44:50 IST 2016,I present 2 breathtaking  Eden Stiles Top placing wrestling star list BHM 
chocolatierLL,Mon Feb 29 05:43:18 IST 2016,Ok I tonights 2 BlackHottiesMonth shocker Its deserved shes huge star
chocolatierLL,Mon Feb 29 05:00:36 IST 2016,Tonight Ill wearing Black Decker accessories Lea Perrins Oscars
chocolatierLL,Mon Feb 29 04:39:58 IST 2016,Is anything less Italian Olive Garden
chocolatierLL,Mon Feb 29 02:19:33 IST 2016,  dont give Bacon Funyuns soon Ima cut bitch
chocolatierLL,Mon Feb 29 02:15:40 IST 2016,Final grades Korean BBQ-AEI Gouda n Chive-AEI Fiery Habanero-A Olive Oil n Herb-AE A meh collection  
chocolatierLL,Mon Feb 29 00:39:03 IST 2016,  Im big fan Cottondale wheres vest 
chocolatierLL,Sun Feb 28 23:13:03 IST 2016,Do think Chris Rock make race jokes tonight hosting Oscars Im putting over/under 17 1/2
chocolatierLL,Sun Feb 28 21:12:55 IST 2016,Why still Presidents Day sales going Let go mattress car companies
chocolatierLL,Sun Feb 28 20:57:15 IST 2016,Just saw commercial Oriental rugs Pretty sure rugs prefer called Asian rugs Gonna lovely Russian rug Kumbaya
chocolatierLL,Sun Feb 28 19:37:26 IST 2016,Still sure rogues gallery Im going vote Ted Cruz looking Grandpa Munster helping cause
chocolatierLL,Sun Feb 28 07:07:09 IST 2016,Tomorrow 2 absolute shockerbut now props HalleBerry being time classic BHM 
chocolatierLL,Sun Feb 28 07:05:41 IST 2016,The question HalleBerry 3 possibly top top 2 spots BlackHottiesMonth 
chocolatierLL,Sun Feb 28 07:04:42 IST 2016,Who knew star BAPS going go win Oscar  3rd place BlackHottiesMonth countdown 
chocolatierLL,Sun Feb 28 07:03:38 IST 2016,Breathtaking stunning timeless If appear high list worthless HalleBerry BHM 
chocolatierLL,Sun Feb 28 07:02:44 IST 2016,There BlackHottiesMonth without classic beauty Miss Halle Berry 3 
chocolatierLL,Sun Feb 28 06:20:32 IST 2016,That green hair look very sexy girls On others I wanna Excuse me-youve green crap hair
chocolatierLL,Sun Feb 28 06:06:58 IST 2016,  imbeciles truly need out mothers basements jobs Meltz
chocolatierLL,Sun Feb 28 05:55:51 IST 2016,Somebody wearing hood obliviously walked right Its idiots know
chocolatierLL,Sat Feb 27 09:20:16 IST 2016,I aspire one day classy enough pronounce word literally litrally
chocolatierLL,Sat Feb 27 06:50:11 IST 2016,Oh yeah s nice smile Tomorrow time classic 3 BlackHottiesMonth 
chocolatierLL,Sat Feb 27 06:47:34 IST 2016,When Oos I OH I knew Funkadactyl days dreamy  BlackHottiesMonth 
chocolatierLL,Sat Feb 27 06:45:54 IST 2016,Great athlete Stunning looks Good enough ring went lovable face vile heel  
chocolatierLL,Sat Feb 27 06:45:02 IST 2016,The lovely Mrs Jimmy and/or Jay Uso easily comes very high list compadres know BHM  
chocolatierLL,Sat Feb 27 06:44:01 IST 2016,People gonna SHOCKED  places 4th BlackHottiesMonth countdown 
