username,time,tweet
inkopolis,Tue Mar 01 05:29:42 IST 2016,howd yen sid lose title master possess keyblade use stroke beard
inkopolis,Tue Mar 01 05:24:28 IST 2016, kh stupid barely makes sense love
inkopolis,Tue Mar 01 05:23:58 IST 2016, know technically right way
inkopolis,Tue Mar 01 05:17:31 IST 2016,RT taka Wow SEGA survey really something 
inkopolis,Tue Mar 01 05:17:01 IST 2016,RT gtaka072 俺、ポケモンセンターのお姉さんをこんな感じのバケモノと思ってました 
inkopolis,Tue Mar 01 05:16:46 IST 2016,RT  
inkopolis,Tue Mar 01 05:16:34 IST 2016,RT  Everyone deserves looked way Leo looks cookie 
inkopolis,Tue Mar 01 04:28:43 IST 2016,RT  Happy LeapDay 
inkopolis,Tue Mar 01 03:23:51 IST 2016,RT  Uhh doesnt look despair Vegetas face 
inkopolis,Tue Mar 01 03:22:03 IST 2016,RT  Casual reminder Minions actively seek out evil being planet serve 
inkopolis,Tue Mar 01 02:39:09 IST 2016,RT  Donkey Kong Country Diddys Kong QuestDonkey Kong Country Diddys Birth Right
inkopolis,Tue Mar 01 02:16:19 IST 2016, omg way seriously id cry
inkopolis,Tue Mar 01 02:15:04 IST 2016,RT eng Shine Black Pearl SR Chiaki Kurokawa Full Cards 
inkopolis,Tue Mar 01 02:12:35 IST 2016,NATALIAAAAAAAAAAAAAAAAAAAAAAAAAAAAAAA
inkopolis,Tue Mar 01 02:12:27 IST 2016,RT eng Arabian Nights Dancer SR Natalia Full Cards 
inkopolis,Tue Mar 01 02:11:18 IST 2016, ansatsu kyoushitsuif guys havent read please
inkopolis,Tue Mar 01 02:11:00 IST 2016,theres 3 more chapters ansatsy kyoushitsu left literally feel heart breaking
inkopolis,Tue Mar 01 02:10:08 IST 2016,RT eng Night Breeze Invitation SSR Kaede Takagaki Full Cards 
inkopolis,Tue Mar 01 01:18:02 IST 2016,phone try kill score cant kill god
inkopolis,Mon Feb 29 21:48:48 IST 2016,RT xxx はじめてのシルバニアファミリー 
inkopolis,Mon Feb 29 21:44:49 IST 2016, romantic date locations Clown Motel Next To Graveyard
inkopolis,Mon Feb 29 21:42:47 IST 2016,bonding over clown themed motels
inkopolis,Mon Feb 29 21:38:32 IST 2016,RT  DPtぴかぴかバッジ 
inkopolis,Mon Feb 29 17:37:24 IST 2016, granddad
inkopolis,Mon Feb 29 17:12:37 IST 2016,way victors counter counting down halloween again
inkopolis,Mon Feb 29 17:11:31 IST 2016,RT  【新作公開】☆ストロベリーガーデンシリーズ サンプル展示のお知らせ☆原宿店、名古屋店でのサンプル巡回が決定いたしました♪お近くのお客様は是非是非直接お手に取って下さい☆メタモル h…
inkopolis,Mon Feb 29 10:57:58 IST 2016, Wii Fit Trainer everything associate
inkopolis,Mon Feb 29 10:57:23 IST 2016,RT  people Ba ba ba ba   People hand wallet
inkopolis,Mon Feb 29 10:57:15 IST 2016, last guy kinda sexy
inkopolis,Mon Feb 29 10:56:47 IST 2016,RT  fucked up announced Leonardo Dicaprio guy ran stage grabbed trophy 
inkopolis,Mon Feb 29 10:53:19 IST 2016,RT  IDK WHO MADE THIS BUT IM CRYINGJS 
inkopolis,Mon Feb 29 10:52:56 IST 2016,RT  trying comfort friend accidentally making worse 
inkopolis,Mon Feb 29 10:52:01 IST 2016,RT  propose Bussiness offer boy saysDamn daniel grace company  wife tw…
inkopolis,Mon Feb 29 10:46:23 IST 2016, portal 2 one favorite games time  everything perfect makes wanna cry
inkopolis,Mon Feb 29 10:45:35 IST 2016, rhythm heavenwhat truly Gamingid pour millions hours those games hesitation already
inkopolis,Mon Feb 29 10:43:46 IST 2016, GIRLS ATTRACTIVE GIRLS UNATTRACTIVE GIRLS SHORT GIRLS TALL GIRLS GIRLS ARE AMAZING
inkopolis,Mon Feb 29 10:43:01 IST 2016, kingdom hearts fucks up dont understand plot anymore thanks kh ddd ill damned dont love
inkopolis,Mon Feb 29 10:42:21 IST 2016, playing old things really liked younger-- nostalgic feeling gives really takes back
inkopolis,Mon Feb 29 10:40:57 IST 2016,RT  yes
inkopolis,Mon Feb 29 10:40:41 IST 2016, LEAKED FOOTAGE OF WILL IN NEW YORK[a video kicking ass smash]
inkopolis,Mon Feb 29 10:40:15 IST 2016,RT  FUCK
inkopolis,Mon Feb 29 10:40:04 IST 2016, drawing  makes feel relaxed problem sometimes draw much hand hurts
inkopolis,Mon Feb 29 10:39:15 IST 2016, PORTAL 2 brought out funks many times ive replayed point nearly recite
inkopolis,Mon Feb 29 10:38:28 IST 2016, friends pals select family members boyfriend etc yall make happy
inkopolis,Mon Feb 29 10:35:30 IST 2016,RT  Oscars 
inkopolis,Mon Feb 29 10:34:58 IST 2016,RT  Leonardo DiCaprio Morphs Back Into Hairy Overweight Iowan After Finally Receiving Oscar  
inkopolis,Mon Feb 29 10:34:45 IST 2016,RT  Leonardo DiCaprio Kisses Bear Before Going Up To Receive Oscar  Oscars 
inkopolis,Mon Feb 29 10:34:41 IST 2016, main character guy died cant remember names watched movie see ship crash
inkopolis,Mon Feb 29 10:34:07 IST 2016,Rose HE GON BE BROKE NOW SON
