username,time,tweet
AboutVirgos,Tue Mar 01 05:17:04 IST 2016,As Virgo You manage without something value simply isnt
AboutVirgos,Tue Mar 01 05:01:12 IST 2016,RT  If You Have A Mole At One Of These 7 Places On Your Body This Is What It Means  
AboutVirgos,Tue Mar 01 05:00:13 IST 2016,RT  Heres How Kylie Jenner Looks Without Makeup Her Skin Is Horrible  
AboutVirgos,Tue Mar 01 04:47:14 IST 2016,Virgos compromise love never run over
AboutVirgos,Tue Mar 01 04:17:05 IST 2016,Virgos speak mind tell
AboutVirgos,Tue Mar 01 03:47:03 IST 2016,Virgos know dont something youve done wont up leave keep up
AboutVirgos,Tue Mar 01 03:17:00 IST 2016,Virgos always think people going feel They constantly put others before themselves
AboutVirgos,Tue Mar 01 03:01:03 IST 2016,RT  Girl On Snapchat Makes Epic Guide For Guys Who Send Dck Pics  
AboutVirgos,Tue Mar 01 03:00:12 IST 2016,RT  Answers To Things Youve Always Wondered About  
AboutVirgos,Tue Mar 01 02:47:08 IST 2016,Virgos dont hard time forgiving They hard time continuing relationship exactly
AboutVirgos,Tue Mar 01 02:17:06 IST 2016,Virgos special talent making partner feel cherished cared
AboutVirgos,Tue Mar 01 01:47:19 IST 2016,Dont drop hints Virgo Theyre busy notice theyre ignoring until come forward
AboutVirgos,Tue Mar 01 01:17:00 IST 2016,Virgos loyal people trust
AboutVirgos,Tue Mar 01 01:01:07 IST 2016,RT  Sensual Sex Tips For Men  Women  
AboutVirgos,Tue Mar 01 01:00:33 IST 2016,RT  How To Lose 5 Pounds In 7 Days Recipe Included  
AboutVirgos,Tue Mar 01 00:47:04 IST 2016,Virgo appreciate little things more anything
AboutVirgos,Tue Mar 01 00:17:10 IST 2016,Even virgo down somewhere inside mind still high hopes themselves
AboutVirgos,Mon Feb 29 23:47:09 IST 2016,Virgos dont play games relationships They want simply wont waste time
AboutVirgos,Mon Feb 29 23:17:07 IST 2016,A Virgos honesty mistaken rudeness
AboutVirgos,Mon Feb 29 23:01:29 IST 2016,RT  He Killed His Girl By Penetrating Her With A Cucumber Now Hes On Trial  
AboutVirgos,Mon Feb 29 23:00:50 IST 2016,RT  65-Year-Old Man Poses With His 12-Year-Old Bride In Times Square  
AboutVirgos,Mon Feb 29 22:47:11 IST 2016,There times piss virgo wont even know They wont give benefit know buttons work
AboutVirgos,Mon Feb 29 22:17:03 IST 2016,Virgos tend stay relationships longer simply dont want give up walk away
AboutVirgos,Mon Feb 29 21:47:06 IST 2016,Virgos clever witty sarcastic
AboutVirgos,Mon Feb 29 20:47:09 IST 2016,The edge Virgo over zodiac signs Virgos mature faster emotionally mentally
AboutVirgos,Mon Feb 29 19:47:08 IST 2016,Virgo wait years right person
AboutVirgos,Mon Feb 29 18:47:38 IST 2016,Virgos dont many people close people find never want lose friendship
AboutVirgos,Mon Feb 29 13:47:03 IST 2016,Virgo dont chase people If want youll
AboutVirgos,Mon Feb 29 12:17:03 IST 2016,The little things everything Virgo The little details going right wrong determine Virgos whole mindset
AboutVirgos,Mon Feb 29 11:47:08 IST 2016,Virgo wouldnt waste breath hate If dont dont exist
AboutVirgos,Mon Feb 29 11:17:01 IST 2016,One day Virgo start sending mixed signals youll mad finally learned play game
AboutVirgos,Mon Feb 29 10:47:03 IST 2016,Virgos slow love strong
AboutVirgos,Mon Feb 29 10:17:10 IST 2016,Virgos pay attention EVERYTHING
AboutVirgos,Mon Feb 29 10:01:12 IST 2016,RT  His Wife Snapchatted Him From Her Hotel Room What He Saw Picture Led Divorce  https…
AboutVirgos,Mon Feb 29 10:00:18 IST 2016,RT  Did You Ever Wonder How A Girl Sees Her Body  
AboutVirgos,Mon Feb 29 09:47:03 IST 2016,Virgos few friends lot acquaintances They dont put trust many
AboutVirgos,Mon Feb 29 09:17:10 IST 2016,Virgos independent find hard ask another help
AboutVirgos,Mon Feb 29 08:47:08 IST 2016,Virgos use ignoring diversion drama youre trying bring day
AboutVirgos,Mon Feb 29 08:32:03 IST 2016,RT  Paris Hilton Is Still Super-Hot  
AboutVirgos,Mon Feb 29 08:31:04 IST 2016,RT  Clearly Every Man Needs A Maid  
AboutVirgos,Mon Feb 29 08:17:01 IST 2016,You always tell Virgo bad mood looking face
AboutVirgos,Mon Feb 29 07:47:01 IST 2016,Virgos dont allow emotions show feelings come out strong possibility really love
AboutVirgos,Mon Feb 29 07:17:05 IST 2016,As Virgos always try make sense everything things dont add up frustrates
AboutVirgos,Mon Feb 29 07:01:01 IST 2016,RT  Sex Facts For All You Kinky Freaks  
AboutVirgos,Mon Feb 29 07:00:28 IST 2016,RT  Science Tells Us Why Girls Nipples Get Hard  
AboutVirgos,Mon Feb 29 06:47:09 IST 2016,Virgos usually intensely supportive considerate attentive affectionate relationships
AboutVirgos,Mon Feb 29 06:17:07 IST 2016,People think Virgos dont emotions They hard time finding someone trust enough show
AboutVirgos,Mon Feb 29 06:01:18 IST 2016,RT  Wild Moms No Daughter Should Copy  
AboutVirgos,Mon Feb 29 06:00:14 IST 2016,RT  Historical Images That Will Leave You Speechless  
AboutVirgos,Mon Feb 29 05:47:10 IST 2016,Virgos days hate everyone dont take personally
