username,time,tweet
ReyonnaG,Sun Mar 20 05:29:59 IST 2016,RT  Despite masculine features BLACK PYRAMID line UNISEX sizes XS -4X ❤️🙏🏼
ReyonnaG,Sun Mar 20 05:29:52 IST 2016,RT  EUROPE Im bringing One Hell Of A Nite Tour guys May/June Visit  tickets https/…
ReyonnaG,Sun Mar 20 05:29:07 IST 2016,RT  Pop Will The Master TeAcherLast nights Topic Life Lessons Love  Being STRONG💪🏽Men 
ReyonnaG,Sun Mar 20 05:29:02 IST 2016,RT  3KINGS 
ReyonnaG,Sun Mar 20 05:28:58 IST 2016,RT  Just posted photo 
ReyonnaG,Tue Mar 15 05:03:21 IST 2016,RT  Callie heyyy  
ReyonnaG,Tue Mar 15 05:03:17 IST 2016,RT  Just posted video 
ReyonnaG,Tue Mar 15 05:03:11 IST 2016,RT  Just posted video 
ReyonnaG,Tue Mar 15 05:03:08 IST 2016,RT  When late night hype thinking bout gone 🐱👅 
ReyonnaG,Tue Mar 15 05:03:06 IST 2016,RT  Just posted photo 
ReyonnaG,Tue Mar 15 05:03:03 IST 2016,RT  Talk Talk 
ReyonnaG,Tue Mar 15 05:03:01 IST 2016,RT  Just posted photo 
ReyonnaG,Tue Mar 15 05:02:58 IST 2016,RT  Just posted video 
ReyonnaG,Tue Mar 15 05:02:51 IST 2016,RT  This world dirty You stay focused YOU keep clean heart 
ReyonnaG,Tue Mar 15 05:02:29 IST 2016,RT  TeamBreezy Stream BackToSleep Remix now  Royalty
ReyonnaG,Tue Mar 15 05:02:28 IST 2016,RT  Download BackToSleep REMIX ft    Royalty  
ReyonnaG,Tue Mar 15 05:02:23 IST 2016,RT  Watch BackToSleep  now  
ReyonnaG,Tue Mar 15 05:02:13 IST 2016,RT  Guest  Givenchy Riccardo Tisci Fall Winter 16 Womens Show Paris 
ReyonnaG,Tue Mar 15 05:02:10 IST 2016,RT  DRAIS March 12th  draislive Tickets  
ReyonnaG,Tue Mar 15 05:02:08 IST 2016,RT  Stream Royalty  -  
ReyonnaG,Tue Mar 15 05:01:56 IST 2016,RT  DRAIS TONIGHT  draislive Tickets  
ReyonnaG,Tue Mar 15 05:01:53 IST 2016,RT  Watch BackToSleep  now  
ReyonnaG,Tue Mar 15 05:01:48 IST 2016,RT  Starting really lose hope caring much giving damn DRAINED  time wit negative society …
ReyonnaG,Thu Mar 03 17:39:29 IST 2016,RT  Thank  supporting ROYALTY concert series Appreciate love  
ReyonnaG,Thu Mar 03 17:39:20 IST 2016,RT  RIGHT NOW  Royalty Album Release Party Watch here  
ReyonnaG,Thu Mar 03 17:39:14 IST 2016,RT  ROYALTY out now Support brother  yall now Im proud CB  
ReyonnaG,Thu Mar 03 17:39:06 IST 2016,RT  Purchase ROYALTY now  1 album donated     https/…
ReyonnaG,Thu Mar 03 17:39:00 IST 2016,RT  BringRoyaltyHomeForTheHolidays Get new album Royalty right now  Music 
ReyonnaG,Thu Mar 03 17:38:53 IST 2016,RT  LITTLE MORE Royalty available now  
ReyonnaG,Thu Mar 03 17:38:45 IST 2016,RT  ROYALTY  1010 PT Watch show LIVE   YahooLive 
ReyonnaG,Thu Mar 03 17:38:23 IST 2016,RT  1 Urban radio Thank support Team Breezy BackToSleep 
ReyonnaG,Thu Mar 03 17:38:19 IST 2016,RT  HEARD ABOUT THE STORM IN MY HOMETOWN I pray everyone including family OK Whatever I support …
ReyonnaG,Thu Mar 03 17:38:17 IST 2016,RT  Stream BackToSleep Remix now  Royalty 
ReyonnaG,Thu Mar 03 17:38:12 IST 2016,RT  NICK CANNON 🙏🏼🔥
ReyonnaG,Thu Mar 03 17:38:09 IST 2016,RT   PENG Big tune respect
ReyonnaG,Thu Mar 03 17:38:06 IST 2016,RT  Tune watch bro  along friends show AboutTheBusiness tonight BET 10p/9C
ReyonnaG,Wed Mar 02 18:05:13 IST 2016,RT  I hope life really treating well   youre loosing become rich loss
ReyonnaG,Mon Feb 29 01:09:46 IST 2016,RT  Download latest ROYALTY Expressers here   
ReyonnaG,Mon Feb 29 01:09:42 IST 2016,RT  Download today BackToSleep ROYALTY 
