username,time,tweet
TheFoodieMama,Thu Sep 01 05:29:52 IST 2011,Ok I think I already know wins Im watching final two episodes MasterChef anyway No spoilers folks
TheFoodieMama,Thu Sep 01 04:11:04 IST 2011,Awesome tips chefs 
TheFoodieMama,Thu Sep 01 00:36:25 IST 2011,YUMMO Thank The Bread Lady inspiring work yeast again 
TheFoodieMama,Thu Sep 01 00:10:35 IST 2011,Check out The Bread Lady tips things yeast 
TheFoodieMama,Wed Aug 31 22:18:52 IST 2011,Hellooooooooooo Anyone home  Havent heard anyone few days I miss Fellow FoodiesWhats dinner tonight
TheFoodieMama,Wed Aug 31 19:50:40 IST 2011,I love feature facebook shows youve posted previouslyGives many dinner 
TheFoodieMama,Wed Aug 31 08:47:40 IST 2011,The Hubbs 2 root canals homemade soup dinner tonight Tomato Basil BisqueYUM
TheFoodieMama,Wed Aug 31 08:46:46 IST 2011,Tomato Basil Bisque 
TheFoodieMama,Wed Aug 31 00:05:51 IST 2011,My brain Im tummy saying Im literally starvingLets food place pronto
TheFoodieMama,Tue Aug 30 20:01:07 IST 2011,The Hubbs I night alone last night grandparents took The Kiddo impromptu slumber party 
TheFoodieMama,Tue Aug 30 19:58:25 IST 2011,Sneak peak 3 
TheFoodieMama,Tue Aug 30 09:32:24 IST 2011,Sneak peak 2 
TheFoodieMama,Tue Aug 30 09:23:27 IST 2011, Foodie friends 
TheFoodieMama,Mon Aug 29 19:32:55 IST 2011,Sneak peak day The Bread Lady 
TheFoodieMama,Sun Aug 28 02:38:26 IST 2011,Ooh phone The Bread LadyCan I I going gain 20 lbs tomorrow And I 
TheFoodieMama,Sat Aug 27 21:04:11 IST 2011,Stay tunedThe Bread Lady I getting together tomorrowYeast bread tutorials lots yummy yummy carbs comin
TheFoodieMama,Sat Aug 27 09:12:15 IST 2011,Manicotti basil bechemel sauceYum-o 
TheFoodieMama,Sat Aug 27 06:54:48 IST 2011,Ooh inspired dinnerStay tuned
TheFoodieMama,Sat Aug 27 04:03:16 IST 2011,I sweet tooth today 
TheFoodieMama,Sat Aug 27 03:14:11 IST 2011,Black Magic Cake Best Chocolate Cake Ever 
TheFoodieMama,Sat Aug 27 00:46:16 IST 2011,Oh many ideas one 
TheFoodieMama,Fri Aug 26 19:46:34 IST 2011,On day 2010 I posted Made yummy waistline busting cinnamon rolls Totally worth Soooooo 
TheFoodieMama,Fri Aug 26 05:37:51 IST 2011,This gonna one yummy night 
TheFoodieMama,Fri Aug 26 02:44:25 IST 2011,For those take pictures food 
TheFoodieMama,Thu Aug 25 03:38:26 IST 2011,Poll Spaghetti w/homemade marinara Chicken Penne Alfredo Florentine
TheFoodieMama,Thu Aug 25 01:44:51 IST 2011,While isnt one I normally make family secret cant share sorry one DELISH 
TheFoodieMama,Thu Aug 25 01:43:22 IST 2011,I leftover shepherds pie crumbled french onion sun chips top lunch today Dont judge 
TheFoodieMama,Wed Aug 24 00:40:22 IST 2011,The Kiddo ate tilapia I think needs national holiday Should I attempt pork No lets crazy
TheFoodieMama,Tue Aug 23 20:09:21 IST 2011,On day 2009 I posted Watching What Brian Boitono Make food networkhe cracks up 
TheFoodieMama,Tue Aug 23 07:21:23 IST 2011,How cook fish
TheFoodieMama,Mon Aug 22 20:11:32 IST 2011,MMM 
TheFoodieMama,Sat Aug 20 08:26:45 IST 2011,Quick - name one food couldnt live without
TheFoodieMama,Wed Aug 17 22:40:12 IST 2011,On stressful mornings one I wanna STOP bake something
TheFoodieMama,Tue Aug 16 07:45:28 IST 2011,Who grills house - husband/boyfriend wife/girlfriend
TheFoodieMama,Mon Aug 15 08:15:55 IST 2011,Chocolate Turtle Cake 
TheFoodieMama,Sun Aug 14 10:55:36 IST 2011,MasterChef getting gooooooooood
TheFoodieMama,Sun Aug 14 09:28:24 IST 2011,Who knew scaling fish nerve-wracking
TheFoodieMama,Sat Aug 13 10:13:51 IST 2011,ThisIsHeaven Thank  Rae 
TheFoodieMama,Sat Aug 13 08:25:09 IST 2011,Thought idea cheesecake inspired cupcakes - stay tuned pics
TheFoodieMama,Wed Aug 10 06:51:13 IST 2011,Sorry having AWOL last few daysBusy busy busy Anyone cook anything yummy lately
TheFoodieMama,Sun Aug 07 23:51:41 IST 2011,Any foodie fans south share fried chicken recipe Im impressed 
TheFoodieMama,Sun Aug 07 22:54:31 IST 2011,Watching 24 Hour Restaurant Battle - Caveman Theme Ugh - well see
TheFoodieMama,Sun Aug 07 20:34:18 IST 2011,Its National Panini Month - go celebrate having panini day
TheFoodieMama,Sun Aug 07 00:34:11 IST 2011,Root Beer Float Cake I Recipe Allrecipescom 
TheFoodieMama,Sun Aug 07 00:05:05 IST 2011,While I ALWAYS associate lemon pepper chicken I dont know I definitely trying 
TheFoodieMama,Sat Aug 06 23:51:17 IST 2011,What theThere Klondike Bars freezer I didnt know until now
TheFoodieMama,Thu Aug 04 06:44:26 IST 2011,Yes please 
TheFoodieMama,Thu Aug 04 06:43:27 IST 2011, 
TheFoodieMama,Thu Aug 04 06:39:43 IST 2011,Dinner tonight 
TheFoodieMama,Thu Aug 04 05:55:48 IST 2011,Seriously craving something one house eat Hmmm3 separate dinners Just maybe
