username,time,tweet
bigfatpeach,Thu Sep 01 05:29:34 IST 2011,Im Southampton staying lovely Val We open tomorrow Mayflower
bigfatpeach,Tue Aug 30 21:06:27 IST 2011,At Oxford Playhouse theatre first time Mint dressing room Never played here before Oxford buzzing  
bigfatpeach,Mon Aug 29 02:57:36 IST 2011,RT  Glass Rosé Manchester teams sticking London teams Lovely
bigfatpeach,Sun Aug 28 16:00:00 IST 2011,Its right working Sunday
bigfatpeach,Sat Aug 27 16:03:15 IST 2011,Congratulations newlyweds Mr Mrs Dalton Fantastic couple great bash
bigfatpeach,Wed Aug 24 22:28:58 IST 2011,Just claimed FREE whole chicken Nandos Get dinnergoingcheap
bigfatpeach,Tue Aug 23 22:23:16 IST 2011,Last chance see MR STINK East Midlands Im Nottingham Playhouse til Sunday Anyone missed Curve touch
bigfatpeach,Mon Aug 22 20:43:59 IST 2011,So sugar puffs make wee smell likesugar puffs
bigfatpeach,Fri Aug 19 17:30:01 IST 2011,Glorious sunshine Nottingham Not even nail tyre deflate well I nail tyre
bigfatpeach,Fri Aug 19 02:44:12 IST 2011,Brilliant Jedward stabbed pikey bloke First live death Big Brother
bigfatpeach,Fri Aug 19 02:32:22 IST 2011,Cantstopwatchingthistripearrrrrrrrgggggghhhhhhhh
bigfatpeach,Fri Aug 19 02:18:25 IST 2011,Very clever Channel 5 launching big brother random Thursday night absolutely nothing channels stillgash
bigfatpeach,Wed Aug 17 23:59:02 IST 2011,RT  Thought day - People weak follow dreams always find way discourage yours
bigfatpeach,Sat Aug 13 18:29:40 IST 2011,Come England finish em Number 1 world
bigfatpeach,Sat Aug 13 04:29:43 IST 2011, nightmare Its never bad Cant
bigfatpeach,Sat Aug 13 03:02:21 IST 2011,Errrrm The Faces Rob Brydon showamazing
bigfatpeach,Fri Aug 12 17:01:15 IST 2011,Excited hear Coldplays new album out October Yes Im massive fan proud
bigfatpeach,Fri Aug 12 16:56:07 IST 2011,Students next year average debts £50000 graduate due fees tripling Now theres incentive
bigfatpeach,Fri Aug 12 16:22:07 IST 2011,Come England Finish No 1 world
bigfatpeach,Thu Aug 11 00:36:01 IST 2011,Londoners using BBerrys chat meeting places riotsIf media outlet maybe tap those phones
bigfatpeach,Wed Aug 10 03:04:55 IST 2011, more world well Nottingham anyway
bigfatpeach,Wed Aug 10 02:53:09 IST 2011,RT  Message people Leicester stay calm stay proud stay strong  We excellent community spirit - make sure 
bigfatpeach,Sun Aug 07 05:59:17 IST 2011,What hell happening Tottenham Jeez
bigfatpeach,Sat Aug 06 21:45:36 IST 2011,Great result Leicester City Be great see back prem end season Maybe year
bigfatpeach,Sat Aug 06 17:02:35 IST 2011, Nice Work Rooney heres next chapter life x
bigfatpeach,Sat Aug 06 16:51:47 IST 2011,Where old friend Ive missed After such long summer come back life complete football
bigfatpeach,Fri Aug 05 19:48:39 IST 2011,So I went Press Club Manchester last nightas Errrr lets leave hole
bigfatpeach,Thu Aug 04 17:32:26 IST 2011,The Bolton News story Mr Stink easily act beacon education change way homeless people perceived
bigfatpeach,Thu Aug 04 15:05:11 IST 2011,RIP Bubba Smith Aka Hightower Police Academy
bigfatpeach,Tue Aug 02 22:57:53 IST 2011, unfortunately first day next venue Nottingham We finish 14th Thats shame
bigfatpeach,Tue Aug 02 22:53:03 IST 2011,At Lowry Salford two glorious weeks
bigfatpeach,Sun Jul 31 20:54:42 IST 2011,Despite missing family day out Clumber doing show driving agesIm now home celebrations begin 28 today
bigfatpeach,Sat Jul 30 21:49:43 IST 2011,Not bad place chill between shows  
bigfatpeach,Sat Jul 30 17:38:36 IST 2011,Last chance catch Mr Stink London weekend Were Kingston Rose until Sunday
bigfatpeach,Sat Jul 30 15:23:29 IST 2011,RT com F1 Poll RT pay sky sports watch Formula 1 2012
bigfatpeach,Fri Jul 29 15:49:33 IST 2011,replacelovewithmingeinasong Beegees - How deep minge
bigfatpeach,Thu Jul 28 17:05:23 IST 2011,RT   Thankyou - good luck rest tour My children loved
bigfatpeach,Thu Jul 28 14:16:34 IST 2011,Watched film Black Dynamite last night Anyone seem Ruddy hilarious
bigfatpeach,Wed Jul 27 01:46:05 IST 2011,Opening night KingstonRose Wonderful crowd - unique theatre
bigfatpeach,Mon Jul 25 20:18:36 IST 2011,RT 5starseaham We’re giving away free dinner bed breakfast package  worth £500 hit 1000 follower RT share win  
bigfatpeach,Mon Jul 25 02:19:51 IST 2011,Well went well Love Cardiff What manic week newtheatre
bigfatpeach,Mon Jul 25 02:11:12 IST 2011,RT   David Walliams Mr Stink - Live Stage Smells Of Success | Suite101com 
bigfatpeach,Thu Jul 21 21:42:00 IST 2011,The audiences generous Cardiff  So reviewers  
bigfatpeach,Thu Jul 21 20:33:33 IST 2011,Just chillin bay
bigfatpeach,Thu Jul 21 19:42:22 IST 2011, thinkin guys X 
bigfatpeach,Wed Jul 20 02:01:14 IST 2011, well was/is
bigfatpeach,Tue Jul 19 03:48:13 IST 2011, sadly I cant come Im touring I hear going Shampton I make doing leg
bigfatpeach,Tue Jul 19 03:29:56 IST 2011, I hear youre wowing crowds PPan ex-Chitty pals   phil Guille The Gooch Patch Ms Ray X
bigfatpeach,Tue Jul 19 03:25:19 IST 2011, HOPE WEST SIDE HAS GONE DOWN A STORM TONIGHT Congrats involved X
bigfatpeach,Mon Jul 18 19:36:42 IST 2011,Just took Lady Peachey see final Harry Potter And very enjoyable romp Film wasnt bad
