username,time,tweet
StevenCreyelman,Thu May 07 00:13:53 IST 2015,Sometimes I love being  bastard 
StevenCreyelman,Thu May 07 00:05:48 IST 2015, So youre rubber Im glue Let buy dictionary
StevenCreyelman,Thu May 07 00:02:56 IST 2015, community helping others being helped Thats way supposed AfterEffectsAnonymous
StevenCreyelman,Wed May 06 23:59:11 IST 2015, Ook wel makkelijk om uitspraken over mij te doen terwijl mij niet kent
StevenCreyelman,Wed May 06 19:35:43 IST 2015, heeft gelijk ivm ongelijke verdeling rijkdom welvaartskloof tussen ABVV-top en -militanten wordt steeds groter
StevenCreyelman,Wed May 06 12:31:01 IST 2015,Nochtans onthoofding een barbaarse praktijk die moslimextremisten zelf aanhangen 
StevenCreyelman,Tue May 05 18:53:41 IST 2015,PvdA-fans de praktijk niet vies v woekerkapitalisme AndreaCroonenberghs verhuurt appartement voor €140/nacht 
StevenCreyelman,Tue May 05 15:03:36 IST 2015,RT  De standpunten van  over identiteit zijn niet marginaal maar worden breed gedragen de samenleving http/…
StevenCreyelman,Tue May 05 12:46:42 IST 2015,30-urenwerkweek stimulans voor zwartwerk hautekiet
StevenCreyelman,Tue May 05 12:43:04 IST 2015,Korte werkweek maar ook minder loon dan onbetaalbaar voor werkgevers en werknemers hautekiet
StevenCreyelman,Mon May 04 16:17:53 IST 2015,RT  Beste  graag een rechtzetting van deze flater De essentie nu juist dat voor het behoud zijn https/…
StevenCreyelman,Mon May 04 15:56:08 IST 2015,VlaamsBelang pleit voor behoud WetMajor   schrijft bewust tegenovergestelde 
StevenCreyelman,Mon May 04 15:55:09 IST 2015, geeuw
StevenCreyelman,Mon May 04 15:52:12 IST 2015, Allé hop You 15 minutes fame Hope youre happy now moemagikookietszegge
StevenCreyelman,Mon May 04 15:46:05 IST 2015,RT online Dit de criminele journalistiek Bewust schaden van mensen die bijeenkomen vóór behoud van de Wet Major 
StevenCreyelman,Fri May 01 23:41:41 IST 2015, heeft klaar en duidelijke boodschap op 1mei RedVlaamseJobs -  -  
StevenCreyelman,Fri May 01 15:22:40 IST 2015, RedVlaamseJobs Video    Pas   1mei
StevenCreyelman,Wed Apr 29 12:00:10 IST 2015,Beeldverslag actie  tegen socialedumping  - hlndendermonde hlnbuggenhout Pas
StevenCreyelman,Wed Apr 29 11:57:30 IST 2015,VlaamsBelang voert actie tegen SocialeDumping -  HLNDendermonde HLNBuggenhout via BE -  
StevenCreyelman,Wed Apr 29 11:55:36 IST 2015,TV OOST  Vlaams Belang Oost-Vlaanderen voert actie tegen sociale dumping - 28/4/2015 - Nieuwsberichten 
StevenCreyelman,Tue Apr 28 21:24:08 IST 2015,VlaamsBelang voert actie aan de terreinen van VPK Oudegem RedVlaamseJobs -  - Pas 
StevenCreyelman,Mon Apr 27 13:56:20 IST 2015,Vandaag het 8 jaar geleden dat KarelDillen de stichter van het VlaamsBlok overleden  
StevenCreyelman,Mon Apr 27 00:20:56 IST 2015,And suddenly interesting guy world according himself went quiet maybehegotalife
StevenCreyelman,Mon Apr 27 00:17:07 IST 2015, You important know important people Thats damn impressive shaniatwain
StevenCreyelman,Mon Apr 27 00:06:58 IST 2015, Zullen even nakijken hoeveel actieve profielen dat zijn
StevenCreyelman,Mon Apr 27 00:06:17 IST 2015, Gelukkig ken ik ook normale supporters van  anderlecht Vermoedelijk lacht de hele rsca-tribune je gewoon uit
StevenCreyelman,Mon Apr 27 00:04:45 IST 2015, So
StevenCreyelman,Mon Apr 27 00:03:45 IST 2015, Diegene die een beter gedacht hebben van zichzelf dan jij moeten ook nog geboren eengoedgedachtvanuweigenisveelwaard
StevenCreyelman,Mon Apr 27 00:02:52 IST 2015, Klopt absoluut Al 10 jaar geen kampioen Wij zijn nu eenmaal geen successupporters
StevenCreyelman,Sun Apr 26 23:59:11 IST 2015, Eentje zoals Dufour -p
StevenCreyelman,Sun Apr 26 23:56:32 IST 2015, Tuurlijk jongen tuurlijk Als je het zelf maar gelooft
StevenCreyelman,Sun Apr 26 23:54:09 IST 2015, Ik ga je laten Succes ermee
StevenCreyelman,Sun Apr 26 23:51:32 IST 2015, Dus omdat jullie teveel kampioen gespeeld wouden jullie de beker niet en hoeft kampioenschap ook niet sterk
StevenCreyelman,Sun Apr 26 23:50:14 IST 2015, Selectieve blindheid heet dat VDBvsDeSutter
StevenCreyelman,Sun Apr 26 23:47:09 IST 2015, Wat heeft dat er mee te maken Ik supporter voor een ploeg niet tegen een andere Misschien ook eens doen
StevenCreyelman,Sun Apr 26 23:41:50 IST 2015, Vel  Beer 
StevenCreyelman,Sun Apr 26 23:39:49 IST 2015, Jaja  de boeken zijn toe Beter niet met je tegenstander lachen
StevenCreyelman,Sun Apr 26 23:33:07 IST 2015,Hautaine Hein verprutst het voor Gent met absurde wissels Je lacht beter niet met je tegenstander genclu gntclu
StevenCreyelman,Thu Apr 23 21:37:13 IST 2015,Zal Buggenhoutse gemeenteraad deze avond Brugs burgemeester  de oorlog verklaren -  HLNBuggenhout
StevenCreyelman,Thu Apr 23 12:07:49 IST 2015,De scriptkiddies mogen nu stilaan gaan ophouden met onnozele pogingen Wij draaien geen WordPress -p
StevenCreyelman,Wed Apr 22 20:40:45 IST 2015, Telefoontje voor administratieve aanpassing 20 seconden later orde ZoHoortHet WegMetDeBureauCratie TevredenBusinesKlant
StevenCreyelman,Wed Apr 22 19:18:55 IST 2015,Do NOT wake proverbial sleeping dog - 
StevenCreyelman,Sun Apr 19 23:39:36 IST 2015,App  voorspelde 2-1 enkele minuten voor het tweede doelpunt van  viel cluand Nostradamus
StevenCreyelman,Sat Apr 18 16:37:25 IST 2015, echt wel mee met de tijd Adminsitratief probleem snel en efficiënt afgehandeld via socialemedia AlsHetGoedIsZeggenWeHetOok
StevenCreyelman,Sat Apr 18 16:19:47 IST 2015, PM verzonden Dank voor de snelle respons
StevenCreyelman,Sat Apr 18 16:17:02 IST 2015,Support volgens website ook op zaterdag Als je belt de support gesloten Hallo  wat het nu businessklantdiehetwilweten
StevenCreyelman,Fri Apr 17 13:09:36 IST 2015,Niemand zegt dat je de opvoeding van je kinderen moet overlaten aan studio100 Je kan dat ook kaderen hautekiet jullieoverdrijvenwel
StevenCreyelman,Fri Apr 17 12:53:11 IST 2015,Heeft die dame ooit naar PietPiraat gekeken pietpiraat nietalleenvoorbeeldenkiezendiejeuitkomen
StevenCreyelman,Fri Apr 17 03:56:36 IST 2015,Islamitische vluchtelingen gooiden christenen overboord tijdens oversteek  - Hallo   en 
StevenCreyelman,Wed Apr 15 14:56:51 IST 2015,RT  Zou reizen De Zigeuner zich zorgen maken over uitspraken  Zigeuner scheldwoord en dus onaanvaardbaar ht…
