username,time,tweet
makesplash,Mon Jun 22 15:03:17 IST 2015,Such stupid farmaans being issued- Yoga compulsory Of d things d world 
makesplash,Mon Jun 22 14:59:16 IST 2015, Maybe IIT shudve said- aana hai toh aao nahin toh koi baat nahin Hum dekhlenge 
makesplash,Mon Jun 22 14:54:08 IST 2015,Lover Imagine 
makesplash,Mon Jun 22 14:52:10 IST 2015,p tuuuu
makesplash,Mon Jun 22 14:42:37 IST 2015,RT  I expect Hamid Ansari ecstatic unprecedented attention received going stop going an…
makesplash,Mon Jun 22 14:42:06 IST 2015,My daughters r crying I made COMPULSORY fr finish der veggies nd dal CompulsoryYoga
makesplash,Mon Jun 22 14:30:52 IST 2015,RT  Delhi Urgent Need 6 AB blood units  National Heart Institute Call 09993333903 Rakt via  cc  …
makesplash,Mon Jun 22 14:11:58 IST 2015,Whoa 
makesplash,Sun Jun 21 19:20:38 IST 2015,RT  Bengaluru Critical Ove Platelets requiredDengue Patient Columbia Asia Hosp Yeshwantpur Call 8861226000 NewAid Pleas…
makesplash,Sun Jun 21 07:17:40 IST 2015,RT  Delhi Urgent blood ANY group BL Kapoor Hospital Karol Bagh Contact 9654532146 21Jun    http…
makesplash,Fri Jun 19 17:00:13 IST 2015,RT  जितना विरोध सूर्य नमस्कार और योग का हो रहा हैं अगर उतना विरोध आतंकवाद और नस्लवाद का हुआ होता तो आज देश का ये हाल न होता …
makesplash,Fri Jun 19 16:59:27 IST 2015,RT  Spirit Mumbai euphemism Majboori ka name Mahatma Gandhi
makesplash,Fri Jun 19 16:55:58 IST 2015,RT  Avoid subways Milan subway 5 ft water  khar subway 6 ft mankhurd subway 10 ft average info Please avoid
makesplash,Fri Jun 19 16:51:27 IST 2015,RT  Up tick continues Nifty up 50 pts close 8224 Sensex rises 200 pts close 27316 Volatility 1508
makesplash,Fri Jun 19 15:30:53 IST 2015,Rains bring interim relief ppl- Sushma  Vasundhara particular They r nt Headlines anymore
makesplash,Fri Jun 19 14:37:10 IST 2015,RT  appollo hospital ahmedabad needs A blood urgentplz contact 09377080699
makesplash,Fri Jun 19 14:34:12 IST 2015,RT  Tकौनसा पंछी सबसे तेज़ उड़ता हैSसर हाथी।Tनालायक तेरा बाप क्या करता हैSदाउद के गैंग में शूटर है।Tशाबाश लिखो बच्चो …
makesplash,Fri Jun 19 14:32:51 IST 2015,RT  appollo hospital ahmedabad needs A blood urgentplz contact 09377080699
makesplash,Fri Jun 19 13:18:51 IST 2015,RT  PA MJ joining BJP RaGa Michael Jackson alive PA Arre sir MJ Akbar RaGa What Even Akbar aliv…
makesplash,Fri Jun 19 12:37:37 IST 2015,THORe  Hes writing book called - From 3 tier 3 tyre
makesplash,Fri Jun 19 12:28:04 IST 2015,From Wats App-The American Time  magazine  put  aptly  The  paper  wrote The Indian Army  needs   everything except courage
makesplash,Fri Jun 19 12:24:10 IST 2015,Innovative form protest 
makesplash,Fri Jun 19 12:05:29 IST 2015, actually name Tan Me 2 Bhat
makesplash,Fri Jun 19 11:22:56 IST 2015,RT  Take famed spirit Mumbai Add rain water Have nice drinkMumbaiRains
makesplash,Fri Jun 19 11:05:45 IST 2015,RT  Urgent Kerala 2yrOldUnits 2Blood group AB-Hospital Sct Trivandrum RaktCall 9447010950 via  cc …
makesplash,Thu Jun 18 16:33:16 IST 2015,RT  Nifty rises 83 pts closes 8174 Sensex rises 283 pts close 27115 Volatility 1600
makesplash,Thu Jun 18 10:53:01 IST 2015,Advani phir bola Iss Budhhe ka kya karen
makesplash,Wed Jun 17 17:41:24 IST 2015,Correction over 
makesplash,Wed Jun 17 12:40:13 IST 2015,RT  Dear news Banana republiccorrupt media never question real criminals    
makesplash,Wed Jun 17 11:40:59 IST 2015,RT  Munnabhai fake MBBS degree gave Jadoo Ki JhappiJitendar Tomar fake LLB degree gave Jhadoo Ki Jhappi
makesplash,Wed Jun 17 11:36:18 IST 2015,RT  Bangalore O platelets need Malathi Memorial Hospital contact 96116770039035258234 17Jun NewAid Via  u…
makesplash,Wed Jun 17 11:30:41 IST 2015,Agree 
makesplash,Wed Jun 17 11:29:59 IST 2015,But need surprised Gadkaris ride scooty w/o helmet made big event media
makesplash,Wed Jun 17 11:27:20 IST 2015,I mean hav 2g coal hawala adarsh etc wud worry abt sort noc LalitModi
makesplash,Wed Jun 17 11:23:56 IST 2015,Bar scams lowered much LaMo wudnt hav managed even mention one during UPAs time Thats wat Modi done
makesplash,Wed Jun 17 11:19:21 IST 2015,For want good scam/scandal LalitModi SushmaSwaraj vasundharaRaje non-scandal suffice
makesplash,Tue Jun 16 18:13:33 IST 2015,RT  Markets recover late trade Nifty closes 8047 up 33 pts Sensex rises 100 pts close 26686 Volatility a…
makesplash,Tue Jun 16 18:12:16 IST 2015,RT   Bhai need help A Blood needed Rajeev cancer Rohini Delhi Pls help Contact Dr Sanjay 08400092460 n…
makesplash,Tue Jun 16 14:07:13 IST 2015,Built Renovated correct word actually 
makesplash,Tue Jun 16 13:49:17 IST 2015,RT  Delhi Need O-ve blood  near jasola metroCall 9873297834 Rakt via India cc  …
makesplash,Mon Jun 15 16:15:31 IST 2015,I presume r referring   Hain na  
makesplash,Mon Jun 15 16:08:39 IST 2015,Very well 
makesplash,Mon Jun 15 16:00:42 IST 2015,Some hashtags trend many tweets hashtag trending stupid
makesplash,Mon Jun 15 15:49:48 IST 2015,The way brand Audi highlighted Jahnavi Gadkars car crash seems d fault Audi mumbaiCarCrash
makesplash,Mon Jun 15 15:40:13 IST 2015,RT  May inflation -236 pc negative zone 7th month -  
makesplash,Mon Jun 15 15:40:02 IST 2015,Bottom formed 
makesplash,Mon Jun 15 11:12:46 IST 2015, yes remember
makesplash,Mon Jun 15 10:21:49 IST 2015,RT  Hyderabad Urgent AB Blood  star hospitals banjara hills CallVenkat 9703177151 Via NewAud   …
makesplash,Mon Jun 15 10:20:26 IST 2015, Why
makesplash,Sun Jun 14 15:05:06 IST 2015,RT sena Full Speech Shree Subramanian  Savarkar  Hindutva 
