username,time,tweet
wsadid66,Fri Jun 26 19:49:46 IST 2015, En protesta  deberíamos volver ver Miss Universo 
wsadid66,Fri Jun 26 19:28:39 IST 2015,  Juan siempre soñó que serías el mejor 
wsadid66,Fri Jun 26 16:43:18 IST 2015,Con toda tigre    hoy vas rugir 
wsadid66,Fri Jun 26 16:42:44 IST 2015,RT  Mi esposa  ya les puso la camiseta Domi y Desi para alentar Colombia 
wsadid66,Fri Jun 26 05:58:16 IST 2015,RT dicho — Amor devuélvete casa— No puedo — Dejaste Twitter abierto — 
wsadid66,Fri Jun 26 05:57:51 IST 2015,RT  2in1 처럼 두 가지 일을 완벽히 소화할 수 있나요 Jim Parsons가 도전해봅니다  
wsadid66,Fri Jun 26 05:01:06 IST 2015,   Excelente Santi
wsadid66,Thu Jun 25 17:28:26 IST 2015,RT Bancolombia ETB’s Board proposed AGM release reserves distribution extraordinary dividends COP11384/share paid…
wsadid66,Thu Jun 25 05:07:03 IST 2015,RT  Tecnología global disponible en ExpoAgrofuturo2015      
wsadid66,Thu Jun 25 04:58:52 IST 2015,RT   agro   
wsadid66,Wed Jun 24 20:44:46 IST 2015,RT  Too bad didnt work 😂😂 
wsadid66,Wed Jun 24 09:31:13 IST 2015,Tan leeeeeedos los diputados 
wsadid66,Wed Jun 24 09:23:12 IST 2015,RT  ¿Falcao necesita de usted No sean maricones
wsadid66,Wed Jun 24 08:49:25 IST 2015,RT  Nueva CaricaturaXtian ¡TAN LIBERALES 
wsadid66,Wed Jun 24 07:17:13 IST 2015,RT  Las copas de los cuartos de final de la Copa América   
wsadid66,Tue Jun 23 20:12:57 IST 2015,RT  The best way predict future create Abraham Lincoln OgilvyCannes Inspire series CannesLions 
wsadid66,Tue Jun 23 08:21:41 IST 2015,RT  - Te extraño - Ok - Ay que seco - 💦💦 Ok 💦💦
wsadid66,Tue Jun 23 01:19:41 IST 2015,RT  Tienen una delantera de lujo   
wsadid66,Tue Jun 23 00:17:47 IST 2015, La copa del amort 
wsadid66,Mon Jun 22 20:56:27 IST 2015,De los mismos creadores de cójalo cójalo suéltelo  suéltelo Ahora viene  Falcao presidente Falcao chupar banca
wsadid66,Mon Jun 22 08:50:04 IST 2015,RT  Follow instincts
wsadid66,Mon Jun 22 08:02:19 IST 2015,RT  Conocimiento inspiración y tendencias en un sólo lugar VII Congreso Internacional Agropecuario ExpoAgrofuturo2015 https…
wsadid66,Mon Jun 22 07:25:10 IST 2015,RT  La buena Jesús te ama La mala murió hace 2000 años
wsadid66,Mon Jun 22 06:15:36 IST 2015,RT  De carambola mi columna sobre Colombia y la clasificación cuartos  
wsadid66,Mon Jun 22 05:03:18 IST 2015,RT 2010MisterChip Colombia es la TERCERA selección que supera una Fase de Grupos de Copa América marcando un solo gol tras México 2001…
wsadid66,Mon Jun 22 05:02:25 IST 2015,RT TomasRoncero Viva Colombia Viva   Vamooooos
wsadid66,Mon Jun 22 04:58:28 IST 2015,RT 2010MisterChip Por una parte del cuadro CHI vs URU BOL vs PERPor la otra parte del cuadro ARG vs COL BRA vs PAR
wsadid66,Mon Jun 22 04:58:05 IST 2015,Conclusión  Las eliminatorias van estar muy duras 
wsadid66,Mon Jun 22 03:43:51 IST 2015,RT  —¿Pero cuándo coño vamos tener sexo anal Pili - Tenemos toda una vida por delante Paco —Y por detrás Pili y por detr…
wsadid66,Mon Jun 22 03:21:22 IST 2015,RT 2010MisterChip BRA 1-0 VEN 15 Chile2015Los Cuartos de Final ahora mismo CHI vs URU BOL vs PER ARG vs COL B…
wsadid66,Mon Jun 22 02:46:42 IST 2015,RT  Y ahora Tiembla Brasil que allá viene La Vinotinto Venceremos
wsadid66,Mon Jun 22 02:31:26 IST 2015,RT  Es un muy buen defensor Jeison Murillo Lo mas rescatable de Colombia sin soluciones ofensivas hoy
wsadid66,Mon Jun 22 01:31:23 IST 2015,RT  Cuando le empiece ir como Falcao pasaremos de James presidente James hijueputa Así somos
wsadid66,Mon Jun 22 01:22:03 IST 2015,RT  Si Don Jose hubiera convocado los que son era el momento de sacar James y meter Neider Morantes
wsadid66,Sun Jun 21 23:16:16 IST 2015,RT  Ras tas tas se metió la guerrilla
wsadid66,Sun Jun 21 22:34:48 IST 2015,RT  —Papá estas obsesionado con Estados Unidos —No se que te refieres Carolina Del Norte
wsadid66,Sun Jun 21 22:06:20 IST 2015,RT  La teta Teresa pronosticó triunfo de Colombia Señores Creo en ti Teta Teresa  Vamos la Teta carajo
wsadid66,Sun Jun 21 20:12:54 IST 2015,RT  Me acabo de comer 150 gramos de chocolate unas palomitas grandes y un litro de CocaCola Soy un fofisano de esos
wsadid66,Sun Jun 21 20:04:21 IST 2015,RT  Feliz día del cualquier hijueputa
wsadid66,Sun Jun 21 17:18:23 IST 2015,RT  Esta es la primera vez que abrí los ojos y vi mi papá PapásReciénNacidos DíaDelPadre
wsadid66,Sun Jun 21 08:17:43 IST 2015,RT  No renuncié mis sueños despidieron
wsadid66,Sun Jun 21 08:17:21 IST 2015,RT  Los anuncios de comida dan hambre Los de bebidas sed Los de condones depresión
wsadid66,Sun Jun 21 08:15:17 IST 2015,RT  Ojalá un plan B igualito que el A y llamarlo constancia
wsadid66,Sun Jun 21 08:14:12 IST 2015,RT  La gente como el arte se supone que sea hermosa sino que te haga sentir algo
wsadid66,Sun Jun 21 08:09:25 IST 2015,RT  -Amor siento que nuestra relación se tornó fría y distante-Yo lo siento de ese modo Sin otro particular saludo atte
wsadid66,Sun Jun 21 06:21:12 IST 2015,RT  Lo tengo chiquito pero empujo como Bacca
wsadid66,Sun Jun 21 06:20:56 IST 2015,RT  Somos tan pero tan subdesarrollados que creemos que si alguien usa el metro es porque es pobre Muy duro
wsadid66,Sun Jun 21 06:19:08 IST 2015,RT  Estas son las tablas de posiciones de Chile2015 Descarga nuestra App MiEquipo y conoce más detalles VamosColombia http…
