username,time,tweet
je_taimelou,Tue Mar 01 01:24:48 IST 2016,Oli Briana Totally unexpected 
je_taimelou,Tue Mar 01 01:22:29 IST 2016,Why Home MITAM  I still mad
je_taimelou,Tue Mar 01 01:21:50 IST 2016, 1home 2 home 3home 4 I fly 5 love goodbye wait home album
je_taimelou,Tue Mar 01 01:20:05 IST 2016, trolling  herself
je_taimelou,Tue Mar 01 01:18:11 IST 2016, dat hawt guy behind payno
je_taimelou,Mon Feb 29 15:56:14 IST 2016,RT  very very grateful people use celebrity speak out critical world issues need more attention
je_taimelou,Mon Feb 29 09:07:27 IST 2016,RT  talk 
je_taimelou,Mon Feb 29 01:26:54 IST 2016,RT  If stans Liam lost fucking shit 
je_taimelou,Mon Feb 29 01:19:04 IST 2016,One day 
je_taimelou,Mon Feb 29 01:14:23 IST 2016,Oh 
je_taimelou,Mon Feb 29 01:11:48 IST 2016,I didnt need 
je_taimelou,Mon Feb 29 01:10:53 IST 2016,This extra  
je_taimelou,Mon Feb 29 01:10:32 IST 2016,Good see 20000 years mate   
je_taimelou,Mon Feb 29 01:09:13 IST 2016,How 
je_taimelou,Mon Feb 29 01:07:14 IST 2016,Tomlinson You need hire someone  
je_taimelou,Mon Feb 29 01:05:07 IST 2016,Shut up  
je_taimelou,Mon Feb 29 01:04:37 IST 2016,POWERCOUPLE  
je_taimelou,Mon Feb 29 01:02:45 IST 2016,RT  Dont cry over boys Do squats make cry wishin still dat ass
je_taimelou,Mon Feb 29 01:01:26 IST 2016,He one nicest person Its heartbreaking I think He go through  
je_taimelou,Mon Feb 29 00:55:17 IST 2016,Ur bedroom  
je_taimelou,Mon Feb 29 00:54:34 IST 2016,Even fat Why people judge She great voice enough  
je_taimelou,Mon Feb 29 00:43:16 IST 2016, understand give end tired FUCK
je_taimelou,Mon Feb 29 00:41:00 IST 2016,Reunion exes 2K16 going wild Wtf happening
je_taimelou,Mon Feb 29 00:38:00 IST 2016,RT  caroline lou teasdaleeleanor shopialiam cheryldanielle lottieno cant distract babygate
je_taimelou,Mon Feb 29 00:36:54 IST 2016,One question Why Harry attacked media He going solo Everyone chilled Liams solo
je_taimelou,Sun Feb 28 20:13:35 IST 2016,They extra  
je_taimelou,Sun Feb 28 20:11:02 IST 2016,Now know Why LILo went BRITs I gonna sit back see shit going down 
je_taimelou,Sun Feb 28 20:09:06 IST 2016,There much drama right now I gonna bring back He looked hot FUCK 
je_taimelou,Sun Feb 28 20:05:01 IST 2016,Had Same thought second  
je_taimelou,Sun Feb 28 20:02:51 IST 2016,The things couples show dating Larry already done And better  
je_taimelou,Sun Feb 28 19:58:08 IST 2016,Why I think Ill sleep peace during Hiatus
je_taimelou,Sun Feb 28 19:56:50 IST 2016, thought well peace during hiatus
je_taimelou,Sun Feb 28 19:54:03 IST 2016,I need type shit right now  
je_taimelou,Sun Feb 28 19:53:09 IST 2016,The fact He rolled up jeans makes more painful  
je_taimelou,Sun Feb 28 19:52:08 IST 2016,How He staying out opera  I wanna learn ways  
je_taimelou,Sun Feb 28 19:49:37 IST 2016,RT  NO OFFENSE BUT THEY KISS 
je_taimelou,Sun Feb 28 19:48:56 IST 2016,RT  😂📞 
je_taimelou,Sun Feb 28 19:48:35 IST 2016, The fact broke out story makes more questionable
je_taimelou,Sun Feb 28 19:47:12 IST 2016,RT  How 
je_taimelou,Sun Feb 28 19:45:27 IST 2016,Wish I Niall
je_taimelou,Sun Feb 28 19:28:50 IST 2016,I dont give fuck think Liam Cheryl But respect woman
je_taimelou,Sun Feb 28 19:26:25 IST 2016,You judge Cheryl age You literally 12 years old dreaming 23 years old guy judge
je_taimelou,Sun Feb 28 19:24:56 IST 2016,Like I knew weekend gonna full Drama Some really rude No idea disrespectful
je_taimelou,Sun Feb 28 19:15:32 IST 2016,taimelou How childish No wonder Why half population think childish No brain
je_taimelou,Sun Feb 28 19:14:21 IST 2016,Okay even dont idea Liam Cheryl together You No right nasty thongs instagram
je_taimelou,Sun Feb 28 19:03:27 IST 2016, yep
je_taimelou,Sun Feb 28 19:03:04 IST 2016,So sorry hear thoughts goes tomlinson family RIPKeith
je_taimelou,Sun Feb 28 16:53:52 IST 2016,So telling Liam Cheryl kept relationship secret 3 months suddenly getting pictured Tesco  Try again
je_taimelou,Sat Feb 27 23:04:15 IST 2016,Did anything happen today I know
je_taimelou,Sat Feb 27 23:02:28 IST 2016,RT Styles You shake apple apple tree
