username,time,tweet
LaciLower,Sun Apr 19 22:42:50 IST 2015,Mommy being artistic Daddy Artastic Sartistic 
LaciLower,Tue Apr 14 07:05:10 IST 2015,  I found app I love keep thoughts list organized -  Kinda post-it noteish
LaciLower,Tue Apr 14 06:57:52 IST 2015, looks  desktop Ooh I saw huge post-its Target fun
LaciLower,Sun Apr 12 21:21:17 IST 2015,Mommy started sentence And  definitelymydaughter grammarpolice  Waterstreet… 
LaciLower,Sun Apr 05 22:08:34 IST 2015,Superheroes need rest recharge 
LaciLower,Wed Mar 25 08:09:27 IST 2015, HBD I bought something Gap totally awkward sales guy creeping
LaciLower,Mon Mar 23 03:29:22 IST 2015, “ 2012 Tiger Woods2013 Tiger Woods2014 Matt Every2015 Matt Every PGATour”
LaciLower,Mon Mar 23 03:21:46 IST 2015,RT  That shot 18 putt birdie MattEvery showed guts Cant afraid done Phenomenal golf  C…
LaciLower,Sun Mar 22 08:21:36 IST 2015,Wow Brewer guy come Dominating tourney 13seed d1wrestle
LaciLower,Sun Mar 22 00:46:47 IST 2015,Averie HourOfCode - check out  
LaciLower,Mon Mar 16 00:17:02 IST 2015,“ TheKimmySchmidt first truly great sitcom streaming era  cantstopwatching dontwantittoend
LaciLower,Sat Mar 14 07:44:03 IST 2015,Nate geeked out tomorrow Need figure out celebrate Love enginerd EpicPiDay 
LaciLower,Fri Mar 13 07:02:40 IST 2015,I highly recommend Improv Beer  Get outside comfort zone 20 sign up 3/14 
LaciLower,Tue Mar 10 21:08:24 IST 2015,“ Under 18  Rocking  Awesome SWCR15 
LaciLower,Tue Mar 10 07:48:28 IST 2015, hasnt tried  I bet shed love Ill bring try out Thanks letting know codingfun
LaciLower,Tue Mar 10 06:52:35 IST 2015, I told I posted notes Averie Hey I wasnt finished Her final product SWCR15 
LaciLower,Tue Mar 10 02:59:39 IST 2015,  I feature requests - I target demographic 😄
LaciLower,Mon Mar 09 23:55:35 IST 2015,  Of course Averie took dads spot during Demo day  son more even pitched wares
LaciLower,Mon Mar 09 09:13:30 IST 2015,Focused notes swcr15 rockinthegumballtights 
LaciLower,Mon Mar 09 09:10:17 IST 2015,1st grade view  demo day Bummed iPad died 😞 entrepreneur journalist  maybe  prodigy 
LaciLower,Mon Mar 09 08:06:31 IST 2015,  - gathering speaks Would definitely team I 3 day-er Want This App swcr15
LaciLower,Sat Mar 07 10:46:07 IST 2015,RT  CUBuffsWBBs coach Lappe defeating top-seeded Oregon State Pac12Hoops Tourney Weve even more p…
LaciLower,Sat Mar 07 09:13:08 IST 2015, first grade basketball coach forthekiddos mommyproblems
LaciLower,Sat Mar 07 08:44:28 IST 2015, many amazing ideas The Corridor Wish I stay  inspiring SWCR15 
LaciLower,Sat Mar 07 07:50:47 IST 2015,  ones swcr15
LaciLower,Tue Mar 03 05:58:04 IST 2015, worst travel experience Ive many different mess ups impressed
LaciLower,Tue Mar 03 05:48:17 IST 2015, The people CID friendly helpful
LaciLower,Tue Mar 03 04:20:54 IST 2015, well made back luggage didnt seriously missed connections cancelled return trip lost luggage bummed
LaciLower,Tue Mar 03 02:37:31 IST 2015, thanks response
LaciLower,Tue Mar 03 02:35:28 IST 2015, ok now 1291 On Wed 6157 problem 15 hrs Tarmac missed 764 FLL route through EWR lost itinerary
LaciLower,Tue Mar 03 01:09:35 IST 2015,Ugh stuck Tarmac ORD 2nd time same trip If miss connection time - grrr Come UnitedAirlines
LaciLower,Mon Feb 23 01:01:44 IST 2015,Mommy Hawks arent good today 😩 typical comeonHawks 
LaciLower,Mon Feb 23 00:10:38 IST 2015,Frustrating day Carver far comeonHawks 
LaciLower,Fri Feb 20 09:07:58 IST 2015, way fast Shell grown up before I know
LaciLower,Fri Feb 20 09:04:42 IST 2015,Love  wish more Midwest games    
LaciLower,Mon Feb 09 09:22:58 IST 2015,RT  Is Saturday Night Live
LaciLower,Sat Feb 07 07:57:31 IST 2015,RT  Dance one watching FTK UIDM21 IowaBrag 
LaciLower,Mon Feb 02 08:46:43 IST 2015,RT  Seattle put ball hands 1 yard line 
LaciLower,Mon Feb 02 08:31:52 IST 2015,Give Marshawn duh
LaciLower,Mon Feb 02 06:57:58 IST 2015,pepa
LaciLower,Mon Feb 02 06:57:11 IST 2015,Salt n peppa - love pushit
LaciLower,Mon Feb 02 06:55:52 IST 2015,RT  Honored having team  Heres way saying thanks OneBoldChoice 
LaciLower,Thu Jan 22 04:57:02 IST 2015,  maybe thats point - youre top dog Its  lower chairs negotiations
LaciLower,Fri Jan 16 10:03:26 IST 2015, nice see name confirmed list 24th SeeYouSoon
LaciLower,Sat Dec 13 00:03:06 IST 2014,RT  Were giving away autographed Fred Jackson Helmet  To enter RETWEET THIS BillsFansNeverDriveDrunk 
LaciLower,Sun Dec 07 22:27:14 IST 2014,Excited take kiddos watch  
LaciLower,Mon Nov 10 00:27:20 IST 2014,RT  100 games counting I still see I lot left tank”   bil
LaciLower,Sat Nov 01 20:04:45 IST 2014,Sliders Marys Go Hawks  
LaciLower,Sun Sep 21 00:05:55 IST 2014,Before rain before trip bookstore A geared up GoKohawks  Coe College 
LaciLower,Sun Sep 07 09:14:43 IST 2014,I think Untitled nicest restrooms bar I remember 
