username,time,tweet
hessie39,Fri Feb 26 04:30:36 IST 2016,  haigh92 griff good unison 
hessie39,Tue Feb 23 00:11:52 IST 2016,Making ThinkingDay biscuits WTD2016 world  
hessie39,Sun Feb 21 22:11:13 IST 2016,Senior section centenary sleepover thinkingday2016 connect spark   
hessie39,Sun Feb 21 02:35:45 IST 2016,Senior section centenary sleepover thinkingday2016 connect spark   
hessie39,Thu Feb 18 05:50:38 IST 2016,Aghast SidtheSloth PLL PrettyLittleLiars twist WineWednesday
hessie39,Mon Feb 15 04:40:18 IST 2016,Rachel-boomwhaker-hands Edwardscissorhands  haigh92 
hessie39,Mon Feb 15 04:32:21 IST 2016,Fun games practicing Churpies  boomwhacker halfterm  
hessie39,Mon Feb 15 00:23:57 IST 2016,Practically  baking vegan halfterm noSundayblues haigh92 
hessie39,Sun Feb 14 21:06:31 IST 2016,That awkward moment confuse Jude Euan WrongValentine haigh92 ColdMountain
hessie39,Sun Feb 14 20:47:11 IST 2016,Happy Valentines Day haigh92  griff  choirbantz punny 
hessie39,Fri Feb 12 21:04:57 IST 2016, haigh92 griff  I think criticisms nicetry photocopyinggate
hessie39,Thu Feb 11 04:06:30 IST 2016, haigh92 griff  MassivePauseBeforeBlessingAndHonour RachelNearlyKnockedMeOut RachelGotToldOff
hessie39,Thu Feb 11 03:54:59 IST 2016, haigh92 griff  nopagefour nobook noacclamations pluralprobs leadnotleads
hessie39,Thu Feb 11 03:48:27 IST 2016, haigh92 griff  haha Byrd/Bach error nothing comparison saidorsung processtotheback
hessie39,Thu Feb 11 01:12:28 IST 2016, haigh92 griff  oops I excited wrong man ByrdNotBach
hessie39,Thu Feb 11 00:09:26 IST 2016,Quite excited Bach annual ashtag tonight  haigh92 griff 
hessie39,Wed Feb 10 02:46:47 IST 2016,haigh92 pancake made bit thin I shouldnt put up kind crepepunny
hessie39,Sun Feb 07 03:24:09 IST 2016, griff  haigh92 ooooooooooooooooooooooo
hessie39,Fri Feb 05 03:44:21 IST 2016,That moment haigh92  realises origin phrase heads roll TudorEducation TheTudors beheaded
hessie39,Fri Feb 05 03:33:46 IST 2016,griff   haigh92  pretty awkward given childs sock
hessie39,Fri Feb 05 02:55:11 IST 2016,griff   haigh92 loosemorals loveabitofkendrick
hessie39,Thu Feb 04 03:39:28 IST 2016, haigh92 haha probably cut those bits favour x rated scenes
hessie39,Thu Feb 04 02:05:04 IST 2016, haigh92 ThomasMore new favourite Thomas sorryTallis I dont know anything Erasmus though
hessie39,Wed Feb 03 02:32:02 IST 2016,haigh92 ThomasMoreLove MourningThomasMore Masters distraction
hessie39,Fri Jan 29 22:52:57 IST 2016, Woohoo Now church leaders catch up
hessie39,Fri Jan 29 06:09:15 IST 2016, I doubt dad even heard Shaggy He definitely wouldnt approve post Good Friday listening DadProbs
hessie39,Fri Jan 29 06:04:00 IST 2016, Im pretty sure answer Shaggyprobs
hessie39,Fri Jan 29 05:57:27 IST 2016, haigh92 haha It reference finding stolen crockeryIve heard usual hiding place
hessie39,Fri Jan 29 05:51:03 IST 2016,haigh92 favourite song large proportion teenage years  check car
hessie39,Fri Jan 29 04:07:44 IST 2016,haigh92  brings whole new meaning BackToChurchSunday  day take borrowed crockery back church
hessie39,Wed Jan 27 04:09:52 IST 2016,   dont forget capers WhoKnewTheyWereAVegetable NotMe
hessie39,Sat Jan 23 19:52:07 IST 2016, haigh92 Tom Jerry Tom Thumb Goodnight Mr Tom Thomas Tank Engine Tommy Rugrat Primaryschoolprobs
hessie39,Fri Jan 22 04:14:22 IST 2016, haigh92 wow I love never sung except car Too demanding SPC tallislove
hessie39,Fri Jan 22 04:02:53 IST 2016, haigh92 evidence 
hessie39,Fri Jan 22 03:57:59 IST 2016, haigh92 Im teaching Victorians moment actually Barnado feature list Tallis still fave
hessie39,Fri Jan 22 03:35:44 IST 2016, haha never doubt allegiance haigh92 ThomasTallis Thomas worth talking
hessie39,Thu Jan 21 03:59:02 IST 2016,Tudors  Tallis Baileys  best part day medicinal NotDryJanuary 
hessie39,Wed Jan 20 03:37:14 IST 2016, haigh92 haha 80 Tudor knowledge teaching Tudors The 20 Horrible Histories
hessie39,Tue Jan 19 02:50:34 IST 2016,RT  There never enough people standing up rich white politically incorrect trumpdebate MLKDay soashamedphili…
hessie39,Tue Jan 19 02:50:14 IST 2016,haigh92 Tudorlove
hessie39,Fri Jan 15 03:06:49 IST 2016,RT  Tonight Taizé prayed Primates Anglican Communion meeting Canterbury week OneFamily Primates2016 …
hessie39,Fri Jan 15 03:04:19 IST 2016, sorry stress flats  griff haigh
hessie39,Fri Jan 15 02:36:15 IST 2016,griff   haigh Hey I met crazy Heres number call Jesus
hessie39,Fri Jan 15 02:35:20 IST 2016, griff haigh  terrified They everywhere
hessie39,Wed Jan 13 03:03:10 IST 2016,FengShui stressful haigh92 
hessie39,Sun Jan 10 22:08:08 IST 2016,    haigh92 griff  awkward moment beat linemanager
hessie39,Sun Jan 10 21:17:36 IST 2016,haigh92  Im excited
hessie39,Sun Jan 10 17:44:31 IST 2016,griff   haigh92     fullmarks punny smashedit
hessie39,Sun Jan 10 17:21:40 IST 2016, Happy Sunday    haigh92 griff  
hessie39,Sun Jan 10 16:51:58 IST 2016,  fame
