username,time,tweet
maximenamateus,Wed Jun 03 08:24:12 IST 2015,A round applause those use same repertoire 
maximenamateus,Tue Jun 02 03:50:00 IST 2015,RT  Hay 6670903752021072936960 sonrisas en el mundo y mí gustó la tuya
maximenamateus,Tue Jun 02 03:38:45 IST 2015,vamos por esos 10 
maximenamateus,Tue Jun 02 03:36:54 IST 2015,RT  Y la dieta 
maximenamateus,Mon Jun 01 03:20:53 IST 2015,possible miss somebody less 3 hours come
maximenamateus,Sun May 31 01:33:27 IST 2015,red nails back 
maximenamateus,Fri May 29 23:52:05 IST 2015,My name molly 
maximenamateus,Fri May 29 06:45:06 IST 2015,Dont waste time overthinking google knows everything
maximenamateus,Fri May 29 06:42:40 IST 2015,Él sabe como hacerme sonreir😍💑 
maximenamateus,Thu May 28 22:53:07 IST 2015,Hate being sick
maximenamateus,Thu May 28 02:31:17 IST 2015,Un amigo haciendome compañia en la oficina buzzlightyear 
maximenamateus,Wed May 27 02:31:16 IST 2015,Nap time please
maximenamateus,Wed May 27 02:30:01 IST 2015,Sabes q estas en el camino correcto cuando pierdes el interes por mirar atras
maximenamateus,Sat May 23 05:48:48 IST 2015,No es justo desvelarme las 330am y mañana terner q despertarme las 420
maximenamateus,Thu May 21 09:27:45 IST 2015,El origen se niega todo el día hablando con Santandereanos que ya al final el mano se escucha hasta bonito
maximenamateus,Tue May 19 10:15:02 IST 2015,RT  De día mantiene la mente ocupada y de noche quita el sueño
maximenamateus,Sat May 16 09:18:19 IST 2015,The worst sensation full hear instead eat
maximenamateus,Thu May 14 18:13:25 IST 2015, oh thats Lol miss guys Ps Plane trains haha
maximenamateus,Thu May 14 08:53:39 IST 2015, I thought soon I saw Amtrak crash news 
maximenamateus,Thu May 14 08:05:15 IST 2015,Escucha XO por johnmayer np en SoundCloud
maximenamateus,Thu May 14 07:53:31 IST 2015,Why now mixed Too much ask 
maximenamateus,Wed May 13 01:47:31 IST 2015, si se porta bien
maximenamateus,Tue May 12 09:45:09 IST 2015,La tonta mania en donde el que busca encuentra y la que esculca tambien
maximenamateus,Tue May 12 04:34:32 IST 2015,Con ganas de coger un avion que vaya bien lejos
maximenamateus,Sun May 10 23:42:55 IST 2015,Dejenme salir 
maximenamateus,Sun May 10 23:15:15 IST 2015,Que mejor que un tinto del campo mientras sale toda la gente que se parqueo en frente de mi carro atrapada 
maximenamateus,Fri May 08 05:32:44 IST 2015,Imposible querer verla 
maximenamateus,Thu May 07 09:12:39 IST 2015,Los complementos perfectos existen para la muestra un boton 
maximenamateus,Wed May 06 03:14:05 IST 2015,Dia de montaña rusa
maximenamateus,Wed May 06 03:11:41 IST 2015,RT  El poder de un abrazo  
maximenamateus,Sat May 02 11:53:42 IST 2015,El corazon esta en modo acordeon arrugado
maximenamateus,Fri May 01 08:30:05 IST 2015,Gabs mas reencuentro 
maximenamateus,Sun Apr 26 23:01:08 IST 2015,Sabado de pereza y domingo de vueltas Como q cuadra
maximenamateus,Fri Apr 24 08:10:35 IST 2015,RT  
maximenamateus,Thu Apr 23 05:46:43 IST 2015,Dia sin carro y pico y placa mañana tan querido ud señor alcalde Mi cansancio le agradece😠
maximenamateus,Thu Apr 23 00:58:41 IST 2015,Asi asi 
maximenamateus,Wed Apr 22 09:04:55 IST 2015, con ganas tía
maximenamateus,Wed Apr 22 08:49:04 IST 2015,Quien quiere Peru 😆
maximenamateus,Wed Apr 22 03:45:33 IST 2015,Hay una palabra que esta perturbando en este momento sueñoooooooo zzzzzzz
maximenamateus,Tue Apr 21 06:48:37 IST 2015,Looking forward
maximenamateus,Thu Apr 16 16:19:07 IST 2015,Mucho amor de llevar mi hno al aeropuerto esta hora
maximenamateus,Wed Apr 15 09:41:14 IST 2015,Liking much pillow face
maximenamateus,Tue Apr 14 08:53:24 IST 2015,Acabo de publicar una foto 
maximenamateus,Tue Apr 14 07:47:06 IST 2015,Have heard ‘Angus And Julia Stone - Big Jet Plane’ quinwhisperer SoundCloud np 
maximenamateus,Tue Apr 14 07:34:33 IST 2015,Como dos canciones al dia pueden sacar sonrisas 😊😊
maximenamateus,Mon Apr 13 06:33:16 IST 2015,Eato pasa cuando visitas tus amigs con hijos 
maximenamateus,Sun Apr 12 22:28:31 IST 2015,Raro yo en el piso pero esta vez si dolio auch pie
maximenamateus,Sat Apr 11 06:31:40 IST 2015,Omg girl taking salon
maximenamateus,Thu Apr 09 09:12:42 IST 2015,Lets trust magic 
maximenamateus,Thu Apr 09 08:18:47 IST 2015,So good red wine health
