username,time,tweet
Miss_Wood,Sun Feb 28 00:20:40 IST 2016,Poor sportsmanship England  depleted Irish team  poor ref decisions  England win You proud ENGvIRE 
Miss_Wood,Sun Feb 28 00:17:04 IST 2016, hardly How brown didnt red I dont know Shocking deliberate behaviour
Miss_Wood,Sun Feb 28 00:16:22 IST 2016,Shame  couldnt ref game - completely different  ENGvIRE
Miss_Wood,Sun Feb 28 00:12:37 IST 2016,Love Ireland still powering  giving up Some poor sportsmanship English - putting politely ENGvIRE
Miss_Wood,Sun Feb 28 00:11:11 IST 2016,Feeling sorry Irelanda depleted side ref against 15 foul play going unnoticed shocking ENGvIRE
Miss_Wood,Sun Feb 28 00:09:47 IST 2016,The ref clearly hates Irishunbelievably shocking decisions ENGvIRE
Miss_Wood,Sun Feb 28 00:07:20 IST 2016,RT  Absolutely ridiculous behaviour thats game played terrible sportsmanship right  …
Miss_Wood,Sun Feb 28 00:06:38 IST 2016,RT  Thug ENGvIRE RT  Accidental Pfff ENGvIRE 
Miss_Wood,Sun Feb 28 00:06:25 IST 2016,RT  Wtf Where mike Browns yellow card First kick accident rest purpose RBS6Nations ENGvIRE
Miss_Wood,Sun Feb 28 00:06:17 IST 2016,RT  Mike Brown ban ENGvIRE
Miss_Wood,Sun Feb 28 00:05:45 IST 2016,How hell 15 still pitch twat ENGvIRE
Miss_Wood,Sat Feb 27 23:45:25 IST 2016,Knew  reminded someone rugby rugbybanter  ENGvIRE 
Miss_Wood,Thu Feb 18 20:17:20 IST 2016, great parking one guys  inconsiderate illegal totaljoke taxi cardiff 
Miss_Wood,Thu Feb 18 20:14:18 IST 2016, exactly I out disgusting taxi blockedin 
Miss_Wood,Thu Feb 18 20:13:38 IST 2016, AWFUL INCONSIDERATE parking one drivers Blocking space disgusting 
Miss_Wood,Mon Feb 15 23:30:36 IST 2016, lovely meet today - bit inspirational I thought youd 😊
Miss_Wood,Sat Feb 13 18:39:27 IST 2016, welcome world tweeting rugby complaining companies 😂
Miss_Wood,Sun Feb 07 22:34:32 IST 2016, I agreeboth teams pretty good
Miss_Wood,Sun Feb 07 22:34:13 IST 2016,RT  What game Gotta give lot credit Rhys Priestland game IREvWAL Wales SixNations rugby iamwales
Miss_Wood,Sun Feb 07 22:32:53 IST 2016, true He form Absolute beast 👌🏼
Miss_Wood,Sun Feb 07 22:31:48 IST 2016,monkey Im thinking
Miss_Wood,Sun Feb 07 22:31:35 IST 2016, 👌🏼 absolute beast ❤️
Miss_Wood,Sun Feb 07 22:29:52 IST 2016,  Complete waste wrong decision Cost game fur sure
Miss_Wood,Sun Feb 07 22:29:18 IST 2016,  cant believe didnt
Miss_Wood,Sun Feb 07 22:28:55 IST 2016,RT  Well played both teams truly exhilarating game IREvWAL
Miss_Wood,Sun Feb 07 22:28:31 IST 2016,IREvWAL  played well today Welcome back lovely spoton cracking
Miss_Wood,Sun Feb 07 22:26:30 IST 2016,   - Irish player
Miss_Wood,Sun Feb 07 22:26:16 IST 2016,IREvWAL poor decision making drop goal attempts Wales down todayit works Biggar Halfpenny
Miss_Wood,Sun Feb 07 22:17:52 IST 2016,IREvWAL hell  man match
Miss_Wood,Sun Feb 07 22:17:17 IST 2016, stupid
Miss_Wood,Sun Feb 07 22:15:10 IST 2016,IREvWAL 2 attempts drop goal - waste
Miss_Wood,Sun Feb 07 22:09:25 IST 2016,IREvWAL now need stop Sexton doing drop goal 😁
Miss_Wood,Sun Feb 07 22:06:07 IST 2016,IREvWAL Francis doing Wales favours
Miss_Wood,Sun Feb 07 22:01:27 IST 2016,IREvWAL surely   MoM incredible performance
Miss_Wood,Sun Feb 07 21:59:43 IST 2016,IREvWAL fear Ireland win drop goal 😩 pleasedontcometrue
Miss_Wood,Sun Feb 07 21:51:03 IST 2016,IREvWAL  cracking game today Huge hits
Miss_Wood,Sun Feb 07 21:49:44 IST 2016,RT  Ive thought far long I need share now IREvWAL 
Miss_Wood,Sun Feb 07 21:48:53 IST 2016,lissack thanks likes ❤️
Miss_Wood,Sun Feb 07 21:46:54 IST 2016,IREvWAL Wales looking incredible defence  scrums form Cracking start boys👌🏼 ❤️🏉❤️ RBS6Nations
Miss_Wood,Sun Feb 07 21:43:54 IST 2016,IREvWAL Ireland really going out wing Not really sure
Miss_Wood,Sun Feb 07 21:41:55 IST 2016,IREvWAL Jesus game tense
Miss_Wood,Sun Feb 07 21:39:27 IST 2016, Im first criticise hes doing well
Miss_Wood,Sun Feb 07 21:38:01 IST 2016,IREvWAL I miss 
Miss_Wood,Sun Feb 07 21:36:24 IST 2016, I know Cost small fortune worth penny
Miss_Wood,Sun Feb 07 21:35:59 IST 2016,IREvWAL drop goal priestland Really Youre Biggar
Miss_Wood,Sun Feb 07 21:31:30 IST 2016, priestland done well far - credit due
Miss_Wood,Sun Feb 07 21:31:01 IST 2016, home games BBC thank god - although benefits Im stadium fur
Miss_Wood,Sun Feb 07 21:29:24 IST 2016,IREvWAL win lose - think thus best Ive seen Wales start tournament RBS6Nations WalesRugby Wales
Miss_Wood,Sun Feb 07 21:26:50 IST 2016,RT  Higher quality more accuracy one half game whole two games yesterday IREvWAL RBS6Nations
Miss_Wood,Sun Feb 07 21:26:26 IST 2016, absolute genius I impressed tips run
