username,time,tweet
joshauck,Mon Feb 29 06:19:57 IST 2016,Watching Michael Strahan force Tina Fey selfie never presented classily Oscars 
joshauck,Mon Feb 29 06:17:08 IST 2016,In same room people watching Oscars Ive never seen many famous people I forgotten exist
joshauck,Sun Feb 28 23:55:19 IST 2016, Mostly agree Concerned ceiling run talented team happens execute
joshauck,Sun Feb 28 23:45:04 IST 2016, They arent talented enough win without superior execution Sort poor mans Wichita St
joshauck,Sat Feb 27 07:21:39 IST 2016,pianowski Him Cousins Harden big 3 whining Also Clips collective unit
joshauck,Sat Feb 27 00:04:03 IST 2016, Not lot evidence hang onto entry passes post tape Ive seen
joshauck,Fri Feb 26 23:13:05 IST 2016,Now needs learn catch pass block run behind line isnt miles better opponent 
joshauck,Fri Feb 26 08:09:56 IST 2016, Hed probably current president appoint doubt find fault many potential candidates
joshauck,Thu Feb 25 22:38:17 IST 2016,How deep dynasty roster need add T-Rich 40 man 60fantasy DynastyFootball
joshauck,Thu Feb 25 08:58:27 IST 2016,To eyes Dunleavy coming back fixed lot Bulls issues He doesnt allow defense readjust bc moves ball quickly
joshauck,Thu Feb 25 08:37:05 IST 2016, Benjamin Gordon 106 Martin Ingram Lacy Concerned Ingram injury think Lacy looks beyond bad
joshauck,Thu Feb 25 08:15:53 IST 2016,This best offensive game Ive seen Bulls play system works Rose/Butler weighing down
joshauck,Wed Feb 24 07:02:11 IST 2016, It looks theyre obstacles particularly unoriginal laser-tag course
joshauck,Tue Feb 23 09:37:19 IST 2016,I dont think theres WWE fan over age 12 Roman Reigns beat  WrestleMania performance
joshauck,Tue Feb 23 09:30:54 IST 2016,Anything involving BigShow long ago descended unintentional comedy RAW WWE
joshauck,Mon Feb 22 07:34:13 IST 2016,Is REALLY want WM This feud Really WWEFastlane WrestleMania
joshauck,Mon Feb 22 06:37:14 IST 2016, looks poorly constructed CGI rendering actual person WWEFastlane WWE
joshauck,Sat Feb 20 23:57:54 IST 2016,Im sure well intentioned feels more embarrassing getting blown out basketball  
joshauck,Thu Feb 18 23:48:29 IST 2016,Why trade Frye It seems Cavs shouldnt interested worse Love certainly doesnt help guard dubs
joshauck,Sat Feb 13 04:02:54 IST 2016, Thats sort I settled thanks advice BTW thoroughly enjoying new podcast
joshauck,Sat Feb 13 03:41:46 IST 2016, Should mentioned PPR make significant enough difference
joshauck,Sat Feb 13 03:27:22 IST 2016, Was offered Gurley L Bell straight up Whats play
joshauck,Sat Feb 13 00:42:16 IST 2016, In particular order Cade McNown Ced Benson Johnnie Knox Kellen Davis JMarcus Webb immortal Chris Conte
joshauck,Tue Feb 09 21:47:05 IST 2016,To fair Cam shown extremely poor sport wins admire consistency CamNewton
joshauck,Tue Feb 09 10:01:03 IST 2016,ThankYouDanielBryan making care deeply something silly
joshauck,Tue Feb 09 04:50:39 IST 2016, And seems Kerr picked up lot more Pop certainly isnt running triangle
joshauck,Tue Feb 09 04:46:57 IST 2016,Thank  years away one brought back wrestling ThankYouDanielBryan
joshauck,Mon Feb 08 08:42:38 IST 2016,giveuppunt sb50
joshauck,Mon Feb 08 07:47:32 IST 2016,Thats drop right SB50 propbets
joshauck,Mon Feb 08 07:32:46 IST 2016, They throwing Jericho Cotchery more
joshauck,Mon Feb 08 07:21:10 IST 2016, Nothing wrong halftime show more fun hate
joshauck,Mon Feb 08 07:08:36 IST 2016,Did anyone tell Coldplay happening SB50 PepsiHalftime
joshauck,Mon Feb 08 06:08:28 IST 2016,A 4 yard difference seems silly use final challenge KeepPounding SB50
joshauck,Mon Feb 08 05:47:36 IST 2016,Cotchery having bad game far 2 peewee level drops maybe switched numbers Tedd Ginn SB50
joshauck,Mon Feb 08 05:39:32 IST 2016, But clearly incomplete nose ball hits ground shifts rolls over SB50
joshauck,Mon Feb 08 03:03:05 IST 2016,Its injustice Timbers second TD taken away VoteTimber PuppyBowl
joshauck,Mon Feb 08 01:08:35 IST 2016,The Puppy Bowl took shot Brian Williams PuppyBowl NBCNightlyNews
joshauck,Mon Feb 08 01:03:59 IST 2016,Serious question Puppy Bowl announcers better CBS team PuppyBowl SuperBowl
joshauck,Sun Feb 07 23:49:33 IST 2016, Still though skull fractures arent good thing easy fix NFL
joshauck,Sat Feb 06 09:14:46 IST 2016, Knee ligament injuries definition sprains seem indicate ACL easily diagnosed live
joshauck,Sat Feb 06 09:11:14 IST 2016,Bulls training staff real issue It happen anyone once screwed up Lu Jo Rose Butler coincidence Bulls
joshauck,Sat Feb 06 00:40:22 IST 2016,At point need think penalizing coaches well programs You know Pitino run greener pastures UofL
joshauck,Tue Feb 02 07:20:17 IST 2016,The SocialOutcasts Michael Scott tag team over place hard watch RAW
joshauck,Mon Feb 01 06:41:22 IST 2016,Rice call throw interception force fumble recover play again NFLProBowl2016 ProBowl
joshauck,Mon Feb 01 04:59:29 IST 2016,John Scott highest percentage career goals scored star game  NHLAllStar
joshauck,Mon Feb 01 03:31:45 IST 2016,These teams close eye-opening see much better Pau Deandre Jordan clippers bulls CHIatLAC
joshauck,Tue Jan 26 21:48:53 IST 2016,Did whine foul being called afterwards BlakeGriffin Clippers 
joshauck,Mon Jan 25 05:45:16 IST 2016,The RB playing QB thing becoming disservice Cam hes real QB whos league average pocket AZvsCAR KeepPounding
joshauck,Mon Jan 25 04:47:28 IST 2016,Gronk whine DoYourJob
joshauck,Mon Jan 25 04:44:38 IST 2016,Terrible challenge catch definitely fumble NEvsDEN BroncosCountryPlayoffs
