username,time,tweet
VanessaMiranda1,Thu May 21 15:24:02 IST 2015,This brilliant way 2 pay 4 taxesgreat financial advice 😒 yes being  household-debt 
VanessaMiranda1,Sun May 17 04:58:04 IST 2015,RT  Zappos employees cool Holacracy »  
VanessaMiranda1,Sat May 16 18:53:34 IST 2015,Interesting times Msia Online Classified New players Decline 2ndhand car market394K 300K units 2020 
VanessaMiranda1,Fri May 15 15:39:22 IST 2015,Nordic countries online buying trends 
VanessaMiranda1,Mon May 11 09:42:51 IST 2015,Nokia Here Has New US3 Billion Suitor Uber  Interesting 
VanessaMiranda1,Thu Apr 30 06:36:07 IST 2015,From one mckinsey publication barriers2internet 
VanessaMiranda1,Wed Apr 29 06:03:46 IST 2015,And game begandisruption  
VanessaMiranda1,Tue Apr 28 11:46:12 IST 2015,balance power world’s airlines indeed shifted Got love free market 
VanessaMiranda1,Fri Apr 24 19:58:24 IST 2015,Netflix eating TVs dinner Watch out traditional tvs operators   
VanessaMiranda1,Mon Apr 20 16:00:21 IST 2015,RT  Life change Sometimes painful Sometimes beautiful But time both sotrue
VanessaMiranda1,Mon Apr 20 15:59:29 IST 2015,RT  Update Jobstreet decide future direction market study - The Edge Markets 
VanessaMiranda1,Wed Apr 08 14:49:35 IST 2015,RT  Indian E-Commerce Giant Snapdeal Buys Bill Payment Service FreeCharge  
VanessaMiranda1,Thu Mar 12 04:31:49 IST 2015,RT  REPORT Chinese e-commerce giant Alibaba plans invest 200 million Snapchat 15 billion valuation 
VanessaMiranda1,Wed Mar 11 10:00:23 IST 2015,RT  A jury awarded Marvin Gayes family 74 million BlurredLines lawsuit  via  
VanessaMiranda1,Sat Mar 07 12:56:35 IST 2015,I wanna professional traveler 
VanessaMiranda1,Sat Mar 07 12:55:18 IST 2015, little late Hahahaha ☺️☺️
VanessaMiranda1,Sat Mar 07 12:53:36 IST 2015, red beanbag yo 
VanessaMiranda1,Wed Mar 04 10:46:35 IST 2015,RT  We crunched numbers  found surprises These 20 jobs biggest gender pay gaps  …
VanessaMiranda1,Fri Feb 27 05:24:55 IST 2015,RT  Bye bye bank tellers Heres digital banking future  
VanessaMiranda1,Sun Feb 22 05:42:41 IST 2015,Zlatan Ibrahimovic joins forces UN World Food Program
VanessaMiranda1,Mon Feb 16 20:26:07 IST 2015,“ omg pls tell asia stats p re-wear clothes 5x before washes  
VanessaMiranda1,Mon Feb 16 20:11:20 IST 2015,American Airlines New Boeing 787 Cabins cool -  Travel Airlines 
VanessaMiranda1,Mon Feb 16 20:08:57 IST 2015,1st HSBC now starbuckstax avoidancetax shifting gets profitable  
VanessaMiranda1,Mon Feb 16 19:59:16 IST 2015,RT  6 days 2015 Oscars Check out list nominees - includes Bradley Cooper  
VanessaMiranda1,Sun Jan 18 16:34:20 IST 2015, vs    DraculaUntold 100 better LucyMovie
VanessaMiranda1,Sun Jan 18 14:02:18 IST 2015,Movie marathon  DraculaUntold done now Lucy next Arrow Chillax Sunday 😘😘
VanessaMiranda1,Tue Dec 23 13:01:29 IST 2014,RIP Joe -  
VanessaMiranda1,Sat Dec 20 11:05:44 IST 2014,RT  Join MudahStories now it’s Day 9 
VanessaMiranda1,Fri Dec 19 18:09:22 IST 2014,RT  Join MudahStories now  it’s Day 8 
VanessaMiranda1,Fri Dec 12 13:40:35 IST 2014,RT  Join MudahStories Day 1 now  
VanessaMiranda1,Mon Dec 08 19:07:42 IST 2014,RT  McDonald’s serves up more weak monthly sales numbers  MCD
VanessaMiranda1,Sat Dec 06 14:18:26 IST 2014,Sorry US UKPress  sorry butur mobileweb crap thinkmobile 
VanessaMiranda1,Fri Dec 05 20:13:08 IST 2014,RT  Know LDP lanes starting 8th December onwards KL citylife urban trafficupdates 
VanessaMiranda1,Thu Dec 04 18:37:19 IST 2014,Uber banned SPAD  
VanessaMiranda1,Thu Dec 04 16:42:38 IST 2014,Telco thank DiGi insights  thinkmobile mobiletrend 
VanessaMiranda1,Wed Dec 03 20:50:57 IST 2014, interesting report
VanessaMiranda1,Tue Dec 02 04:45:44 IST 2014,RT  Feel CHEATEDafter  banked in2 wrong cimb acci hv waiting2be transfered back acc Mac/14 NO RESPONSE
VanessaMiranda1,Fri Nov 28 13:38:44 IST 2014,RT   Feel CHEATEDafter  banked in2 wrong cimb acci hv waiting2be transfered back acc Mac/…
VanessaMiranda1,Thu Nov 27 09:29:19 IST 2014,Should Sony forget smartphones  
VanessaMiranda1,Mon Nov 24 18:27:20 IST 2014,censorship poses special dangers freedom expression 
VanessaMiranda1,Sun Nov 16 15:21:22 IST 2014,- 
VanessaMiranda1,Fri Nov 14 13:53:29 IST 2014, hi contact re Fake Instagram account leveraging corporate brand Instagram trademark issue
VanessaMiranda1,Wed Nov 05 08:04:47 IST 2014,RT  Millennials generation see incivility online CivilityInAmerica  http//…
VanessaMiranda1,Wed Oct 15 19:06:03 IST 2014,RT  HP resume share buyback merger talks EMC fall flat - The Edge Markets  via 
VanessaMiranda1,Sat Oct 11 07:56:59 IST 2014,RT  Today announcing separation s businesses create two distinct technology companies 
VanessaMiranda1,Mon Oct 06 19:51:00 IST 2014,RT  Facebooks 19 billion acquisition WhatsApp finally official  
VanessaMiranda1,Tue Sep 30 09:14:26 IST 2014,RT covi Google 55 users research mobile phone want buy within hour - wow 
VanessaMiranda1,Sun Sep 14 22:10:06 IST 2014,RT warren Malaysian national ICT custodian MDeC welcome Dato Yasmin Mahmood new CEO tomorrow  
VanessaMiranda1,Sun Sep 14 22:09:29 IST 2014,RT  Steve Jobs Was Low-Tech Parent  foodforthought
VanessaMiranda1,Tue Sep 02 19:26:43 IST 2014,RT  Happy Birthday Salma Hayek The sexy stars turning big 4-8 today 
