username,time,tweet
House_of_gimp,Thu Feb 25 01:35:39 IST 2016,The opening scene spectacular  TheBritAwards
House_of_gimp,Thu Feb 25 01:31:57 IST 2016,Theres fuck tonight take piss out TheBritAwards Bieber doesnt spontaneously combust Im gonna sad
House_of_gimp,Thu Feb 25 01:28:13 IST 2016,Will someone go full jarvis cocker tonight TheBritAwards
House_of_gimp,Thu Feb 25 01:01:57 IST 2016,The brits suck balls tonight
House_of_gimp,Wed Feb 24 23:30:05 IST 2016,caz82 yeah true bad
House_of_gimp,Wed Feb 24 23:29:18 IST 2016,caz82 probably more manson monroe
House_of_gimp,Wed Feb 24 23:27:18 IST 2016,caz82 bet doesnt happen
House_of_gimp,Wed Feb 24 23:25:47 IST 2016,Who janes make up Dulux  ComeDineWithMe
House_of_gimp,Wed Feb 24 23:24:17 IST 2016,Not sure way sharon facing both front back boobs  ComeDineWithMe
House_of_gimp,Wed Feb 24 23:23:08 IST 2016,Look Jane remember kids drugs bad mmkay  ComeDineWithMe
House_of_gimp,Wed Feb 24 23:22:38 IST 2016, Lsd
House_of_gimp,Wed Feb 24 23:21:13 IST 2016,Interpreting Diana Dors What make twat pompadoms ComeDineWithMe
House_of_gimp,Wed Feb 24 23:19:07 IST 2016,The bloke tash looks hes accident rimming someone ComeDineWithMe
House_of_gimp,Wed Feb 24 23:16:08 IST 2016, worlds worst bowie tributeI think
House_of_gimp,Wed Feb 24 23:15:17 IST 2016,Has old bag turned up shittest bowie tribute ComeDineWithMe
House_of_gimp,Wed Feb 24 23:13:48 IST 2016,Just turned over ComeDineWithMe fuck fur
House_of_gimp,Wed Feb 24 20:24:03 IST 2016,He feels fkn everyone ffs jeremykyleemergencyroomemergencyroom
House_of_gimp,Wed Feb 24 20:15:32 IST 2016,I bet feet smell toilet morning night before jeremykyleemergencyroomemergencyroom
House_of_gimp,Wed Feb 24 20:14:16 IST 2016,With toes hell launching aerial attacks above kebabs  jeremykyleemergencyroomemergencyroom
House_of_gimp,Wed Feb 24 20:11:42 IST 2016,My back kills Ive never kebab makes feel better jeremykyleemergencyroomemergencyroom
House_of_gimp,Wed Feb 24 20:10:26 IST 2016,Carer code dwp theyre watching jeremykyleemergencyroom
House_of_gimp,Wed Feb 24 20:09:28 IST 2016,Is fat gunt special jeremykyleemergencyroomemergencyroom
House_of_gimp,Wed Feb 24 20:03:08 IST 2016,His obese wife tried reverse cowboy nearly crushed poor fucker death left  hernia jeremykyleemergencyroomemergencyroom
House_of_gimp,Wed Feb 24 20:00:06 IST 2016, Im using both safe lol
House_of_gimp,Wed Feb 24 19:59:31 IST 2016,I bet shed look something pair Fishnets  Something along lines joint pork jeremykyleemergencyroomemergencyroom
House_of_gimp,Wed Feb 24 19:08:30 IST 2016,Mistakenly used 24mg juice rda Lungs now floor😫
House_of_gimp,Wed Feb 24 17:34:25 IST 2016,Holly confused cupboard  thismorning
House_of_gimp,Wed Feb 24 17:10:28 IST 2016, caz82 😂😂😂
House_of_gimp,Wed Feb 24 17:09:51 IST 2016, big game kid better yours
House_of_gimp,Wed Feb 24 17:06:37 IST 2016,Parade young child dressed little slut claim charity feed ego thismorning
House_of_gimp,Wed Feb 24 17:05:05 IST 2016,caz82  see Harvey brother
House_of_gimp,Wed Feb 24 17:04:17 IST 2016, natural
House_of_gimp,Wed Feb 24 17:03:04 IST 2016,Buy view want £300 tv cost £1200 thismorning
House_of_gimp,Wed Feb 24 17:00:33 IST 2016,thismorning further apart eyes back head 
House_of_gimp,Wed Feb 24 16:57:55 IST 2016,Thats ham cold kebab meat takeaway Sheffield  thismorning
House_of_gimp,Wed Feb 24 16:53:38 IST 2016,Local cheeses ones Aldi ones Lidl rest tesco value  thismorning
House_of_gimp,Wed Feb 24 16:52:25 IST 2016,Itsa gino live da sheffield thismorning
House_of_gimp,Wed Feb 24 16:51:28 IST 2016,All oils shown todays show available Halford stores thismorning
House_of_gimp,Wed Feb 24 16:50:26 IST 2016, therell strongly wonder letter I dont see one today
House_of_gimp,Wed Feb 24 16:47:55 IST 2016,Prices daughter definitely Harvey gene two thismorning
House_of_gimp,Wed Feb 24 16:45:54 IST 2016, ofgimp days complete without tumble dryer
House_of_gimp,Wed Feb 24 16:45:34 IST 2016,Paper bag fix roseacea love thismorning
House_of_gimp,Wed Feb 24 16:44:04 IST 2016, I know I staring until came
House_of_gimp,Wed Feb 24 16:40:59 IST 2016,We someone show dry clothes yesterday Today apply oil  thismorning
House_of_gimp,Wed Feb 24 16:38:21 IST 2016,The eating disorder upsetting professionally offended brigade thismorning
House_of_gimp,Wed Feb 24 16:35:59 IST 2016,thismorning weather Cold scattering tumble dryer fires
House_of_gimp,Wed Feb 24 16:33:31 IST 2016,Fuck course youd start eating meant youd away speakmans  faster  thismorning
House_of_gimp,Wed Feb 24 16:24:10 IST 2016,Its film Amy pocket liner dad thismorning
House_of_gimp,Wed Feb 24 16:20:46 IST 2016,Lie early looking youthful plastic surgery present bullshit products thismorning
House_of_gimp,Wed Feb 24 16:18:20 IST 2016, giving I good dad I failure basically cashing death thismorning
