username,time,tweet
erynnmccabe,Fri Feb 26 20:32:54 IST 2016,I better blackout drunk tonight celebrate awesome week hahahah 
erynnmccabe,Fri Feb 26 09:29:30 IST 2016,gif legit explains mood swings lmaooo 
erynnmccabe,Fri Feb 26 09:26:23 IST 2016,I really hope one day I go prove lot people wrong
erynnmccabe,Fri Feb 26 09:21:21 IST 2016,RT  11 holy shit havent heard song years such big part life OMG 
erynnmccabe,Fri Feb 26 06:51:07 IST 2016,RT  
erynnmccabe,Thu Feb 25 23:38:35 IST 2016,RT  life fucked up lit same time
erynnmccabe,Thu Feb 25 21:53:12 IST 2016,I court I cant even find escort lmao take
erynnmccabe,Thu Feb 25 21:50:01 IST 2016,yall lucky youre
erynnmccabe,Thu Feb 25 02:44:26 IST 2016,man lowkey hating yourself really tiring
erynnmccabe,Wed Feb 24 22:48:20 IST 2016,RT  Taking contouring next level 😁 
erynnmccabe,Wed Feb 24 22:37:18 IST 2016,Id alone pretending friends someone care less
erynnmccabe,Wed Feb 24 22:23:52 IST 2016,I walking disaster
erynnmccabe,Wed Feb 24 10:12:10 IST 2016,depressed bc isnt summer
erynnmccabe,Wed Feb 24 07:28:53 IST 2016,RT  YALL DID NOT DO RATATOUILLE LIKE THIS 
erynnmccabe,Wed Feb 24 07:25:23 IST 2016,RT  damn jason 😂😂 
erynnmccabe,Wed Feb 24 03:20:48 IST 2016,I cant buy 5 WHoLE FREAKING DOLLers yes I pay 80 belly button pierced
erynnmccabe,Mon Feb 22 09:39:38 IST 2016,somebody talk 2
erynnmccabe,Mon Feb 22 05:38:48 IST 2016,everyone mall look DJ khaled 
erynnmccabe,Sun Feb 21 10:18:58 IST 2016,RT  This cant take niggas anywhere 
erynnmccabe,Sun Feb 21 08:19:32 IST 2016,RT  Every person mall major staring issues
erynnmccabe,Sun Feb 21 08:17:21 IST 2016,RT 7randy LMFAOOOOOO I LOVE ZUMIEZ 
erynnmccabe,Sun Feb 21 07:09:16 IST 2016,RT  vine never old 
erynnmccabe,Sat Feb 20 22:38:38 IST 2016,  oh god
erynnmccabe,Sat Feb 20 02:06:47 IST 2016,RT  gonna catch feelings 
erynnmccabe,Sat Feb 20 02:06:24 IST 2016,screw I guess cat escort Ill put tux carry down aisle
erynnmccabe,Sat Feb 20 02:05:41 IST 2016,I
erynnmccabe,Sat Feb 20 02:05:32 IST 2016,y everyone hate tho
erynnmccabe,Fri Feb 19 00:50:20 IST 2016,gettin 
erynnmccabe,Thu Feb 18 20:44:29 IST 2016,RT  29
erynnmccabe,Thu Feb 18 07:27:07 IST 2016,RT  FAM THIS KILLS ME EVERY TIME💀 
erynnmccabe,Thu Feb 18 03:00:19 IST 2016,RT  National Anthem 
erynnmccabe,Thu Feb 18 02:59:35 IST 2016, OG kush
erynnmccabe,Thu Feb 18 02:58:00 IST 2016,RT  Prime example men being faithful times 
erynnmccabe,Wed Feb 17 22:09:12 IST 2016,broke ugly  fat hair pretty
erynnmccabe,Wed Feb 17 21:03:13 IST 2016,mom didnt even call senior skip day I sick lmao
erynnmccabe,Wed Feb 17 21:01:01 IST 2016,RT  people wait two arent friends anymore yall used closeme 
erynnmccabe,Wed Feb 17 09:06:51 IST 2016,RT  I WANT TO TRY THIS 🙆🏼🙌🏻 
erynnmccabe,Wed Feb 17 02:31:29 IST 2016, lmao thanks dawg
erynnmccabe,Tue Feb 16 23:00:20 IST 2016,wont  
erynnmccabe,Tue Feb 16 22:58:44 IST 2016,RT  favorite one far 
erynnmccabe,Tue Feb 16 22:45:25 IST 2016,RT  ICE CUBES SNAPCHAT IM DEAD 
erynnmccabe,Tue Feb 16 22:40:55 IST 2016,RT  The more watch funnier gets 😂 
erynnmccabe,Tue Feb 16 09:24:59 IST 2016,Im another basic bish septum piercing
erynnmccabe,Tue Feb 16 02:47:20 IST 2016,daily erynn 
erynnmccabe,Mon Feb 15 09:55:05 IST 2016,RT  The Valentines message I today 
erynnmccabe,Mon Feb 15 08:31:02 IST 2016,RT  When savage lowkey emotional  wanna held 
erynnmccabe,Sun Feb 14 22:38:44 IST 2016, I never specifically lightyears measurement time whatever Branson everyone know smarter go away
erynnmccabe,Sun Feb 14 22:32:39 IST 2016, bc something 25 lightyears away take 25 years see light produced
erynnmccabe,Sun Feb 14 22:31:58 IST 2016, time tho lol
