username,time,tweet
justinalsoufi,Fri Nov 27 22:26:20 IST 2015,Well done Rail another metro train running shoebury 5pm 
justinalsoufi,Sat Nov 14 04:13:02 IST 2015,What crazy senseless world live times prayforparis
justinalsoufi,Fri Nov 13 01:34:55 IST 2015,Just sit down beer reminisce privilege seeing ELO ElectricLightOrchestra 
justinalsoufi,Tue Nov 10 01:24:09 IST 2015, tooling up weapons readily available
justinalsoufi,Tue Nov 10 01:04:52 IST 2015, Rail saw canvey approaching right nervous maybe
justinalsoufi,Tue Nov 10 00:59:22 IST 2015,How many people stand escalators travelators gym membership justsaying
justinalsoufi,Fri Nov 06 03:48:21 IST 2015,Ikea hide seek amazing good idea Boys Brigade trip
justinalsoufi,Sat Oct 31 00:59:00 IST 2015,About watch How To Train Dragon 2 I turn Chloe film based true story Rachel turns special
justinalsoufi,Fri Oct 30 11:10:40 IST 2015,Why mind play cruel tricks waking up early give good news Saturday indeed friday pants
justinalsoufi,Fri Oct 30 03:32:33 IST 2015,BB annual returns complete Time Beer
justinalsoufi,Wed Oct 28 13:43:40 IST 2015, jesting quality trains over Rail fair grateful getting work nevertheless
justinalsoufi,Wed Oct 28 13:02:51 IST 2015,On line today aka   Surely Rail customers use 1st class replacement
justinalsoufi,Sun Oct 25 00:47:52 IST 2015,RT rosberg mercedes 1-2 out track moment hurricane  USGP f1 cota  
justinalsoufi,Sat Oct 24 03:29:32 IST 2015,Based James Bond name calc name give private parts grandmothers maiden name bond name Willy Blow grahamnorton
justinalsoufi,Fri Oct 16 01:09:44 IST 2015,Just watching first ep latest series apprentice What load dicks TheApprentice
justinalsoufi,Tue Oct 13 11:38:37 IST 2015,Some mens manspread extreme cant help think severe case swollen testicles timetoseekmedicaladvice
justinalsoufi,Mon Oct 12 00:57:32 IST 2015,wonmoretime RussianGP mercedesamgf1 
justinalsoufi,Sun Oct 11 20:20:04 IST 2015, well done best team Proud  happy fan
justinalsoufi,Sun Oct 11 20:17:40 IST 2015,RT  CONFIRMED Yeeeeeessss World Champions second time row Proud humbled part team WonMoreTime ht…
justinalsoufi,Fri Oct 09 16:51:23 IST 2015,RT  Well comment lie now Plenty time discuss garage neighbours next year 😘 
justinalsoufi,Fri Oct 09 02:21:23 IST 2015, hmmm I wasnt drunk I excuse
justinalsoufi,Fri Oct 09 02:20:01 IST 2015,Starting wonder anyone NOT seeing  o2 week justsaying
justinalsoufi,Wed Oct 07 02:08:17 IST 2015, I try look face Altho I feel I visually inspected prostate many times without trying 😕
justinalsoufi,Wed Oct 07 00:08:00 IST 2015,Ahhhh man see week swimming pool changing rooms bent over butt naked drying between toes train near
justinalsoufi,Tue Oct 06 13:18:52 IST 2015,Sorry ladies gents train BEHIND delayed going held platform bit  best
justinalsoufi,Mon Oct 05 22:41:27 IST 2015,Rail having bit mare tonight The announcer fenchurch st well explode wearesorry
justinalsoufi,Mon Oct 05 13:00:18 IST 2015,Christmas lights going up Oxford st premature thatlasthashtagmaybeunwise
justinalsoufi,Wed Sep 30 13:25:11 IST 2015, worst non Londoners tube waiting 4 doors open reach press buttonThat button dont work
justinalsoufi,Wed Sep 30 11:15:58 IST 2015, try harder
justinalsoufi,Fri Sep 25 12:26:38 IST 2015,   007 No passion Just whiny -
justinalsoufi,Fri Sep 25 12:25:36 IST 2015,I wonder many cigarettes smoke indirectly whilst walking Fenchurch St Bank back day passivesmokingsucks
justinalsoufi,Fri Sep 18 16:35:18 IST 2015,bbcf1 How many times quantity floodlights mentioned commentators SingaporeGP
justinalsoufi,Thu Sep 03 13:37:12 IST 2015,Sign don’t agree go  see image dead boy sign  migrantcrisis
justinalsoufi,Fri Aug 21 14:25:46 IST 2015,Rail  start bending breaking rules here stop Next talking quiet coach acceptable -
justinalsoufi,Fri Aug 21 14:16:54 IST 2015,Rail  Think careful way fear breach terms selfie -
justinalsoufi,Fri Aug 21 14:02:52 IST 2015,Rail  If hand someone group photo termed USIE Selfie rossigate
justinalsoufi,Fri Aug 21 13:23:08 IST 2015,Want Spa BelgianGP
justinalsoufi,Wed Aug 19 22:10:44 IST 2015,Its love hate relationship Rail  Today love thanks free icecream
justinalsoufi,Tue Aug 18 17:23:30 IST 2015, unfortunately ive seen worse Pleasuresofcommuting
justinalsoufi,Tue Aug 18 17:22:20 IST 2015,When wife I argue we’re band concert start new stuff roll out greatest hits - Frank Skinner
justinalsoufi,Mon Aug 17 22:56:57 IST 2015, theres thinking tough bird x
justinalsoufi,Mon Aug 17 22:53:57 IST 2015, going lie apparently walked past earlier wouldnt noticed anyway trained myself forget -p
justinalsoufi,Mon Aug 17 22:51:06 IST 2015, yep Bit time went text thought cant bothered -
justinalsoufi,Mon Aug 17 22:48:05 IST 2015, well 621 well ignored
justinalsoufi,Wed Aug 12 17:20:23 IST 2015,CPD wine cellars today With free Wine
justinalsoufi,Tue Aug 11 22:31:09 IST 2015,Those screens scroll through tell platform go Are set screen need never up first conspiracy
justinalsoufi,Mon Aug 10 00:25:44 IST 2015,Carlsberg dont make weekends probably still beat weekend Ive blessed
justinalsoufi,Wed Aug 05 20:05:23 IST 2015, saying massive plan elaborate April Fools Day totally amazing  dont want miss
justinalsoufi,Wed Aug 05 19:48:05 IST 2015,April Fools Day
justinalsoufi,Tue Aug 04 11:58:25 IST 2015, 710 southend east running normal x
