username,time,tweet
jiujitsunow,Sun Feb 28 08:36:32 IST 2016,Almost 4-0-0 followers yessssssssssss 
jiujitsunow,Sun Feb 28 08:34:00 IST 2016,   No London Underground next trip Checked
jiujitsunow,Sun Feb 28 05:49:13 IST 2016,  Even QElizabeth F judges UFCLondon shesaidwhat
jiujitsunow,Sun Feb 28 05:22:13 IST 2016,There Decision KO fight both PricelessUFCLondres
jiujitsunow,Sun Feb 28 05:20:00 IST 2016,RT   beautiful commentary tonight’s fights
jiujitsunow,Sun Feb 28 05:19:23 IST 2016,RT  Raf hard work covering oscars talk show  Repost… 
jiujitsunow,Sun Feb 28 05:17:18 IST 2016, I think Herbs  Gin won 3rd round give round ref
jiujitsunow,Sun Feb 28 05:14:52 IST 2016, wallet Fudge
jiujitsunow,Sun Feb 28 05:14:00 IST 2016,Gente Silva perdeu Vamu pras ruas Ihh esqueci que já tem um protesto dia 13deixa pra lá UFCLondres
jiujitsunow,Sun Feb 28 04:50:08 IST 2016,Mais que Silvarada na cara Bisping UFCLondres
jiujitsunow,Sat Feb 27 08:24:23 IST 2016,RT           …
jiujitsunow,Sat Feb 27 05:07:28 IST 2016,Sunset final de trade Priceless paraiso beach praia philippines 
jiujitsunow,Sat Feb 27 04:48:56 IST 2016,Ganhei um campeonato de Cuspe distância em 1986 na escola ainda conta Os muleques falaram q era mundial caducou expirou validade
jiujitsunow,Sat Feb 27 04:44:29 IST 2016,RT  FF         
jiujitsunow,Fri Feb 26 14:52:07 IST 2016,Before during BJJ class whats drink  energy jiujitsu drink
jiujitsunow,Fri Feb 26 14:32:38 IST 2016, Oss
jiujitsunow,Thu Feb 25 06:28:29 IST 2016,  What A heavy weight paycheck 
jiujitsunow,Wed Feb 24 23:24:35 IST 2016,Time bike same spot kerrysports PH 
jiujitsunow,Wed Feb 24 18:18:51 IST 2016,RT  MusclePharm Daily Workouts Wednesday Fat BurnerWeLiveThis RealAthletesRealScience MPNation 
jiujitsunow,Wed Feb 24 18:18:13 IST 2016,Last day AOR Manila Megamall music barchords powerchords 
jiujitsunow,Wed Feb 24 18:15:45 IST 2016,RT  Penúltimo dia para enviar seu e-mail e concorrer uma das 5 vagas Garantimos sigilo total de… 
jiujitsunow,Wed Feb 24 18:15:24 IST 2016,Sem amarração nostalling semamarração 
jiujitsunow,Wed Feb 24 18:12:27 IST 2016,How Bjj Videos Impact Your daily train Is professor ok mad train bjjdvd
jiujitsunow,Wed Feb 24 18:09:46 IST 2016,Queimou os dedos pé ontem treino o q fazer Treinar ou procurar cura Mats burn wrestling treinoduro
jiujitsunow,Wed Feb 24 17:24:28 IST 2016,You question bout Jiu-Jitsu position afraid ask cuz people make fun Wrong school dont care environment
jiujitsunow,Wed Feb 24 16:37:59 IST 2016,  oh gosh here goes another wedding welovefights sorrybaby
jiujitsunow,Wed Feb 24 16:10:01 IST 2016,RT  Gostei de um vídeo   On Cars - Catch Me If You Can - Vevo dscvr Live
jiujitsunow,Wed Feb 24 15:59:34 IST 2016,Please describe trash Too lateshitwasDONE bathroomsigns 
jiujitsunow,Wed Feb 24 15:46:13 IST 2016,RT  󾓬󾓦Fundamentals class specific training immobilizations Brazil-021 Arlington Heights tonight󾓪󾓮Aula de http…
jiujitsunow,Wed Feb 24 15:44:39 IST 2016,  make sure enough granola porra
jiujitsunow,Wed Feb 24 15:43:22 IST 2016,O melhor inimigo será aquele q é honesto Vamos encarar o espelho boratreinar parceria focu
jiujitsunow,Wed Feb 24 15:40:16 IST 2016,What best day train Anythinghappyday train best
jiujitsunow,Wed Feb 24 15:38:11 IST 2016, whatup Or Qual é
jiujitsunow,Wed Feb 24 15:37:28 IST 2016,RT  Another huge thank Matt Godden BJJ everyone supported event Its amazing see far https…
jiujitsunow,Wed Feb 24 15:37:16 IST 2016,RT  Açai OG  LA 
jiujitsunow,Wed Feb 24 15:32:50 IST 2016, Wassup
jiujitsunow,Tue Feb 23 20:11:36 IST 2016,Royce Vc bateu Eu Eu não Shamrock Golpe baixo Eu Eu não avidadamuitasvoltas haha
jiujitsunow,Tue Feb 23 20:09:09 IST 2016,Shamrock como você se sente agora dizendo que o Royce fez algo e ele diz que não karma bitch
jiujitsunow,Tue Feb 23 10:26:29 IST 2016,RT  MuayThai included IFMA Asian Beach Games 2016 Vietnam martialarts mma ufc 
jiujitsunow,Tue Feb 23 10:26:16 IST 2016,RT  Treino da noite Monday    Keller Cebola Russão Akebono Siri Flag e Saguí https…
jiujitsunow,Mon Feb 22 15:39:29 IST 2016,Qual será próxima No comando musical yamanha epiphone 
jiujitsunow,Mon Feb 22 15:34:41 IST 2016, foi di-menor Chegou da escola tirou o sapato e boom meiafurada
jiujitsunow,Mon Feb 22 15:25:20 IST 2016,IM ALIVE 
jiujitsunow,Mon Feb 22 06:20:58 IST 2016,   I dizzy nice tho
jiujitsunow,Sat Feb 20 18:46:37 IST 2016,Always controversy Royce shamrock bellator
jiujitsunow,Sat Feb 20 10:11:27 IST 2016,Sério pra uns engraçado pra outros Bellator149 funny seriously
jiujitsunow,Fri Feb 19 18:48:39 IST 2016, espera o juiz separar dessa vez se o kenshamrock bater não larga não hein Just In case Bellator
jiujitsunow,Fri Feb 19 18:44:04 IST 2016,RT  Custom guitar ideas Our builder bring lifeTry here  
jiujitsunow,Fri Feb 19 18:39:57 IST 2016,A hora é agora AOR megamall manila Philippines barcords music guitar 
jiujitsunow,Thu Feb 18 17:41:02 IST 2016, Not time Have fun philippines manila makati
