username,time,tweet
Mustay,Fri Feb 26 13:48:03 IST 2016, Dont worry patient Ppl diff definitons patience  |   Traffic  
Mustay,Fri Feb 26 13:45:41 IST 2016, Have attempted Talk cheap hardwork  
Mustay,Wed Feb 24 12:19:33 IST 2016,FreshlyPressed981 Maina pronounced May-na My-na
Mustay,Fri Feb 19 23:07:56 IST 2016,help  If CURRENT BALANCE less AVAILABLE BALANCE money left account
Mustay,Fri Feb 19 23:06:55 IST 2016, help Sometimes need check CURRENT BALANCE vis-à-vis AVAILABLE BALANCE
Mustay,Fri Feb 19 02:51:27 IST 2016, traffic   S Na go beg senate slash budget Goodnight
Mustay,Fri Feb 19 02:49:49 IST 2016,traffic   R Whatever D means communication make feel  lets see youre working 4 consumers 
Mustay,Fri Feb 19 02:47:46 IST 2016, traffic     Q Not everyone time visit offices physically
Mustay,Fri Feb 19 02:47:07 IST 2016,traffic    P I remember Gbenga  using  itself na long thing
Mustay,Fri Feb 19 02:38:37 IST 2016, traffic  O And thats I advise  make use Ikeja Forum 
Mustay,Fri Feb 19 02:37:55 IST 2016,traffic   N If Nigerians found solace  trust theyll refer people guys
Mustay,Fri Feb 19 02:36:40 IST 2016, traffic   If job well consumers PR Advert CPC  Zero costs
Mustay,Fri Feb 19 02:35:08 IST 2016, traffic   M If case popular die infamous death
Mustay,Fri Feb 19 02:34:24 IST 2016, traffic   L Then someone Nigerians complain Twitter Sometimes I blame
Mustay,Fri Feb 19 02:33:35 IST 2016, traffic   K And thats typical Nigerians experience - helpless Making look Zoros
Mustay,Fri Feb 19 02:32:24 IST 2016, traffic   J I definitely call CONSUMER PROTECTION Instead thats CONSUMER PROTECTORLESS
Mustay,Fri Feb 19 02:30:10 IST 2016, traffic   I Appears letter sooth nerves agitated customer
Mustay,Fri Feb 19 02:29:28 IST 2016,traffic   H After experience I tried  twice All na letter ongoing investigation
Mustay,Fri Feb 19 02:28:00 IST 2016, traffic   G Omo na dere e end I follow-up tey follow-up unfollowed NoResponse
Mustay,Fri Feb 19 02:26:59 IST 2016,traffic   F Alas same year I used  letter investigation ongoing
Mustay,Fri Feb 19 02:25:57 IST 2016,traffic   E I remember rep used challenge Nigerians test  see results
Mustay,Fri Feb 19 02:25:10 IST 2016,traffic   D The essence enlighten Nigerians rights vis-à-vis s duties
Mustay,Fri Feb 19 02:24:13 IST 2016, traffic   C Cant remember day weekly show morning
Mustay,Fri Feb 19 02:23:00 IST 2016,traffic   B Circa 2013/14  came up show Radio Nigeria network
Mustay,Fri Feb 19 02:21:55 IST 2016,traffic   A I playing Mr Pessimist Ill take up 
Mustay,Thu Feb 18 22:25:36 IST 2016,NRA   Do Indians here consider prices use TATA likes Nigeria 
Mustay,Thu Feb 18 22:20:24 IST 2016,NRA  Apple tight spot Obeying s wishes opening Pandora box
Mustay,Thu Feb 18 22:16:49 IST 2016, traffic Take mobile court drivers alone Noise pollution
Mustay,Thu Feb 18 20:33:07 IST 2016, traffic   send one letter follow-up I want dem2 prove wrong
Mustay,Thu Feb 18 12:14:15 IST 2016,FreshlyPressed981 Just day Magu cited 1 EFCC lawyer vs 34 SANs 90 lawyers another EFCC case
Mustay,Thu Feb 18 12:11:33 IST 2016,FreshlyPressed981 Okufi talks sanctity Contracts avoids fair billing  measurement consumers electricity consumption
Mustay,Thu Feb 18 12:06:09 IST 2016,FreshlyPressed981 The DISCOS regulated government agency NERC Hence oversight NASS
Mustay,Wed Feb 17 16:51:20 IST 2016, Ironically Mikel touch Zlatans goal Zlatan touch Mikels 
Mustay,Wed Feb 17 16:50:10 IST 2016,Its strange commentators speak strangely Mikels goal Same Makelele - unlikely sources 
Mustay,Wed Feb 17 02:03:39 IST 2016,traffic  Champions League Night
Mustay,Wed Feb 17 02:01:42 IST 2016, Fatglive And Chelsea goal Mikel written over Mikel cancels Mikel
Mustay,Wed Feb 17 01:57:30 IST 2016,PSGCHE The PSG goal Mikel written over 
Mustay,Wed Feb 17 01:44:54 IST 2016,I knew  wld go commercial CommonSense vids Putitinabook
Mustay,Wed Feb 17 01:20:08 IST 2016,9ja The Obi Somto TV SOUNDS different  radio Voice/face mismatch 😁
Mustay,Tue Feb 09 12:25:25 IST 2016,FreshlyPressed981  diabolically wicked way Thats tautological
Mustay,Mon Feb 08 12:45:53 IST 2016, I concur High rubbish lazy Perhaps record show ▶ beep sounds 
Mustay,Mon Feb 08 12:44:10 IST 2016,RT  FreshlyPressed981 Cheta needs adopt Best Practise Broadcast Dont ask audience High  PMB …
Mustay,Mon Feb 08 12:16:07 IST 2016,freshlypressed981 Rubbish Dutse Nawa o
Mustay,Mon Feb 08 12:09:52 IST 2016,The former president LAZY present Appropriation Bill Haba o saaro Monday freshlypressed981
Mustay,Mon Feb 08 01:21:52 IST 2016, Okupe making responsible statements la s vacation
Mustay,Mon Feb 08 01:18:52 IST 2016,  SC judge based facts presented Acts/constitution supercede sentiments opinions
Mustay,Mon Feb 08 01:15:52 IST 2016, I agree Okupes analysis Oyeguns comments SC judgments Leaders need careful public utterances
Mustay,Fri Feb 05 22:49:02 IST 2016,Kudos   You story tell  
Mustay,Fri Feb 05 22:44:06 IST 2016, Did notice use sole purpose
Mustay,Wed Feb 03 14:36:29 IST 2016,   A case PAYMENT before COMPLAINT SERVICE PAYMENT
