username,time,tweet
asapsealy,Thu Apr 16 19:07:15 IST 2015,Early morning frustration dealing   stellar customer service  suchAShame
asapsealy,Fri Apr 03 16:25:22 IST 2015,RT aTeN Tomorrow FitFridays  comes discuss   addition NEW Fitness component http/…
asapsealy,Thu Mar 26 02:54:25 IST 2015,foodTruck Miami Wynwood need food truck provide food 100 hungry young professionals money LMNT 7pm
asapsealy,Mon Mar 23 02:15:04 IST 2015,Im having dinner show party over bday weekend differentVibes caribbeanUnplugged April11 tickets sale now 
asapsealy,Mon Mar 23 02:11:44 IST 2015,They front IT IT fell sky hit head clue IT  entrepreneurLife
asapsealy,Fri Mar 20 01:53:10 IST 2015,I excited I heading I sometimes forget Im already ThatBrandingGuy
asapsealy,Mon Mar 16 00:17:13 IST 2015,  ThankYou customer service amazing happyCustomer
asapsealy,Sun Mar 15 21:17:50 IST 2015,God solution readyForAnything BlessedSunday
asapsealy,Wed Mar 04 20:01:10 IST 2015,  dealing w/ customer service 3 months Not sure Im deal another rep frustrated  loyal
asapsealy,Wed Mar 04 19:40:41 IST 2015,  over 6 months Im still being charged returned iPhone5s HELP
asapsealy,Sun Feb 22 05:17:03 IST 2015,Thank WreckBar BOcean Raw chickenFingers daughter neverAgain worstExperience 
asapsealy,Sun Feb 22 03:38:16 IST 2015,RT  congrats  thank community    
asapsealy,Fri Feb 13 23:17:49 IST 2015,Hanging peeps  BrowardCounty NonProfitAcademyAwards oscars211   
asapsealy,Sun Feb 08 00:12:34 IST 2015,“ Thanks 1st class customer service  Travel LikeahBoss ” 
asapsealy,Wed Feb 04 23:06:55 IST 2015,YOU texting driving playing RussianRoulette MY life itCanWait thatBrandingGuy
asapsealy,Sat Jan 31 06:47:37 IST 2015,What long tiring extremely productive week blessed thankful entrepreneurLife thatBrandingGuy asapSealy worthThePain
asapsealy,Thu Jan 29 22:23:49 IST 2015,RT  Miami Carnival Inc appoints new Board     
asapsealy,Tue Jan 20 19:43:54 IST 2015,Humbled EntrepreneurOfTheMonth BrickellLiving    
asapsealy,Thu Jan 08 02:28:24 IST 2015,RT  blackShadowStudios working newMusic talent Production Studio  akaq  TeamQ http/…
asapsealy,Mon Dec 08 20:22:38 IST 2014,Whats good detox rid negative people mondayCleanse
asapsealy,Sun Dec 07 13:11:58 IST 2014,RT  The streets ArtBasel MiamiLife 
asapsealy,Wed Dec 03 23:36:23 IST 2014,loveHarder ArtBasel2014 ILoveMyCity asapsealy 
asapsealy,Wed Dec 03 09:06:12 IST 2014,troubleInTheWater   Home listening party  
asapsealy,Thu Nov 27 05:40:07 IST 2014,Not fastFood fan Loving Wendys new slogan - Quality recipe 👌   
asapsealy,Tue Nov 25 19:56:37 IST 2014,Anything Anything Anything feel alive
asapsealy,Sat Nov 22 04:01:26 IST 2014,Headed  private MiamiUnder40 BadJews look out review  
asapsealy,Thu Nov 06 07:30:16 IST 2014,RT  We invite special MiamiUnder40 screening theatrical performance BadJews 
asapsealy,Mon Nov 03 23:11:09 IST 2014,As professionals relationships foster impact brands represent asapsealy
asapsealy,Sun Nov 02 21:51:48 IST 2014,Realization truth sometimes lead disappointing reality asaPSealy
asapsealy,Wed Oct 29 10:49:26 IST 2014,RT  We excited selected Phase2 grant process plan 1st Annual 
asapsealy,Sat Oct 25 07:58:06 IST 2014,The worst lies tell ones tell ourselves 💯 
asapsealy,Thu Oct 16 17:15:22 IST 2014,RT  How brands engaging effectively users Instagram  
asapsealy,Thu Oct 16 17:15:19 IST 2014,“ Brands easily increase exposure Instagram 3 trends  
asapsealy,Wed Oct 15 18:27:47 IST 2014,I love word multicultural means Hispanic operating MIAMI market adAgencies
asapsealy,Tue Oct 14 23:13:32 IST 2014,RT  Win VACATION TO MIAMI BEACH Share Pics/Videos FeelSoGood Moment Just Add FeelSoGood   http…
asapsealy,Sun Oct 05 07:29:48 IST 2014,RT  Your host IRAWMA 2014 showtime 30mins check website  app available 
asapsealy,Sat Oct 04 03:02:06 IST 2014,RT  Thank amazing students Shanghai Civil Aviation College  team welcome ht…
asapsealy,Sat Oct 04 03:01:18 IST 2014,Genuinely feeling blessed highly favored godIsGreat
asapsealy,Tue Sep 23 16:13:01 IST 2014,fact simplystated “ When really care someone happiness matters more yours”
asapsealy,Mon Sep 22 21:50:58 IST 2014, I guess customer service thing work onAMonday emptytank myLuck 
asapsealy,Mon Sep 22 21:18:30 IST 2014, poor customerService Avis Im way over gunther go back training 
asapsealy,Mon Sep 22 21:17:16 IST 2014,enterpriseRental Poor much ask - CSRs dont speak back customers Gunther go back training 
asapsealy,Sun Sep 21 01:43:57 IST 2014,Judging curry duck competition Orlando swear Im gonna leave here smelling Debe Trinidad 
asapsealy,Sat Sep 20 18:44:07 IST 2014,orlando Im back work ybop specialEvents clients CaribbeanAir 
asapsealy,Fri Sep 12 16:52:49 IST 2014,RT  Thank Lord another day
asapsealy,Fri Sep 12 08:11:25 IST 2014, blessings special day 10 years strong Thank communities US salute
asapsealy,Mon Sep 01 18:25:06 IST 2014,RT  FF    events programs celebrating CaribbeanAmericanCulture
asapsealy,Mon Aug 18 18:41:26 IST 2014,RT  FijiMusicFestival 93014 OrlandoFL Music Black Chiney Friends | Tickets available online 
asapsealy,Sat Aug 16 08:47:08 IST 2014,I dont come bow I come conquer Robert Nesta Marley 
asapsealy,Tue Aug 05 03:03:54 IST 2014,Are real unsafe drivingConditions SouthFlorida Miami 
