username,time,tweet
SicTransit34,Sat Feb 27 20:43:56 IST 2016,TheLastWord Trump perfect POTUS wont need press check How criticize perfection 
SicTransit34,Sat Feb 27 20:20:32 IST 2016,Im waiting anti-Trump conservatives somehow blame Trumps rise solely President Obama nenertrump
SicTransit34,Sat Feb 27 20:13:54 IST 2016,RT  I many others vote  over short-fingered fascist vulgarian NeverTrump  
SicTransit34,Sat Feb 27 20:10:33 IST 2016,RIP Republican Party 1854-2016 aka 
SicTransit34,Sat Feb 27 20:06:55 IST 2016,Imagine Trump   Obama change laws sue critics media big 
SicTransit34,Sat Feb 27 19:59:15 IST 2016,RT  Jeb campaigns communications director 
SicTransit34,Sat Feb 27 19:54:55 IST 2016,RT  Why Electing Hillary ’16 Is More Important Than Electing Obama ’08  via  Impo…
SicTransit34,Sat Feb 27 19:50:51 IST 2016,RT  Donald Trump open up libel laws sue press  via  One const amendment…
SicTransit34,Sat Feb 27 19:48:11 IST 2016,RT  All anti-Trump ads funded elite GOP donors wonders stop guy whos running scourge elites
SicTransit34,Sat Feb 27 19:47:46 IST 2016,RT  Rubio tried approach Christie left message during NJ budget saying bright future service 
SicTransit34,Sat Feb 27 19:46:13 IST 2016,RT  Twitter handle squatting 
SicTransit34,Sat Feb 27 19:44:00 IST 2016,RT  Did know income taxes make   rich How Congress burdens  enriches  See 
SicTransit34,Sat Feb 27 19:42:48 IST 2016,RT  Christie wasn’t first mainstream Republican jump He won’t last 
SicTransit34,Sat Feb 27 19:39:00 IST 2016,RT  Team Jeb goes Christie Trump endorsement The fat kid gave bully  
SicTransit34,Sat Feb 27 08:47:30 IST 2016,RT  The Governing Cancer Our Time 
SicTransit34,Sat Feb 27 08:45:26 IST 2016,RT  I critic GEN Hayden hes sane voice season Trumpsanity   …
SicTransit34,Sat Feb 27 08:45:12 IST 2016,GenMhayden concerned President Trump governed Candidate Trump realtime
SicTransit34,Sat Feb 27 08:41:26 IST 2016,RT  First up PlayingtotheEdge author  former    Director  joined  RealTime https/…
SicTransit34,Sat Feb 27 08:31:47 IST 2016,RT  RealTime returns LIVE Friday      FranLebowitz 
SicTransit34,Sat Feb 27 08:23:39 IST 2016,Using religion excuse discriminate against people dislike Is great country 
SicTransit34,Sat Feb 27 07:51:09 IST 2016,When America last great When invaded Iraq When Reagan traded spare parts hostages When 299 servicemen died 1983 Beruit
SicTransit34,Sat Feb 27 07:41:05 IST 2016,True Trump espouses anti-Muslim bigotry endorsed  governor once denounced bigotry 
SicTransit34,Sat Feb 27 07:29:49 IST 2016,Strauss Bingo
SicTransit34,Sat Feb 27 07:27:51 IST 2016,If media outlet promises report stories pre-approved Trump give pass 
SicTransit34,Sat Feb 27 07:23:49 IST 2016,RT  Donald Trump declared war today free press 
SicTransit34,Sat Feb 27 07:14:09 IST 2016,Unlicensed untrained uninsured drivers moonlighting taxi drivers What POSSIBLY go wrong 
SicTransit34,Sat Feb 27 07:12:18 IST 2016,BREAKING Dow Chemical sends bill 835000000 estate Justice Scalia 
SicTransit34,Sat Feb 27 07:09:19 IST 2016,GovChristie You once stood up anti-Muslim bigotry Today endorsed bigot How long take abandon conscience
SicTransit34,Sat Feb 27 06:58:12 IST 2016,Did dog play role Isis  
SicTransit34,Sat Feb 27 06:56:55 IST 2016,Friends dont mans best friend watch  
SicTransit34,Sat Feb 27 06:49:00 IST 2016,Hey  Heres idea ensure victory 2016 And election future VoterSuppression 
SicTransit34,Sat Feb 27 06:14:14 IST 2016,jonathanalter Christie once spoke out against anti-Muslim bigotry endorses candidate whose campaign embraces anti-Muslim bigotry
SicTransit34,Sat Feb 27 06:11:20 IST 2016,RT  Trumpsters telling critics grow up Now thats rich  
SicTransit34,Sat Feb 27 06:06:02 IST 2016,True One few  governors call out anti-Muslim bigotry endorses  candidate espouses bigotry 
SicTransit34,Sat Feb 27 05:56:32 IST 2016,RT  Maybe Christie transportation secretary cause traffic problems states voted blue
SicTransit34,Sat Feb 27 05:53:20 IST 2016,Usually conservative pundit call media report proof liberalbiased media Not time 
SicTransit34,Sat Feb 27 05:47:21 IST 2016,When Trump becomes president maybe round up Demacraps send re-education camps 
SicTransit34,Sat Feb 27 05:41:17 IST 2016,RT  In person voter fraud statistically zero Stop lying Be better person 
SicTransit34,Sat Feb 27 05:40:29 IST 2016,RT  Former Marine advocated benefits comrades ended life  via  https…
SicTransit34,Sat Feb 27 05:39:14 IST 2016,RT  Good night Tour Scotland photo Massacre Glencoe Kelvingrove Art Gallery ancestry visit Glasgow https…
SicTransit34,Sat Feb 27 05:38:52 IST 2016,RT  SeaWorld admits employees posed animal rights activists spy protesters  
SicTransit34,Sat Feb 27 05:33:14 IST 2016,RT  Tour Scotland photograph The Morning Bannockburn Kelvingrove Art Gallery ancestry visit Glasgow 
SicTransit34,Sat Feb 27 05:27:58 IST 2016,DenmarkinUSA Did know Prince Georges county Maryland named Prince George Denmark1653-1708 husband UKs QueenAnne
SicTransit34,Sat Feb 27 05:21:49 IST 2016, Is diorama Smithsonian Museum American History Washington DC
SicTransit34,Sat Feb 27 05:18:53 IST 2016,RT  Unacceptable  FlintWaterCrisis   
SicTransit34,Sat Feb 27 05:13:34 IST 2016,RT  British tourists Brexit blues pound slumps  
SicTransit34,Sat Feb 27 05:13:07 IST 2016,RT  Britain’s great European divide really education class  Brexit 
SicTransit34,Sat Feb 27 05:09:23 IST 2016,SenateMajLdr Did then-Sen Biden call President George H W Bush  NOT fill SCOTUS vacancy 1992
SicTransit34,Sat Feb 27 05:05:59 IST 2016,RT  Chris Christie once fighter anti-Muslim bigotry endorses Donald Trump president  http…
SicTransit34,Sat Feb 27 05:03:52 IST 2016,Lawrence once gave Gov Christie standing ovation speaking out against anti-Muslim bigotry Today Christie endorsed Trump Go figure
