username,time,tweet
CourtPapersAK,Wed Mar 23 07:45:20 IST 2016, true What homegrown terrorists Should export What dowhat 
CourtPapersAK,Wed Mar 23 07:42:55 IST 2016,Sending love Brussels
CourtPapersAK,Mon Mar 21 13:04:17 IST 2016,Meredith Our Daughters Murder Hearbreaking Quest Truth J  via 
CourtPapersAK,Mon Mar 21 13:03:55 IST 2016,RT   
CourtPapersAK,Mon Mar 21 12:20:08 IST 2016,RT  Nos da God bless MeredithKercher Justice denied 
CourtPapersAK,Sun Mar 20 09:26:40 IST 2016,amandaknox  convicted twice murder 
CourtPapersAK,Sat Mar 19 23:42:27 IST 2016,RT  So close eyes Im still I havent left I never Stephanie Kercher   MeredithKercher RIP https…
CourtPapersAK,Sat Mar 19 23:42:06 IST 2016,RT   
CourtPapersAK,Sat Mar 19 11:49:27 IST 2016, wizard1999 word Lol
CourtPapersAK,Thu Mar 17 08:07:35 IST 2016,RT Aki 2011 interview phony amandaknox appeal acquittal politics  justice USA Italy meredithkercher 
CourtPapersAK,Thu Mar 17 08:03:32 IST 2016,RT Aki meredithkercher Bongiornos expert ProfVinci found amandaknoxs DNA murder room 
CourtPapersAK,Tue Mar 15 10:01:27 IST 2016,MeredithKercher Everything killers werent                             amandaknox 
CourtPapersAK,Tue Mar 15 00:59:26 IST 2016,RT   amandaknox served 3 years falsely accusing innocent man murder Stop trying distort truth Bs abo…
CourtPapersAK,Mon Mar 14 02:51:45 IST 2016,   Shes looker He worse  amandaknox  murder
CourtPapersAK,Mon Mar 14 02:45:02 IST 2016,RT  Blessings Kercher family MeredithKercher RIP 
CourtPapersAK,Mon Mar 14 02:44:57 IST 2016,RT  Meredith Our Daughters Murder Hearbreaking Quest Truth J  via 
CourtPapersAK,Mon Mar 14 02:28:24 IST 2016,Wang LucidHurricane We jump conclusions
CourtPapersAK,Mon Mar 14 02:27:04 IST 2016,  lol
CourtPapersAK,Sun Mar 13 09:42:11 IST 2016, Maybe Trump angry cos penis small NapoleonComplex
CourtPapersAK,Sun Mar 13 09:39:57 IST 2016, Can provide evidence
CourtPapersAK,Sun Mar 13 09:35:43 IST 2016,LucidHurricane How know BernieVoters
CourtPapersAK,Sun Mar 13 09:30:39 IST 2016,RT  I guess decided act theory  TrumpRally 
CourtPapersAK,Sun Mar 13 09:18:24 IST 2016, Yes Keep clean protestors  civildisobedience
CourtPapersAK,Sun Mar 13 07:39:20 IST 2016,RT  Nos da God bless MeredithKercher Justice denied 
CourtPapersAK,Sun Mar 13 07:30:47 IST 2016, He galvanizing America  DumpTrump
CourtPapersAK,Sun Mar 13 07:26:36 IST 2016,RT  Can DonaldTrump responsibility blame others thisweek  
CourtPapersAK,Sun Mar 13 07:20:59 IST 2016,DonaldTrump Thanks ensuring Bernie/Hillary win LOL Loser
CourtPapersAK,Sun Mar 13 07:18:12 IST 2016,I want fight good reason DumpTrump Be resolute fellow Americans
CourtPapersAK,Sun Mar 13 07:16:26 IST 2016,   He inspires hate We kick ass
CourtPapersAK,Sun Mar 13 07:14:05 IST 2016,   believe gullible sheep followers Enjoy Whistlerxo
CourtPapersAK,Sun Mar 13 07:06:41 IST 2016,RT  drumptheclown  getting shut down way go KC trumprally 
CourtPapersAK,Sun Mar 13 07:04:53 IST 2016, I love people standing up DumpTrump
CourtPapersAK,Sun Mar 13 07:03:28 IST 2016,RT  TrumpRally Hes stage hour spoken policy specifics Hes talking endlessly to…
CourtPapersAK,Sun Mar 13 07:03:13 IST 2016,RT  He literally Talking About Anything  TrumpRally
CourtPapersAK,Sun Mar 13 07:00:39 IST 2016, Restores faith We people
CourtPapersAK,Sun Mar 13 05:44:43 IST 2016, So true Take care
CourtPapersAK,Sun Mar 13 05:42:20 IST 2016,RT  If Chicago shut down  rest country TrumpRally MiGente  dumptrump 
CourtPapersAK,Sun Mar 13 05:41:49 IST 2016,RT Murray Heres video  acting punk ass bitch someone jumped stage Dayton 
CourtPapersAK,Sun Mar 13 05:40:43 IST 2016, Hey thanks Cant believe TrumpHateCircus I think ruining campaign What think
CourtPapersAK,Sun Mar 13 05:36:59 IST 2016,MarcoRubio Your expressed torment Trump honest appreciated thx
CourtPapersAK,Sun Mar 13 02:53:12 IST 2016,    lol 4 laying ground Respect
CourtPapersAK,Sun Mar 13 02:51:16 IST 2016,MeredithKercher  Remembered 
CourtPapersAK,Sun Mar 13 02:44:52 IST 2016,     guys drink much Mom always I cheap date errr
CourtPapersAK,Sun Mar 13 02:37:52 IST 2016, The good thing destroying campaign  DumpTrump
CourtPapersAK,Sun Mar 13 02:36:53 IST 2016,RT  RIP MeredithKercher InjusticeInItaly JusticeDenied Amandaknox RaffaeleSollecito 
CourtPapersAK,Sun Mar 13 00:33:35 IST 2016,    hah
CourtPapersAK,Sun Mar 13 00:30:44 IST 2016,    Congrats winning team
CourtPapersAK,Sun Mar 13 00:23:57 IST 2016,    laughing loud here x
